department,dep,title,ask
内科,神经科,女孩子会得肌营养不良吗,好友个花季少女，不能够走路，但是腿都动弹，经仔细检查得的是进行性肌营养不良，可是好友平常吃的都不错呀，现在两个手都还用的上力，但是跟没异常人比，力气好小，去市医院仔细检查，大夫给的建议是多锻练及推拿，可是好友的心脏的心肌不能获得锻练。您好可有女孩肌营养不良病发的？
内科,神经科,头晕心脏痛浑身无力是得了什么病,孩子头晕，心脏痛，发病一个月，近几天浑身无力，脖子以下疼痛站不起来
内科,神经科,成年人癫痫病症状有哪些表现特征,癫痫发作时，全身抽搐，口吐白沫，请问成人年成年人癫痫病症状有哪些表现
内科,神经科,走路时常打趔趄是什么病,最近不知道怎么回事睡不着，特别影响板式效率，朋友推荐去神经内科看看，请问走路时常打趔趄是什么病
内科,神经科,癫痫的病人日常注意什么啊？,我的儿子从小就得了癫痫这个病啊，我现在十分担心啊，因为经常都会发作现在了啊，我不知道怎么办啊，家里人都十分着急了啊，我儿子今年才刚刚出来工作啊，以后这样子怎么办了啊。很伤心啊。
内科,神经科,儿童面部神经炎如何治疗,"BR>确诊为面部神经炎，治疗一个月现在病情见好，但是效果不是很明显，想问专家，多长时间能彻底治好。能不能留下什么后遗症？后续治疗有哪些好的方案？目前一般情况:眉头能动，不是很灵活病史:以往的诊断和治疗经过及效果:见好。但不是很明显。现在还在吃维生素b1,配合针灸治疗其它:谢谢，专家指导！"
内科,神经科,慢性精神分裂症，是否需要长期吃药，可以完全康,无
内科,神经科,癫痫是怎么回事？怎么治疗？很担心？？,本人最近出现全身的抽搐，还有就是口吐白沫，去医院看下了，医生说是癫痫，这是什么疾病？怎么治疗才好？很担心？
内科,神经科,为什么患上癫痫病?,班里有个女生非常的优秀，长得很漂亮，而且多才多艺，不过有一点很遗憾的就是，她是个癫痫病患者，每当情绪紧张的时候她就会有复发的危险，一旦复发的时候完全就丧失了意识，很可怕，我们都很同情。
内科,神经科,脑血栓瘫痪出现腹泻治疗方法有哪些？,最近不知道怎么回事睡不着，特别影响板式效率，朋友推荐去神经内科看看，请问脑血栓瘫痪出现腹泻治疗方法有哪些？
内科,神经科,肚子饿，紧张的时候、手抖是什么问题？！,肚子饿，紧张的时候、手抖是什么问题？！肚子饿，紧张的时候、手抖是什么问题？！
内科,神经科,脊髓病变不知道这个病主要是什么引起的？,医生，最近老是据说脊髓病变这个病，不知晓这个病主要是什么引来的呢？脊髓病变会致使什么病呢？脊髓病变主要表现出在那些方面?怎么来治疗脊髓病变呢？谢谢医生的答覆。
内科,神经科,请问心脏神经关能症有哪些症状???,请问心脏神经关能症有哪些症状???
内科,神经科,肌萎缩侧索硬化症能不能康复,运动神经元病，肌萎缩侧索硬化症，连伽腿综合征，多发性腔隙性老梗死，原发性高血压3级。在乎的帮助：运动神经元病，肌萎缩侧索硬化症，连伽腿综合征，多发性腔隙性老梗死，原发性高血压3级。能不能治好?
内科,神经科,小孩突发事件属于羊癫疯吗,晚上突然之间两脚抽筋、面部发青、两眼发白、
内科,神经科,请问中药能治癫痫吗,我老公也是癫痫病患者 去年在一家老中医那看了 拿了药吃 结果有一年没有发作 医生说可以慢慢减药了 结果刚刚满了一年就发了 到现在都发了好几次了 以前吃西药的时候还没有这么发的厉害 那我想请问下 为什么去年一年没有发 现在在慢慢减药的时候发了 你们能给我个答案麽？
内科,神经科,癫痫药物会导致双眼复视吗,我患癫痫差不多快六年，一年前眼睛就开始有复视的现象，看东西眼睛都难受，一直吃的是奥卡西平和开普兰这两种药物。
内科,神经科,怎样预防失眠症的发生,我最近好像要失眠了，每天都很晚才睡觉，白天又要早早的起床，想问问怎样才能预防失眠症的发生?
内科,神经科,性别  男   五周岁  重症肌无力能治愈吧,发病时间 2013年五月至2014年五月     症状；眼睑下垂  全身无力 ； 就诊医院；聊城市人民医院  
内科,神经科,羊癫疯病治疗的中医疗法有哪些?,婆婆得了羊癫疯，时长感到不舒服，基本上2，3个月发病一会，每次都给我们这些做儿女的吓得够呛，不知道有没有什么好的解决方法，中医方面有治疗羊癫疯的好的方法吗？
内科,神经科,重症肌无力的眼睑下垂,"请问大夫:重症肌无力的眼睑下垂、复视包括因付鼻窦等疾病引起的眼睑下垂、复视吗？第一次问题补充:包括因付鼻窦等疾病引起的眼睑下垂、复视吗？
第二次问题补充:重症肌无力伴付鼻窦炎等疾病，怎样辨别眼睑下垂、复视原因？第三次问题补充:使用抗生素后可缓解！"
内科,神经科,怀孕快8个月时癫痫发作，手脚不能自觉，能吃什,我女朋友怀孕快8个月了，今天发作了几次后一直说自己没有知觉了，一直没力气手脚都没有自觉，请问现在可以吃什么药
内科,神经科,怎么控制癫痫病的发作,本人就是癫痫病患者，之前一直吃药控制病情的发作。但最精一段时间内，出现了左肢体不断的抽搐，口中还伴有怪叫等症状。这种情况应该要怎么治疗？哪种治疗方法比较好？
内科,神经科,进行性肌营养不良症最典型的症状？,进行性肌营养不良症最典型的症状？
内科,神经科,小腿肌肉萎缩的特征是什么,我妈妈平时很少活动，最近老是觉着肌肉酸痛，有时候还会再次出现抽经走没法路的情况，亲戚说这个情况是小腿肌肉萎缩了，您好这种病的特点表现是什么
内科,神经科,关于癫痫可以治愈吗,从小就有癫痫，一直没治好。时不时的就会犯病
内科,神经科,痫性发作是癫痫吗，有何区别,不知道为什么原因发生，短时间抽搐，但做了所有检查都正常，最近也发生拉几次，没有治疗，只是做了一些CT、神经造影术、脑电图也没有多大问题，经确诊是癫痫痫性发作，痫性发作是癫痫吗？它们的区别是那些？
内科,神经科,癫痫为什么如此难治呢？,我有癫痫病已经差不多十年了，在这十年里我一直都有坚持治疗，但是病情总是反反复复，我真得对这个病失去了信心，因为有这个病不仅让我花费了很多金钱，而且也让我失去了很多，最伤心是女友而我儿去，为什么这个病这么难治啊。
内科,神经科,小儿癫痫常见的症状是什么呢？,小儿癫痫常见的症状是什么呢？
内科,神经科,杜氏肌营养不良症状？,今天返乡下村里，听见说隔壁人家有个小孩子走路的时候腿脚无力，他家里人带他去看了村里的医生，医生也说不出个所以然，我在网上查了几下发觉有一种病叫杜氏肌营养不良症，我想问几下杜氏肌营养不良症状如何。
内科,神经科,长期额头发晕,额头里面发晕，偶尔瞬间感觉天旋地转，经常发生，特别是在阴天或者下午，还有睡眠不好的时候，严重时心情非常烦燥，用手拍打额头，曾经怀疑是心脏问题可是检查正常，那到底是什么原因导致的呢
内科,神经科,癫痫病吃药可以吗如何是好。,我想进行咨询一下，癫痫病该怎么办喝药又吃不起不知如何是好。我女儿才十五岁呢，但是我家里的条件实在是治不好她的病了。可有不需要吃太昂贵的药也可以治好的方法？拜托了期望能帮到我
内科,神经科,女性癫痫患者药物避孕如何？,我的婶婶是一位癫痫病患者，生有一个小孩，前年查出也患有癫痫，现在婶婶到了批二胎了，但是婶婶怕下一个孩子也会这样，所以想要避孕，采用药物避孕怎么样。
内科,神经科,癫痫病患者吃什么药物好？,朋友是一个癫痫患者，大学毕业一年多了，也不敢出去找工作，就怕在工作和路上犯病，现在连女朋友都不敢找。据说有一些药物对癫痫的发作有很好的治疗和控制作用。想多了解一些对癫痫病有用的药物。
内科,神经科,癫痫发作的原理是什么？,小表弟一直好好的，他都上小学了，人也是很聪明的，可是上一次，他感冒了后，就一直的发高烧了，两天才退下来的，这以后，他就变得不是很正常的了，在吃饭时，老是会不自觉的抽搐，嘴角还会往上扬的，姑姑不放心，就带他去做了检查了，说得了癫痫病了。
内科,神经科,经常头痛该咋办？有什么常用的办法治疗？,女性，31 ，就是经常头痛，吃头痛粉也无用，连益佰天麻头痛胶，都无多大用，只是不痛时也没事，就是痛时难受。时间已久。没有诊断过
内科,神经科,脑膜炎球菌多糖疫苗必打吗,"脑膜炎球菌多糖疫苗必打吗 曾经的治疗情况和效果：这个预防工作是不是必打断然不可的呀,不打会有什么在乎怎样的帮助：这个针打还是不打"
内科,神经科,癫痫病人能治好吗 ,隔壁那家的一个人年纪还蛮年轻的，最近突然得了癫痫了，看他的家人因为这个每天也过得特别不好，忙东忙西的，带着他去看医生，看到也很替他们担心啊。好好的一个人，病说来就来了。希望他快点被治好啊。
内科,神经科,怎么确认是不是癫痫?,我有个外甥今年已经不小了，身体非常的好，可是有的时候，经常跌倒，然后还有点抽动，这个症状过去后，就跟没事人是的，家里人都很忧心，有人说质疑是癫痫病，一据说这个病家人里都没心情吃晚饭了。
内科,神经科,我这症状是肋间神经痛吗？,10天前，左边腋窝外肩胛处开始有一痛点，后来慢慢发展到有时左侧胸部胸骨疼痛，有时左侧肋部疼痛，有时左后背部肩胛骨沿线疼痛，有时左侧后腰处胀痛，有时左手上臂有涨感，痛点经常变换不定，疼痛时有皮肤灼热感，疼痛属于阵发性，请问我这是肋间神经痛吗？
内科,神经科,肝性脑病能治好吗,肝性脑病能治好吗我的老人，他得了肝性脑病现在心里负担太重了，总是害怕我们多用了钱，总是说行了，说些不好听的话，请问这种病严重吗
内科,神经科,化脓性脑炎会用什么治疗方式,孩子最近一直低烧不退的，浑身上下没力气，每天总是昏昏欲睡，现在在医院理解仔细检查，：化脓性脑炎应当怎么办？
内科,神经科,想知道癫痫病能停药吗,无
内科,神经科,癫痫能致命吗,患有癫痫病有3年了
内科,神经科,癫痫患者生活中应该些注意什么？,你好，我的外甥女小时候有次发热治疗的不及时，以至于损伤了脑组织，患了癫痫症。经常会突然性的痉挛，据说这种病不是很容易痊愈的，全家人都是很着急。
内科,神经科,坐骨神经痛的病因是什么？,之前身体挺好的，也经常锻炼，上周却检查出患有坐骨神经痛
内科,神经科,女性难治性癫痫如何治疗?,我除了癫痫病已经很多年了，用了各种各样的方法都救治不好。现在都到了离婚生子的年龄，因为这个原因，我一直嫁不出去，家里人都比较忧心，。女性难治性癫痫如何治疗呢?
内科,神经科,右下肋骨附近经常抽筋般的疼，这是怎么回事,患者女，22岁，经常偶发性右下肋骨附近如抽搐拉扯般疼痛，病发没有指定时间，起身、转身、打喷嚏、弯腰都会出现此症状，时间持续半小时以上不定，疼时呼吸不可急促，不可大幅度活动否则会疼痛难止，伤上加伤，无就诊。
内科,神经科,脑出血后遗症引发的癫痫如何治疗好呢？,亲戚老张再次出现了脑出血的症状，捉紧送去医院，脑出血后遗症引起的癫痫怎么办？
内科,神经科,颈椎病如何锻炼恢复,"颈椎病如何锻炼恢复,请问如何保养．"
内科,神经科,手脚抽怎么治疗,手脚抽泣，时间大概几秒。发病时间过后自己不知道怎么回事。有时一天两次有时没有，大概有三年的病史。怎么办？
内科,神经科,该如何治疗继发性癫痫？,如何治疗继发性癫痫？在服药过程中癫痫怎么还会再次发生？2013年2月服药同年10月。今年5月26又再次发生了一寻问服药过程中再次发生了什么。
内科,神经科,语言表达障碍，请问医生，我这种病到底是什么病,从小语言障碍，说话时好时坏，易紧张，紧张时说话困难，说话时大脑右侧太阳穴血管时有疼痛。
内科,神经科,左手左脚无力什么原因,前年发病的，手脚无力，不抖，拳头都握不起，走起路都不像一个正常人走路的样子。去过重庆新桥医院，袁家岗轨道站那个医院。
内科,神经科,神经末梢炎吃什么药,我家人今年已经50岁了，但是最近一段时间总是会出现眩晕的症状，而且特别容易累，也干不了活，这是让家人挺担心的，所以这里特地的来咨询一下这种情况呢，请问神经末梢炎吃什么药
内科,神经科,癫痫病17年比较严重怎么医治,"我妈妈的癫痫病有了17年?现在比较严重?看了很多家癫痫病医院?但是都不怎么管用?吃了很多癫痫药?现在不知道怎么办了?我在网上看到这些中药?不知道对我妈妈管不管用《?天麻,琥珀,羚羊角,麝香,柴胡,桂枝,石菖蒲,青阳参,白僵蚕,钩藤,羊痫草,珍珠母,铁胆粉,龙戟草,甘草治疗》我想试试?就是我不知道买多少?怎么服药?病人发病时四肢抽取?牙齿会咬到舌头?两眼上斜?发病时间3分钟左右?发完病之后头很胀痛?全身无力"
内科,神经科,癫痫12年可以治愈吗？,我的孩子从7岁起临床诊断癫痫，长期服用丙戊酸钠片，德力多片，做过24小时脑电图，增强性核磁共振，均未发现病灶区。平均月犯病1-2次，大多在入睡后不久或凌晨起床前。表现为:呼吸不畅，神志不清，小便失禁，持续2-5分钟。大多5分钟后昏睡。而后清醒。现在已经17岁，变现为智力低下，不会基本数字计算，语言表达欠缺，脾气暴躁，有时无法控制情绪。中医也看了效果也不理想。请问专家向他这种情况能看好吗？
内科,神经科,如何预防妊娠合并癫痫的啊？,现在都是很多人都是得了什么妊娠合并癫痫的啊，我现在都是不知怎么回事的，我现在都是很想自己去预防一下子的啊，我现在都是不知道怎么去了解细节的啊，我现在都是想尽快去处理一下子的，我很无奈的。
内科,神经科,癫痫患者应如何吃蔬菜呢？,得了癫痫这个病，大家都知道怀孕之后的孕妇，基本上是不能吃什么药物的，但是，如果孕妇不小心，感染了流行性感冒，那么就非常的难过了。因为首先流行性感冒会对肚子里的胎儿造成影响，但是孕妇又不知道自己该不该吃药，想问下医生该怎么吃才是对的？
内科,神经科,青少年癫痫病的病因都是什么?,青少年癫痫病的病因都是什么?
内科,神经科,和被狗咬过没打针唾液接触会传染吗,一朋友老公被狗咬伤没打预防针，之后该朋友拿了我的杯子喝水，在我家上了洗手间，不知这些会不会间接传染给我们？
内科,神经科,宝宝总是拉稀最近如何治疗,宝宝大便化验没问题，但就是总是拉稀最近。
内科,神经科,午睡后起来头晕恶心,无
内科,神经科,面部一侧出现肌肉萎缩就是出现酒窝状凹陷怎么回,"岁
详细病情及咨询目的:患此病已有8年 就是右侧脸出现酒窝状凹陷 越来越深 无其他症状 如何治疗 期盼大师的回音 谢谢 
本次发病及持续的时间:8年了
辅助检查:做过面部神经检查 正常"
内科,神经科,癫痫病人吃狗肉好不好？,最近这一段时间特别的冷，我们几个好哥们准备去市里面一家特别好吃的狗肉店吃狗肉。这样也好暖和暖和身体，不过，我小的时候得过癫痫病，好像听说癫痫病人不能够吃狗肉。
内科,神经科,什么原因引起晕厥,"主要症状:今日下午肚疼,去卫生间,突然头晕,出汗,站立时,晕厥.发病时间:1-2分钟化验检查结果:肝功能,血脂,血糖正常"
内科,神经科,如何克服神经衰弱？,我在高中二年级患上神经衰弱，现在还是会有持续的紧张性头痛，如今我大二， 我感觉这病对我学习工作有影响，请问我应如何克服 ？
内科,神经科,如何缓解头胀头痛,我家人今年已经50岁了，但是最近一段时间总是会出现眩晕的症状，而且特别容易累，也干不了活，这是让家人挺担心的，所以这里特地的来咨询一下这种情况呢，请问如何缓解头胀头痛
内科,神经科,瘫痪适合手术治疗吗？,我爸5面前因为脑出血崩溃了，今年11月的时候我带他做仔细检查发觉了甲状腺肿瘤，也去过几家医院，有的建议手术，有的不建议，想问一下像我爸这样的瘫痪病人得了甲状腺肿瘤擅长手术医治吗？
内科,神经科,失眠在陌生的环境睡不着,偶尔失眠，在陌生的环境睡不着，最近一个星期三天失眠，但是失眠后的第二天就睡得很沉，昨天很累12点才入睡，结果失眠。平时10点半就入睡了。失眠有可能造成掉头发挺多。
内科,神经科,怎么样治疗脊髓病变,无
内科,神经科,硬化症是怎么回事,硬化症
内科,神经科,怎么才能确诊是神经根型颈椎病？,右眼睛时常有刚睡醒的感觉，有时候还又模糊的症状？有边头皮很难受（对外界刺激很敏感），右耳以下和脖子连接出的肌肉难受，有时会跳动几下，耳尖发麻，耳廓发硬，用手揉右边脖子右耳里好像打鼓一般？不知道事不是根性颈椎病引起的？排了X片看不出什么，做怎么检查可以看清楚啊，怎么才能检查出是否压迫了神经和血管？谢谢！
内科,神经科,胆红素脑病听力可逆吗,最近不知道怎么回事睡不着，特别影响板式效率，朋友推荐去神经内科看看，请问胆红素脑病听力可逆吗
内科,神经科,脑外伤导致的癫痫要注意些哪些 ,我是在去年发生过一次的事故的，现在的头部的伤还是有些的没有恢复太好的，自从那次事故以后，我就发生了两次的癫痫了，医生说这个是因为受伤而导致的，想来咨询一下。
内科,神经科,癫痫发作会如何,我经常的突然没有意识，自己没有感觉，犯病前没有任何前兆。不会突然的晕倒，也不会口吐白沫，就是突然的失神，像是走神了一样，一般持续几秒钟到十几秒钟，不会超过一分钟。
内科,神经科,治疗癫痫的医院在哪里？,医生，我嫂子上个月生了侄女，但是今天侄女突然手脚抽搐，口吐白沫，两个眼睛没意识，身边的亲戚都说是得了癫痫病，我们想尽快送孩子去医治，想进行咨询一下，治疗癫痫的医院哪一家最好，在哪里？
内科,神经科,病毒性脑炎引发的后遗症癫痫，吃药不见好，怎么,现在17岁，五岁半左右无故岀现腹痛治好后回家第二天岀现抽筋，吐白沫，后诊断为病毒性脑炎，治好后引发岀的后遗症诊断为癫痫，现吃卡马西平，丙戌酸钠，拉莫三嗉片，现吃药11年左右，没见好，现在大概一星期发作一次
内科,神经科,七岁儿童突发抽搐这是癫痫吗,"岁病情描述:患儿中午突然抽搐，眼发直，脸色发青，约几分钟左右，随后恢复正常。睡醒后叫头痛。以前从未发生过这种症状。请问是何病?曾经治疗情况和效果:这段时间在服用赖氨酸维B12颗粒,脑蛋白水解物口服液想得到怎样的帮助:请问患的是什么病?"
内科,神经科,视神经脊髓炎激素怎么减量,左眼发病视神经炎，未用激素冲击治疗，已失明，仅有光感
内科,神经科,请问什么是原发性癫痫疾病？,大概要发3次左右病发是全身抽经就晕过去了，但是不吐白沫，过一会醒了睡一觉就没事儿了，可以说醒了就好了，希望大家帮帮忙！可以治好吗？您好该用什么方法可以治好？?可以治好吗？您好该用什么方法可以治好？
内科,神经科,癫痫病服药后记忆力下降怎么办,记忆力全无（共3次）晕厥都是在刚开始时，后在服用奥卡西平，到现在未晕厥
内科,神经科,手抽搐是癫痫吗?,昨天下午天气特别热就约了几个伙伴去池塘钓鱼，没好一会儿就钓了一条，我一兴奋使劲拉鱼竿，一下子我右手就开始抽搐了，旁边的朋友都问我怎么了，我也知道是怎么回事，难道是癫痫吗。
内科,神经科,颞面叶颞顶叶大面积急性脑梗死怎么治疗？,患者:男，54岁，病发时间:一周主要症状:失去记忆不认识亲人不知晓自己的姓名复诊医院:医院在乎怎样的帮助：能不能够自愈？后遗症会怎样？
内科,神经科, 癫痫会死人吗 ,癫痫病真是吓死我了，又一次正好看到一个癫痫病人发作，口吐白沫太痛苦了，这样会不会因为抽搐而死亡啊？
内科,神经科,服药治癫痫能生孩子吗,癫痫病患者，男，27岁，患病十四年，共发作四次，四五年没有发作了，近期因为停药发作一次，现在一直在服药，服用丙戌酸钠和拉莫三秦，妻子能否怀孕，有影响吗？
内科,神经科,天气冷或喝酒后更病痛头痛咋办,我家人今年已经50岁了，但是最近一段时间总是会出现眩晕的症状，而且特别容易累，也干不了活，这是让家人挺担心的，所以这里特地的来咨询一下这种情况呢，请问天气冷或喝酒后更病痛头痛咋办
内科,神经科,坐骨神经挂什么科,我有坐骨神经痛，请问，应挂什么科？
内科,神经科,癫痫如何控制？？很担心？,我小孩今年17岁，就在三天前出现口吐白沫的情况，今天又出现新的问题，今天感觉更严重了，手和脚都出现痉挛的现象，不知道怎么接触他的痛苦，这种病怎么治疗呢？
内科,神经科,生牛痫怎么治疗,生牛痫应注意甚么
内科,神经科,癫痫病人在日常有什么注意事项,我男朋友最近他从外地出差回来，就感觉他人不对劲，有时候两眼翻白眼，还抽出，还咬牙，家人就带他去医院做检查，医生说是癫痫，现在正在治疗，，想知道要注意什么?
内科,神经科,腿上鸡肉痛,无
内科,神经科,急性播散性脑脊髓炎出院后怎样恢复？,性别，女；年龄，27岁，在2012年9月底我有感冒的症状并伴有低烧，当时一直做感冒治疗，到10月初时就感觉到厌食、无力，免强吃下东西也会呕吐，州医院的医生怀疑是胃病又做了胃镜，胃镜结果胃蠕动缓慢，又开了些胃药吃，回家后我发现我的上肢开始也无力了并解不出大小便，还出现了昏迷，后送到省人民医院经检查后认为是急性播散行脑脊髓炎。
内科,神经科,为什么会经常性的头痛,遇到事一着急就会出现神经性头痛，而且疼的挺厉害，持续时间半个小时到一个小时不定，这种症状持续了有3到4年 左右，请问这是什么性质的头痛，应该做什么样的检查或者吃什么药，
内科,神经科,经常头疼头晕是怎么回事,无
内科,神经科,癫痫病是不是相当于神经病？,我们公司有个被发现有癫痫病被开除了，他刚进来的时候是很正常的，大家都不知道，等他发作的时候大家才知道的。于是老板下决心不要他，他发作的时候口吐白沫确实有点吓人。
内科,神经科,如何让癫痫病人减少发病次数 ,我的朋友患有癫痫病，老是犯病，一犯病就晕倒，口吐白沫，浑身抽搐，真的好吓人，我也挺为他担心的，他的家人也在四处寻找治疗的好方法，但是都不近仁义。
内科,神经科,癫痫应该用什么方法治疗呢？,头好痛，好像要炸开了一样。白天的时候感觉精神有点恍惚，意识有时候有点模糊。有时候手脚会出现不断地抽搐，不知道怎么回事，我想我这情况是不是患上了癫痫了。癫痫应该用什么方法治疗呢？
内科,神经科,我怀疑男友患上神经病，怎么治疗,易怒，挑剔，总是自以为是，别人对不起他，
内科,神经科,癫痫病是由什么引起?,表弟和身体一直都不错的，性格也很开朗，可是前不久突然就昏倒过一次，而且当时情景有点渗人，突然倒地不省人事。
