department,dep,title,ask
内科,神经科,继发性癫痫怎么护理,健康进行咨询叙述：小的时候，家里修房子，我不听话，从楼上摔下来，当时头被摔破皮，当时没什么问题，可是后来去读书的时候突然就已经开始抽动，送去医院说是患了继发性癫痫。在乎怎样的协助：继发性癫痫的护理方法有哪些？
内科,神经科,癫痫患者的饮食禁忌都有哪些呢？,我还是看电视的时候，然后就开始抽搐了几下，时间比较短暂，去看了医生，结果说是得了癫痫。
内科,神经科,得了羊癫疯有救吗?,我家孩子今年6岁，确诊有羊癫疯，是被吓的得的这个病，现在时不时的发作，
内科,神经科,外伤癫痫这种病能康复吗,外伤癫痫能康复吗
内科,神经科,山西哪家医院治疗帕金森综合症最好？,昨天上网的时候偶然间看见一个二十来岁的年轻人有帕金森综合症这种疾病。
内科,神经科,得癫痫病要有什么方法治疗？,弟弟有癫痫病，我父母都是农民也没有什么文化，请问得了癫痫要怎办
内科,神经科,月经正常无排卵,想怀孕排卵试纸测得无排卵结果真没怀孕是怎么回事怎么治吃什么药
内科,神经科,咨询田教授,"田教授:你好！我是河南西峡的，我孩子九个月大，发病期间嘴唇发紫，目光呆滞，浑身出汗进入睡眠状态持续一两分钟左右自己又清醒了，六月十四号你给看过后确诊为癫痫病，你给开药吃过后拉肚子，拉清水一天拉四五次！,以前没有治疗过！。我想知道这是什么原因，是不是药物排斥？谢谢您！"
内科,神经科,尿床是不是一种病,最近不知道怎么回事睡不着，特别影响板式效率，朋友推荐去神经内科看看，请问尿床是不是一种病
内科,神经科,癫痫白天发作突然比以前严重了是什么原因呢？,　　癫痫白天发作突然比以前严重了?你好!我舍友得了癫痫病已经两年多了，一直在用药来控制自己的，但是现在不知道是怎么了，感觉白天发作的很严重，她说晕倒后觉得头痛，反胃想吐，现在突然比以前严重了。。你好!癫痫白天发作突然比以前严重了是什么原因呢?需要注意些什么呢?很担心她
内科,神经科,癫痫患者脚心发热面部纠结怎么办？,男，五十多岁。有癫痫病史。最近常感觉脚心发烫，面部苦恼。以前癫痫发作时只是晕倒，现在有四肢抽蓄的症状再次发生。心口疼痛但头脑清醒。曾经的救治情况和效果：一直服药在乎怎样的协助：想问问他现在拥有什么情况，是不是癫痫严重了需要有家属做什么，谢谢。
内科,神经科,结核性脑膜炎的概念，临床表现，用药，护理,结核性脑膜炎的概念，临床表现，用药，护理，病因及健康教育
内科,神经科,如何治愈癫痫病 ,我是零九年患上的癫痫病，到现在每年至少发作一次，严重的两次，每次发作都浑身抽搐，口吐白沫，发作持续时间不长，半小时左右。我想问一下，有没有治愈癫痫病的办法，怎么治。
内科,神经科,癫痫病人怎样预防感冒?,我10岁那年因脑外伤引来了癫痫病。现在已经9年了，还没去救治，后来复发的时候四肢抽旭，两眼上翻，还会突然的摔倒，好象有痰突然掩着的感觉，15分钟之后就感冒了
内科,神经科,腿筋伤着了很痛怎么办,1月14号腿筋疼痛没去医院在家吃药
内科,神经科,轻微癫痫对生育有影响吗,本人前段时间查出来有轻微癫痫，通过看医生后要吃三年的药，这个会影响结婚生育吗？
内科,神经科,瘨痫不吃药的话有没有问题,磁共振没问题，脑电图有问题，诊断是瘨痫，如果不吃药的话有没有问题啊，药的副作用大吗
内科,神经科,像我这种癫痫病可治愈吗？,从7岁多就患有此病，今年没吃过药，发病次数出现3次，发作时会昏过去，口吐白沫。
内科,神经科,有癫痫能不结婚,右边身体抽搐，眼睛上翻，口吐白沫
内科,神经科,小儿上吐下泄怎么回事,我的儿子一周3个月因为癫痫住院治疗住了半个月癫痫但是控制了可是上吐下泄现在出院了还是上吐下泄怎么办
内科,神经科,癫痫吃那些食物比较好？,邻居家的小弟弟从小就体弱多病，还时不时有些痴呆状。前几天家里人带他去医院检查，医生说他患有遗传性癫痫，这可吓坏了家里人，回到家，家长连班都不上了陪着他，但是不知道吃什么食物对他有好处。
内科,神经科,酒后脚发麻是怎么回事,一次酒后醒来发现脚底有些发麻 一直没有缓解 而只有把手臂申平后才感觉指尖发麻。应该怎么治疗才好？
内科,神经科,癫痫患者服用抗癫痫药物要注意哪些事项？,因为车祸，导致我的头部受创，在医院呆了两个多月才得以出院。出院后身体情况一直良好，没有什么后遗症。可是，一个星期前我突然全身抽搐，癫痫发作。医生给我开了一些药，请问有什么需要注意的？
内科,神经科,癫痫发作有哪些特点,癫痫的每一次发作对于患者及其家人来说都是一次身心上的折磨，我想了解癫痫发作的特点有哪些？
内科,神经科,脊椎动脉痉挛怎么治疗才会完全好,全部症状:，头晕发冷全身麻木次数多但时间少心烦有时头痛发病时间及原因:5年前，最近恶化治疗情况:喝了中药西药打过吊针想要得到的帮助:怎么治疗才会完全好
内科,神经科,氨基比林过敏和惊厥怎么区分两者的不同？,"十月二十三日午睡后发现小孩发热38度6就到乡村卫生院，医生给打了氨基比林后十分钟不到小孩口吐白沫，脸色发青，反白眼，送往镇医院打抢救针后又送往市医院晚19:00医院下病危（重）通知书
神志嗜睡，精神差，营养中等，面色口唇无发绀，双瞳孔等圆筹大，对光反射迟钝，口唇粘膜正常，颈项无强直，三凹征阴性，双肺呼吸音粗糙，未闻及罗音，心率132次/分，心律整齐，各辫膜区未闻及病理性杂音，全腹柔软'，无包块，肝脾肋下未触及，肠鸣音正常，四肢肌力，肌张正常，肢端温暖，布氏征阴性，克氏征阴性，巴氏征阴性，手足无皮疹，CRT约2s。
检查，骨髓检查正常，无脑炎，无癫痫各项检查都正常，请求专业人士给解答一下是药物过敏还是惊厥？。我要怎样才能追究医生的责任。医生说抢救孩子的主治医生是他的同学。不知是不是真的，病厉是不是真实"
内科,神经科,硬化症是否遗传，如果遗传要孩子时怎么避免,您好，我男性，33岁，单侧耳硬化症，影响听力。最近准备要小孩，在网上看耳硬化症有遗传倾向，想问下，是否遗传，如果遗传要孩子时怎么避免。谢谢！
内科,神经科,癫痫大发作的护理?,我儿子从小就患癫痫病，因为我们一直比较当心，忍耐救治，所以很长时间也没大的复发。最近可能会是读书太辛苦或者可能会是受了什么打击的原因，他在吃晚饭吃到一半儿时，突然癫痫病大发作，口吐白沫，不省人事。
内科,神经科,2003年做过右颞叶蛛网膜囊肿手术后一直服药,"癫痫大复发，1995年第一次复发，多数时间在月经期间睡眠中,2003年做过右颞叶蛛网膜囊肿手术后一直服药，至今没得到控制。能否预约王大夫您的，号做全面检查能否找您看病？针对病情您能否给一些治疗建议？……"
内科,神经科,癫痫多吃什么好,本人最近总是不受神经控制的做一些动作，有时候抽搐上有一分钟左右，去医院检查，医生说我这是患了癫痫了。这个病严重吗，我要怎么办才能治好呢。
内科,神经科,脑电图已经确诊癫痫还进一步检查诊断吗,孩子从2014.7.17晚上十点半发病，到现在将近一年时间了。每隔40天左右发病一次，吃德巴金和中药，到时症状没有好转。每次复发都在熟睡时。发病是睡觉时，症状为突然抽搐，眼有时睁着有时闭着，还有事一睁一睁的。口有粘膜，手脚有时发硬。或许一分钟之内时间有时还短。
内科,神经科,中国治共济失调医院哪个比较好啊？,什么是共济失调。
内科,神经科,有癫痫能上大学吗？,表弟今年要靠大学了，听说上大学前要体检合格才能去，因为我们这是小地方，上初中，高中都没怎么全面的体检的，因为表弟得癫痫已经好几年了，担心大学考上了，却因为体检而不让去。
内科,神经科,健身对治疗癫痫有效么？,我是一名先天性的癫痫患者，其实平时不发病的时候我跟正常人没什么区别，但是长期的不运动导致我的身体十分的差，所以我便想到要去健身，同时向想问问各位健身这种事对于我的癫痫是不是也有效？
内科,神经科,小脑共济失调能否做干细胞移植,最近不知道怎么回事睡不着，特别影响板式效率，朋友推荐去神经内科看看，请问小脑共济失调能否做干细胞移植
内科,神经科,一岁小孩补什么牌子的锌好,去查了下锌标准是62---110我们查出来是62.78会不会是因为这个不肯吃饭的。要是补锌补什么牌子的比较好呢。
内科,神经科,腰穿完事一天后头疼这是怎么了,最近不知道怎么回事睡不着，特别影响板式效率，朋友推荐去神经内科看看，请问腰穿完事一天后头疼这是怎么了
内科,神经科,视神经脊髓炎充血和肝功能异常怎么办,叔叔最近不知晓怎么回事身体很不舒服，医生说是视神经脊髓炎，还伴发高血压及肝功异常。所以我想问几下如何治疗呢？
内科,神经科,日常生活中护理癫痫有哪些原则？,我大哥去年开始就患上了癫痫了，后来就一直在家里了，都是妈妈在照顾她，最近我放假回来了，正好妈妈要去外面一趟，让我来照顾他，我想了解一下护理要有什么原则的。
内科,神经科,儿童癫痫及癫痫综合征是什么病,小侄女检查出来患有了婴儿及儿童期癫痫及癫痫综合征。一听是癫痫，这个不是大人才有的病吗。小孩子怎么会得呢。她得的这个婴儿及儿童期癫痫及癫痫综合征是种什么病呢。
内科,神经科,癫痫，脑子会突然意识不清楚怎么办,读书时曾在床上摔下来，自己一点不知道，几年前有次突然晕倒，听朋友说会流口水，眼反白，有时会突然脑子意识不清楚，有时拿着的杯子会掉地，有时看到一些景象好像似曾相识，然后脑子就会有一会儿的模糊，后来检查，说脑电图有异常，磁共振正常，诊断是癫痫。
内科,神经科,多发脑隙性脑梗死属于严重的病吗,我之前受外伤引发右侧额颞顶部蛛网膜下腔积血、右侧小脑幕、额颞顶硬膜下血肿、所以您好易发脑隙性脑梗死严重吗？
内科,神经科,癫痫有哪些危害，该如何治疗？,前段时间和朋友出去玩，在路上看到一个人突然两眼上翻，口唇青紫，双上肢抽动，口吐白沫。等下吐完之后一下他又好了，但是他不知道怎么发生了什么事情，这是不是癫痫的症状。
内科,神经科,怀孕吃母猪肉小孩子会病发吗?,我怀上一个月期间吃了母猪肉和羊肉，以后小孩子会不会病发？
内科,神经科,癫痫病人能不能生小孩,离婚1年患癫痫，有时候会抽动，口吐白沫。持继数十秒复发就会自然停止下来，踏入昏迷状态。您好医生癫痫病人可以生小孩吗？
内科,神经科,湛江耳硬化症的治疗医院哪家最好？,自己发觉听力逐渐减退，而且音准也出现问题，有时还伴有眩晕的症状。德牧到医院耳鼻喉科，通过系统的检查之后，被确诊为耳硬化症。
内科,神经科,请问帕金森吃什么好,听说有些食物对帕金森病人的病情能起到一定的好处，是不是这样的啊？我不知道吃什么食物对帕金森病人好，他们该吃点什么啊，谁知道能不能帮我解答一下，谢谢！
内科,神经科,羊角风不治会有什么影响?,羊角风不治会有什么干扰?患癫痫病，最近感觉头有晕晕的感觉，癫痫之前复发过一次就没复发过了，可以不救治吗
内科,神经科,服用多片佐匹克隆片怎么办,暂时没有症状，意识很清楚
内科,神经科,癫痫患者饮食上注意什么问题？,哥哥最近得了癫痫，每次发作起来都很恐怖，家里本来没啥钱，想在家吃药卡能不能治疗哥哥的癫痫，但是都没有什么作用，最后没办法就住院了。医生说癫痫患者对饮食的要求很高，所以我想了解下癫痫患者在饮食方面注意什么问题？
内科,神经科,中西医治疗癫痫哪个好呢？,妹妹家的孩子，因为去年的高烧惊厥引发了癫痫病，现在虽然犯病的次数不多，但是因为毕竟孩子太小，这样发病会很危险，以后会影响上幼儿园和上学的，所以想赶紧治疗一下，不知道中西医哪个能治疗的好一些。
内科,神经科,预防癫痫病发生应注意什么,在我的老家，有好几个朋友家的孩子都患有癫痫这种病的，我的心里其实也是有压力的，我要负责照顾好我家的宝宝，我也是一个很粗心的人，平时很不会照顾孩子，我很害怕自己家的宝宝也会患上癫痫这种病。
内科,神经科,有什么方法让癫痫症状不再出现？,跟老板去外地上班，可是就在签合同的时候我的癫痫病突然发了，瞬间全身抽动吐白沫然后我就什么都不知道了，事后老板很不高兴我觉着很丢人也离职了，有什么方法让癫痫症状不再再次出现？
内科,神经科,中药治好我的脑瘤,中药治好我的脑瘤
内科,神经科,癫痫应该要怎样治疗？会不会遗传？,得了癫痫有好多年了，现在一直都没有根治，不知道为什么，只要一停药的话，就会发作，换了几个医院都没有什么效果。我去年结婚了，我现在想要小孩，但是，又担心会把癫痫遗传给小孩。
内科,神经科,导致癫痫病发作的因素有哪些？,尖叫、面色青紫、尿失禁、舌咬伤、口吐白沫或血沫、瞳孔散大
内科,神经科,神经内科常见病有哪些呢,我最近会经常失眠，有时候晚上一两点才睡，但是第二天又要上班，七点多就起床，我没感觉有什么毛病，就是白天精神不好，我去诊所看了一下，医生要我去大医院的神经内科查病因，我只是感觉到我睡眠不好，其他没什么感觉。想得到怎样的帮助:神经内科常见病有哪些呢？
内科,神经科,蛛网膜炎这个病能根治吗现在很着急总是反复发作,蛛网膜炎这个病能根治吗现在很着急总是反复发作我该怎么办呢？
内科,神经科,18岁女孩三次昏倒伴有抽搐和白沫，是否是癫痫,女，18岁。以前没受过外伤，家族没有遗传。2011年12月19号晚第一次，2012年1月10号中午第二次，2月19号晚第三次。每次昏倒前会看到别人看不到的亮光，头和眼跟着光向一侧转，然后就没有了意识昏过去开始抽搐，面和手有些发紫脉搏很快，有白沫。半小时内自己会醒来。然后感头痛。医生没有下诊断也没有开药。是否需要找神经内科医生做进一步检查？看是否是癫痫？
内科,神经科,7岁时患过癫痫病现结婚可以要小孩吗 ,"我家侄子7岁时患过癫痫病,从医院治疗,主要症状是范困,爱睡觉，今年27岁,已结婚,想要小孩,请问医生这种病对将来小孩有影响吗？"
内科,神经科,癫痫病的遗传几率很大吗？,我公公得了癫痫病已经很长一段时间了，但是这么多年了经常吃药治疗，也没有什么大的效果，现在准备和老公要孩子了，很让我担心的救赎公公的癫痫会不会遗传给我的孩子。
内科,神经科,共济失调的起因是由于什么中国能治疗吗？,共济失调医院.走路不稳靠轮椅行动 吃饭喝水呛 说话不清楚 睡觉腿感觉特累靠西药来维持希望能得到彻底的解决。
内科,神经科,怀孕引起颅内静脉窦血栓，怎么办啊？,女，27岁、怀孕40天左右。出现意识障碍，癫痫，脑出血。在天坛医院住院25天后出院，出院半年期间一直按照医师的嘱托，控制饮食，定期查INR值，半年内去医院做了两次颅内核磁共振。医生说毫无改变。我也不知道该怎么办了。之后就放宽心。但是我好怕再次怀孕还遇到这种情况怎么办
内科,神经科,癫痫反复发作的危害,小时候就有了癫痫，不过当时吃了药，后来好了就没吃了。两年前突然癫痫发作，全身痉挛，意识丧失，面色青紫，口吐白沫，瞳孔扩大。从那以后癫痫就经常发作，请问这样危害有多大？
内科,神经科,哪里治女孩抽动症医院,我第一个女儿身体挺好的，而且我家里也没抽动症病史，但是我第二个女儿却患这种病，不知晓是不是平时饮食的原因，她平时比较喜欢吃零食，我想问问医生，哪里治女孩抽动症医院最好呢？
内科,神经科,末梢神经炎用哪些药效果好,手指麻麻30天
内科,神经科,羊癫疯也称为癫痫吗 ,曾经有过口吐白沫、抽搐的现象。那时候发作的时候是在村子里发病。村民都吓坏。村里的老人就是我得的是羊癫疯这种疾病。而去医院检查的时候，医生说是癫痫。
内科,神经科,患了癫痫可如何治疗吗 ,我以前癫痫过一次，但是我住院治疗以后就没有再犯病过了，我都不知道要怎么办才好了，我很担心我会不会治疗不好了呢，我现在突然犯病了，我都吓坏了我的孩子了，我不知道怎么面对他了，我心里压力很大。
内科,神经科,脑梗塞四肢瘫痪,我妈得了脑梗塞后遗症四肢瘫痪卧床不起请问大夫喝点什么汤
内科,神经科,癫痫病会导致脑干出血吗,左脑桥出血七毫升，意识清楚，能自己吞咽，四肢会动。
内科,神经科,癫痫发病时什么样的急救措施比较好？,我比较近很累很辛苦，晚上总是神经衰弱出冷汗，体质很弱，刚刚生完孩子，坐月子很不好，因为之前有诊断过有癫痫，在坐月子期间，癫痫病发时，什么样的抢救措施比较好？
内科,神经科,癫痫病怎样才能确诊呢,患者性别：女患者年龄：26癫痫病怎样才能确诊呢
内科,神经科,突然强烈的眩晕怎么回事？,下午突然强烈的眩晕，之前刚吃完一个没削皮的苹果，会不会是食物中毒，或是什么别的病症。多谢医生
内科,神经科,晚上失眠不能好好入睡,晚上失眠怎么办。不能好好入睡，迷迷糊糊睡不着
内科,神经科,神经性震颤怎么样治疗,主要症状:手颤头颤发病时间:5年化验检查结果:
内科,神经科,晚上突然抽搐昏迷不醒是什么情况,2012-12-16晚上突然抽搐昏迷不醒随即到嘉峪关人民医院重症监护病房
内科,神经科,五个月的宝宝拉肚子伴有白色泡沫是什么因素或病,以前有时拉稀有时不拉，一天五六次，近几天伴有白色泡沫，发病于2011年十一月份。
内科,神经科,癫痫症有三年了，一直效果不好。发作的比较频繁,我女儿得了三年了，每次发作是几分钟到几十分钟，发作时眼上翻，牙口紧，手脚抽搐，有时无意识说话，在天津儿童医院和北京海华医院看过，效果不是太好。几天发作一次有时半月以上。
内科,神经科,烟雾病怎么治,烟雾病这病怎么治
内科,神经科,羊角风有啥显著症状?,孩子9岁，在孩子5岁的时候在精神创伤和同伴戏耍掉下炕，脑袋着地，马上带到医院去救治，前几天突然晕厥到底，手脚抽搐，听亲戚说可能会是羊癫疯，正在仔细检查脑电图，哪些原因能引来的癫痫，脑袋受了伤会引来癫痫吗？
内科,神经科,癫痫患者生的宝宝会不会健康呢？,想知道癫痫患者生的宝宝会不会健康呢？
内科,神经科,后天性癫痫能否治愈,堂哥近几年的事业，婚姻都很好，家庭幸福美满，不过这两天他老是感觉身体不适，但也没有特别明显的症状，去医院检查医生说是患有癫痫病，可是我们家族没有癫痫病史，医生说要进一步检查病因。请问这种后天性癫痫能够治愈呢？
内科,神经科,请问什么是原发性癫痫疾病？,大概要发3次左右病发是全身抽经就晕过去了，但是不吐白沫，过一会醒了睡一觉就没事儿了，可以说醒了就好了，希望大家帮帮忙！可以治好吗？您好该用什么方法可以治好？?可以治好吗？您好该用什么方法可以治好？
内科,神经科,癫痫发作频繁有危险吗,我的癫痫病已经有将近十年了，以前吃药一直控制的很好，就最近不知道是不是因为我的睡眠不好有关，癫痫病又开始发作了，而且是越来越频繁了。
内科,神经科,脑梗死患者有什么忌口的吗,脑梗死这个病人如何饮食应该多注意些什么不能吃什么样的食物呢？
内科,神经科,癫痫急救措施有哪些?,弟弟家刚添了个白白胖胖的大小子，一家人真的是高兴坏了，可不知晓怎么了，孩子就是一个劲的哭怎么都哄不好！除了抽的现象再次出现，没办法带孩子去医院，说是癫痫，您好癫痫的抢救措施有哪些?后我们好应付。
内科,神经科,老年人头晕眼花恶心,不时头晕眼花恶心站不稳
内科,神经科,手术治疗脊髓空洞症要多久才能痊愈啊,在宜昌市中心人民医院就诊
内科,神经科,癫痫严重了如何处理？,今天生病了，下午开始就浑身发冷，拉肚子，呕吐，非常难受。在微信上发表了生病很难受的感受，没有多久好多朋友都发来信息慰问哦，真的让我很感动。
内科,神经科,脑梗病人做气管切开术要终身戴管吗,无
内科,神经科,这是特发性震颤吗？我有时头会突然抽动一下,这是特发性震颤吗？我有时头会突然抽动一下，某种姿势下会发生，但是之后保持那种姿势就没有抖动情况，手轻微抖动，我脑ct，血生化等都正常，我需要做哪些检查排除特发性震颤？
内科,神经科,儿童抽动症医院哪看的好,最近不知道怎么回事睡不着，特别影响板式效率，朋友推荐去神经内科看看，请问儿童抽动症医院哪看的好
内科,神经科,肺心脑病诊疗方案是什么？,医生您好！我父亲不幸患上了肺心脑病，我想要理解一下就是这个肺心脑病是不是特别严重啊？肺心脑病被缓解的可能性有多大呢？肺心脑病的最佳筛查方案是怎么样的？
内科,神经科,癫痫病用什么方法能够根除？,我乡下的表弟，由于一次干活时候意外摔倒，从而引发了癫痫，我们对这个病了解的很少，现在想在这里问你们一下，癫痫病用什么方法能够彻底治愈？
内科,神经科,治疗惊厥性癫痫，有什么好的药方吗?,"治疗惊厥性癫痫，有什么好的药方吗?
卡马西平片、中药、脑外伤后遗症"
内科,神经科,在太阳下晒了之后就会头很疼、很晕。请问是怎么,就是现在在太阳下晒了才会有这种现象。
内科,神经科,山西治疗帕金森哪个医院好,我的一个阿姨一向身体很好，不知道怎么回事前不久的时候突然身体开始莫名抖动，身体僵硬，走路也走不好了，去医院检查是帕金森病。
内科,神经科,脑膜炎预防针用打吗？,最近不知道怎么回事睡不着，特别影响板式效率，朋友推荐去神经内科看看，请问脑膜炎预防针用打吗？
内科,神经科,头经常不知不觉的晃动,我岳母现在经常不知不觉头晃动，年前就晃动现在比年前晃的明显了，请问大夫这是不是帕金身病前兆啊:
内科,神经科,原发性癲痫咋样进行控制,11岁发病，原发性，经脑电图检查无异常，身体正常，在当地医院治疗。以前治疗效果不好。从2007年服用西药丙戊酸钠，苯妥英钠，谷维素，维生素b1，有3年没发作了。吃药什么时间才能彻底完好。
内科,神经科,大脑左侧颞叶癫痫怎么治疗,大脑左侧颞叶癫痫，经常在不知情的情况下晕倒，右手在做饭的时间曾经被烧伤3次，有2次被诊断为深3度烧伤。这个周二还当着许多人的面晕倒一次，当时脸色发青，倒在别人的身上。
内科,神经科,神经干细胞移植可以让截瘫恢复到什么程度,，后来一直针灸和导平，有一年半了，现在恢复的情况只是能将就走几步路，腰硬不起来，
内科,神经科,总是高热惊厥会患上癫痫吗？,我孩子孩子6岁了，这几天高烧不退，两眼上翻，口唇发紫，口吐白沫，2分钟停止，送往医院查CT正常，白细胞8点几，请问以后会转为癫痫吗。会影响智力吗？
