department,dep,title,ask
内科,消化科,孩子肠胃炎可能是什么原因导致的？,小孩两岁十一个月，上周五可能会有肠胃炎，一整天基本上吃什么吐什么，有两天时间都让大人一直抱着，没精神。医院开了点药吃了后好了，之后慢慢的吃晚饭和精神也恢复正常。大便大概两三天一次，也正常。期间有两天晚上睡午觉前叫肚子疼，换给揉揉，揉一阵阵就睡着了。今天大便的时候大便表面有一片黑色，里面颜色是正常的，就表面薄薄一层是黑色的，麻烦医生帮推测几下可能会是什么原因。 
内科,消化科,有口臭需要怎么样治疗呢,过年的时候吃了太多的闹肚子的东西了，致使现在瞬间就闹肚子了，吃了点消炎药之后没那么严重了，但是还是一样口臭很厉害，早上下来一答话的时候，自己都能闻获得。
内科,消化科,怀孕36周 胃部反酸 呕吐酸水，希望确定病情,三天前，突然呕吐，胃里反酸，一开始吐食物，后来一直吐酸水，不能吃东西，不消化继续呕吐，没有食物就吐酸水。胃部食道烧灼，下咽咽喉疼痛，胸部疼痛。
内科,消化科,上腹胀满怎样治疗用什么药,最近几日总是上腹胀满这是什么病用什么?治疗
内科,消化科,反流性胃炎怎么治疗？,"后查是重度反流性胃炎,症状幽门水肿,胃体黄染,怎么治疗？"
内科,消化科,大便比较稀怎么治疗,病情描述:比较瘦，吃饭可以，大便基本上比较希，很少出现干的情况曾经治疗情况和效果:没治疗过，很多年了。想得到怎样的帮助:请告诉我，我该怎样调理一下。
内科,消化科,眼睛疼头疼要怎么治,开始眼睛疼，紧接着头疼，然后就吐，过10分钟左右就好啦。
内科,消化科,长期胃酸吃什么药比较好,"医生:我这两天有点胃酸,应吃什么药好?"
内科,消化科,胃部感觉酸痛是什么问题,医生，您好!胃不舒服快两年了，病情；现在肚子里的胃部区域不舒服，有时心里想到一些紧急事，就会一阵酸痛酸痛，肚里感觉有种东西想外溢一样（不是呕吐）感觉很闷一样，就是也不打嗝。但最近感觉不能吃饭，吃什么都没有胃口.医生，我这是怎么回事啊，医生您看了之后发到我的邮箱1625211381@qq.com
内科,消化科,什么病会导致男性右下腹疼,上月血检查尿液有炎症，前列腺肥大，最近做仰卧起坐时突然右下腹疼，抽痛。请问会是什么病？
内科,消化科,胃部不适胀气胃酸到嗓上这种情况应该怎么办,男58岁·胃部不适·胀气·胃酸到嗓上·10天前胃镜和病理萎缩性胃炎·肠化生这种情况应该怎么办？
内科,消化科,石家庄什么医院治疗慢性肠炎效果好那？,我哥哥患有慢性肠炎，还没有去医院治疗，他说先让我在网上问问，我们家里人都很着急，谢谢大家了。
内科,消化科,肠胃不好，身体虚弱怎么办？,无
内科,消化科,便秘怎么治疗才可以恢复正常,您好，医生，我最近便秘很厉害，便秘很严重，现在几乎都要四天左右才去一下厕所，便秘能不能治疗好啊，便秘到底应该如何处理呢，便秘怎么办才可以正常呢？
内科,消化科,肠胃不舒服，然后身体僵痛怎么办,医生，您好！我20岁，昨天我发现腰周围有点不适，感觉僵痛。昨天晚上发现手游浮肿，今天早上起来手浮肿依然存在，并且脸也有点浮肿。而且肚子周围依旧不舒服。我想知道这是为什么呢？是有什么疾病吗
内科,消化科,感冒会引起肠系膜淋巴结炎吗？,小孩感冒了，一个礼拜了都没见好，有一天烧到39度多
内科,消化科,拉稀屁眼疼怎么回事,受凉拉肚，一天拉八次，然后一拉屎屁股就特别疼，就是屁眼里面一厘米左右，疼到有屎不敢拉
内科,消化科,胆囊炎患者经常胀，打嗝要吃啥药,最近我是一直肚子疼，其实分不清是胃疼还是肚子。而且还发烧，咳嗽。疼痛有时候想上厕所。什么都上不出来。有时候疼痛不严重。晚上睡觉的时候也疼。这种请问胆囊炎患者经常胀，打嗝要吃啥药
内科,消化科,浅表性胃炎引起低烧怎么治,去年的过这一周又犯了在潍坊人民医院发烧37.1-37.2
内科,消化科,吃完饭出现胃酸是怎么回事,"每次吃完不好吸收的或油腻的食物甚至煮的不太烂的大米粥就会再次出现胃酸的症状,经常会再次出现.这种症状大约再次出现在吃完饭1小时左右,但症状再次出现时喝两杯热水就会缓解一下.吃完饭常常会出现胃酸是怎么回事？"
内科,消化科,专治幽门螺杆菌感染专科医院在哪里,发呕、口臭、厌食、肚痛(幽门螺旋杆菌)发病时间应该有3—4个月现在服用三联组合装药(一板有白色四块、绿色、黄色各二个)成人用的还是成人用量这种药长期复用会影响大脑有副作用。
内科,消化科,怎样治疗胃酸胃胀？,患者女，32岁，主要是饭后胃胀、积食不下，胸胁满闷，腹胀便秘，怎么治疗？
内科,消化科,为什么我吃香蕉会恶心呕吐,无
内科,消化科,得了胆囊下垂和胃下垂我想了解如何治疗？,得了胆囊弯曲和胃下垂我想了解和进行咨询下怎么治疗?1;病发时间;有4-5天了2:今天打B超医生说胆囊弯曲和胃下垂.曾经的治疗情况和效果：没遗传病史.无过敏?胆囊弯曲和胃下垂你可以给个治疗的建议吗?谢谢!
内科,消化科,婴儿腹痛能用脐贴吗,五十天的婴儿腹胀能用脐贴吗腹胀哭闹 曾经的治疗情况和效果：贴了一贴脐贴想得到怎样的帮助：还能用脐贴吗
内科,消化科,怎么治蛔虫病等等,"详细病情及咨询目的:我儿子现在10周岁,因遗传的关系一直有尿床的病.吃了很多药,也不见效.总算半年多不尿床了.但面色萎黄,身高比同龄人矮.挑食,易出汗,也容易感冒吹嗽.而且每年一到冬天脸上都有白点,俗话说是肚里有蛔虫,但吃了蛔虫药,还不见效.现在我想知道怎样驱蛔虫,还有怎样争对我儿子的情况吃一些健脾气虚的药?"
内科,消化科,大便干燥且呈颗粒状怎么办,"BR>大便干燥,呈颗粒状,有时带有血迹,一般每天排一次便.希望得到各位专家的解答.,"
内科,消化科,急性肠胃炎能不能吃鸡蛋羹,急性肠胃炎能吃鸡蛋羹吗
内科,消化科,排便前大出血怎么办,"医生:
   您好！
   我最近几天，排便前会流出很多血，颜色淡红。
我患有内痔，以前有便秘的毛病，请问该怎么治疗？"
内科,消化科,怎么样治疗口臭才好?,两三年前，主要是口干口苦，撒气很臭，不敢与人对话怎么办？
内科,消化科,急性肠胃炎的症状和治疗方法,急性肠胃炎是怎么引起的应该怎样预防？？？
内科,消化科,一个月大的婴儿消化不良怎么办..,无
内科,消化科,不知道我这病要怎样才治好？,肚子不能什么时候都会响叫，我也医院查过说没什么病，想请各位专家医师诊断一下，怎样治。谢谢！
内科,消化科,1度胃下垂怎么办,"胃下垂造成反流性食管炎,带胃托感觉改善很多,胃下垂造成便秘,失眠"
内科,消化科,胃胀胃隐痛、怎么办？,遇阴雨天胃胀胃隐痛气短呼吸困难病史已有二十年尤其在晚上喘不上来气每年夏天都犯病到秋天就好了还不能够吃凉东西
内科,消化科,胃上一阵阵发热是怎么回事?,无
内科,消化科,恶心 反胃,你好！我想问下，我老公这段时间总是说他喉咙痒有种想吐的感觉，请问是怎么回事
内科,消化科,什么疾病会导致便血,新发现、腹痛
内科,消化科,无痛胃镜结果准确,患者女，35岁，经常性胃痛。在莆田盛兴医院做过检查
内科,消化科,肠胃炎那个医院治疗的比较好？,我母亲患有慢性胃炎
内科,消化科,大便拉不出来适合吃啥好,本人34岁，最近不知道怎么回事总是感觉恶心想吐，胃部阴阴作痛有时有灼热反酸的症状，去医院看过好了一段时间后又开始犯了，请问大便拉不出来适合吃啥好
内科,消化科,大便异常该如何是好,那块深色的大便处 更加坚硬 变成球状 附在正常大便的一侧。肉眼看去 有的就像粘液干化了的状态，。 肚子不舒服 完闹肚子 有时肚脐紧右侧安痛曾经治疗情况和效果:05年到现在 做过3次肠镜 没发现问题  有痔疮。 最近检查肠镜已经有2年。想得到怎样的帮助:请问这是怎么回事呢？是不是肠子里有东西啊。
内科,消化科,结肠息肉和管状腺瘤有哪些区别,疼痛二零零九年
内科,消化科,我有慢性浅表性胃炎，能否吃豆角？吃豆角对,我有慢性浅表性胃炎，能否吃豆角？吃豆角对胃病有害处吗？
内科,消化科,胃窦息肉好治疗吗,胃镜发现胃窦息肉1厘米
内科,消化科,请问人一天几次大便为正常。如出现一天3-4次,无
内科,消化科,18岁女孩便秘该怎么治疗,便秘，2010开始得了便秘，肚子胀，四五天才上一次厕所，吃了好多药都没效果！
内科,消化科,小肠坏死性筋膜炎能活多久,小肠坏死性筋膜炎能活多久
内科,消化科,没胃口吃饭是什么原因？,我感觉自己这段时间一直都没胃口，有点缺肉，看见有好喝的就吃一点儿，如果没好喝的就基本上不动筷子，而且自己一直都感觉胸闷气躁，不太舒服，肚子闷闷的又没胃口吃晚饭是什么原因？
内科,消化科,慢性肠炎要怎么去治疗好一点那？,我本人男46岁，经常早上起来拉肚子，是不是慢性肠炎呀。
内科,消化科,小孩牙齿上有细细的裂纹是怎么回事啊！,"岁牙齿上从牙冠到牙龈部,在几颗牙齿上都有细细的裂纹,不止是什么因素或病因啊?"
内科,消化科,肝癌晚期黄疸一直往上升将不下来怎么办？,我爸爸是在08年7月检查出来是多发性的肝癌发现的时候有好几个小的肿瘤但是医生说不适合动手术所以做了介入我们前后做了3次第一次的效果很好但是后来别的地方又张了好些个现在我爸的主要症状是黄疸很高降不下来医生说是压迫性的黄疸我们现在每天是挂点滴和输血浆并且吃的一些进口的药品（因为先吃的国产的一点效果都不行）现在刚吃进口的也不知道有没有用爸爸现在越来越弱不想动一动就喘气并且牙龈和鼻孔是很频繁的出血也有疼痛
内科,消化科,胃痛吃点什么药好,2017年6月12日发病，胃痛，特别是晚上到天亮最痛。吃饱了一点也很痛。
内科,消化科,功能性消化不良怎么治？,不想吃饭
内科,消化科,小孩子口臭应该怎么办,我爷爷今年70岁了。身体一直都是很好的，最近不知晓怎么的，老是感冒发烧的，咳，吃了药也没转好，去医院仔细检查了，医生说有传染，质疑是得了肿瘤了，您好得了肿瘤的话怎么办啊？
内科,消化科,慢性浅表性胃炎伴糜烂如何治疗,胃镜诊断:慢性浅表性胃炎伴糜烂、十二指肠球部溃疡（0.3*0.3CM）HP检测报告:强阳性、检测值为000506
内科,消化科,胃溃疡当好了最近怎么胃口有点疼怎么办？,我有胃溃疡，当好了，最近怎么胃口有点疼，不能够高声答话，一高声胃口这就有东西往下，怎么回事？
内科,消化科,三天没排便，肚子胀如何处理？,本人34岁，最近不知道怎么回事总是感觉恶心想吐，胃部阴阴作痛有时有灼热反酸的症状，去医院看过好了一段时间后又开始犯了，请问三天没排便，肚子胀如何处理？
内科,消化科,消化不良和肠炎有什么区别,我家宝宝2周半了，这两天腹泻，次数每天一次，大便是黄色的特别稀。
内科,消化科,急性肠胃炎能够吃橙子吗,急性肠胃炎可以吃橙子吗
内科,消化科,胃酸反流性食管炎有哪些症状,朋友经常胃酸，有时候会有口腔刺痛感，咳去医院仔细检查是反流性食管炎和慢性胃炎，想问胃酸反流性食管炎有什么症状？
内科,消化科,引起胃下垂的原因是什么？,导致胃下垂的原因是什么？
内科,消化科,大便带血是什么症状,患者男，24岁。此次病情大便带微量血液，手纸擦拭后上有少量血迹，大便干燥时排便过程中会感到肛门有撕扯般疼痛，便后疼痛消失。持续时间大概2周，现在每天排便时手指都带少量血液。
内科,消化科,萎缩性胃炎有什么好的治疗方法,刚做了胃镜，做了活检，但报告还出来，十年前做了胆囊切除，两年前是胆汁反流，吃了达喜好了，现在是萎缩性胃炎，可有什么方法治好
内科,消化科,胃口隐痛，消化不良腹部感觉有气乱蹿怎么回事,"详细病情及咨询目的:胃口隐痛，消化不良腹部感觉有气乱蹿，但不排气，嗳气，肛门肿痛缀胀大便不成型，有酸腐味。感觉只要消化不好肛门就会肿痛缀胀，请问专家这是什么病？应用哪些药？
本次发病及持续的时间:大概有两周左右
病史:大概有一年多时好时坏
目前一般情况:现在很严重"
内科,消化科,胃里老是进水怎么办,无
内科,消化科,便秘和肚子胀气怎么缓解,便秘和肠胃气胀怎么办？我便秘好久了。几天前我去了厕所。今天我觉着胃胀了。我总是埋怨和打嗝。谁能告诉我如何摆平便秘和腹痛？最好快点。
内科,消化科,胃部疼痛，请指点迷津,"，大夫你好！
患者女51岁
大约十天左右晚上起床后突然打嗝，连续两晚，本人就按压胃，结果不打嗝了，但是一直隐约疼痛，就像吃了大蒜或韭菜之类的像是辣心的疼，这是怎么了"
内科,消化科,萎缩性胃炎，北京那个医院治疗的效果好,萎缩性胃炎
内科,消化科,糜烂性胃炎结肠炎内痔怎么办,糜烂性胃炎，结肠炎，内痔，喝药一个多月了，感觉没好完全，现在是继续吃还是去复查？吃的药有阿莫西林，克拉霉素，奥美拉唑和果胶泌，怎么办？
内科,消化科,吃多了腹泻如何治疗,2012年11月19日，腹泻发烧，吉林省农安县医院
内科,消化科,胃酸和胸口堵怎么办？,现在息肉已经没了，这段时间药没吃，现在有点胃酸和胸口堵，是怎么回事？
内科,消化科,幽门螺杆菌能治愈吗,幽门螺杆菌能治疗好吗
内科,消化科,成年人两三天一大便正常吗?,无
内科,消化科,产后为什么不大便,本人34岁，最近不知道怎么回事总是感觉恶心想吐，胃部阴阴作痛有时有灼热反酸的症状，去医院看过好了一段时间后又开始犯了，请问产后为什么不大便
内科,消化科,脚心手心发烧怎么办,易出汗，脚心手心发烧，胃涨，
内科,消化科,胃酸便秘有时吐出后比较舒服是怎么回事？,能吃不消化，胃酸、便秘，有时吐出后比较舒服，但不吃也痛，胃疼、胃冷，是怎么会死？
内科,消化科,做了食管裂孔疝修补术术后怎么修养？,本人刚刚做完食管裂孔疝修补术，现在还在医院，由护士帮帮忙照料着。过几天就要回家调养。因为是肠道方面的手术，想着饮食方面需要有留意。您好有什么是不能够吃的？
内科,消化科,便秘带血丝是什么原因,老婆的阿姨最近老是便秘，今天上厕所发现自己的大便含有许多血丝，阿姨很忧心的，您好便秘带血丝是怎么回事?
内科,消化科,肚子胀气肠子痛怎么办,无
内科,消化科,我的胃溃疡症状严重吗,我以前就有轻度胃溃疡，近期加重了，一吃东西胃就疼，尤其不敢吃米饭，而且，不吃东西也一点都不会觉得饿，吃一点就撑得慌，尤其晚上，吃东西会憋得喘不过起来，睡不着觉，这是什么症状，严重吗？我已经很久都没吃米饭了，不敢吃，怎么办呢？有时候早晨吃点米，会疼一上午，我是大学学生，总这样很耽误学习，求解决办法
内科,消化科,吃东西吃的肚子疼怎么办,无
内科,消化科,先天性肥厚性幽门梗阻该怎么办呢？,我昨天去医院做了个全面的仔细检查，今天来医院拿结果，结果出的了，然后体现我有先天性肥厚性幽门梗阻，这是什么意思，严重吗？先天性肥厚性幽门梗阻该怎么办？
内科,消化科,我有胃病可以吃红枣吗,无
内科,消化科,求教慢性浅表性胃炎是怎么回事,这几天去体检发现自己可能患有胃炎，但是并没有其他表现特征，想问一下慢性浅表性胃炎是怎么回事？
内科,消化科,慢性非萎缩性胃炎如何改善,约5年时间，大便成型差，一天解3-4次，腹胀
内科,消化科,胃造漏手术要多少钱,无
内科,消化科,有没有不用插管的胃镜检查,胃部和食道部分不舒服近一个月了，想做一下胃镜检查，请问医师有没有不用插管的胃镜检查，谢谢
内科,消化科,胃炎可不可以喝奶粉,经常出现胃部消化不良的情况，有的时候吃完饭还觉着胃部疼痛，后来到医院去做了仔细检查，医生说是拥有胃炎，再次出现胃炎之后能喝奶粉吗？
内科,消化科,非萎缩性胃炎的饮食规则,最近肚子不太舒服，去医院做了胃镜后发觉是非萎缩性胃炎，想知道非萎缩性胃炎吃什么比较好？
内科,消化科,食道炎能治愈吗,无
内科,消化科,幽门螺杆菌病好治疗吗,患者女，23岁，有一年了吃什么都没味道··什么也不想吃··一天只吃一顿饭！在我们县医院仔细检查结果是幽门螺杆菌病14C-UBTDPM=740HP（+），好治疗吗？
内科,消化科,胃炎使用什么药物比较好？,糜烂性胃炎总吃不饱总饿气血不足。
内科,消化科,痢疾治疗手段和方法,本人34岁，最近不知道怎么回事总是感觉恶心想吐，胃部阴阴作痛有时有灼热反酸的症状，去医院看过好了一段时间后又开始犯了，请问痢疾治疗手段和方法
内科,消化科,胃痉挛病发怎么治疗,胃里忽冷忽热急剧痛疼
内科,消化科,新生儿幽门梗阻的症状有哪些,我女儿刚出生几天，在喝奶的时候总是会干呕远不止，有时看她还会精神萎靡不振的样子，医生说我孩子可能会是得了新生儿幽门梗阻，这个病的症状有？
内科,消化科,怀孕三个月了胃堵得慌吃什么东西都吐怎么办,无
内科,消化科,胃溃疡5年了，缓解又反复发作怎么办,我应该是年轻的时候可能会酒喝多了，本来肠胃就不好，后来又被确诊是胃溃疡现在有五年了，治好又反反复复复发？现在每年都要受一次复发的痛苦，委实是想求个长久的办法。讨教好的方法？
内科,消化科,"吃不下饭,也不饿,肾的位置也比较疼是怎么了",无
内科,消化科,胃病疼痛呕吐怎么办,以前就有胃病，最近已经疼有一个月了，一阵一阵的疼，严重时呕吐
内科,消化科,孩子出现厌食要补充些什么呢,我们家孩子自从上了幼儿园以后我也不知道是怎么回事就经常性的出现了偏食厌食的习惯，请问孩子出现厌食要补充些什么呢？
内科,消化科,治疗老年人便秘的特效药,BR>患便秘4－5年，经县医院检查为便秘。有什么特效药。本次发病及持续的时间:4－5年。目前一般情况:便秘病史:70岁以后经常便秘以往的诊断和治疗经过及效果:诊断结果为便秘，用过麻仁润肠丸、麻仁丸、芦荟胶囊等。中医中药辅助检查:无其它:无
内科,消化科,胃胀疼该怎么处理好？,胃有点胀疼用手摁隐隐约约疼。
内科,消化科,79岁老人肚子胀吃什么,"晚上感觉肚子胀气，还会喘不上气。 

"
内科,消化科,小腹痛奶涨是怀孕了吗,无
内科,消化科,石家庄哪个医院治疗慢性肠炎有效果,我肠胃一直不是很好，但是前几天吃了冰箱里的剩菜，半夜就开始拉肚子，还吐，勉强撑到早上去输液去了，输了几天是好了，但是现在只要吃到不如意的饭，就开始拉肚子。
内科,消化科,你好，我婆婆便秘一个星期了，不吃药，不去医院,无
内科,消化科,今天妈妈做了内镜手术切除胃息肉，需要住院,今天妈妈做了内镜手术切除胃息肉，需要住院吗？术后饮食要吃什么，应注意什么？
内科,消化科,吃烤红薯会出现便秘吗,我特别讨厌吃烤红薯，有的时候在街上碰上都会买，但我妈每次都不让我吃，说烤红薯会让人便秘，所以您好下烤红薯真的会让人便秘吗？
内科,消化科,拉肚子怎么办才好,"病情描述:我拉肚子18天了.化验大便和血都没问题,吃了几种药都解决不了问题.现在该怎么办?曾经治疗情况和效果:效果不明显想得到怎样的帮助:吃什么药?如何治疗?"
内科,消化科,有口臭怎么治疗才好,我一年以前有十二指肠溃疡慢性胃炎。现在基本都好了，可这段时间经常有口臭的。而且舌头好白的，但是吃了好些药了。还是有口臭的。除了就是舌头白就一定口臭吗？
内科,消化科,检查未孕想吐怎么回事?,"最近几天,常觉得想吐,但检查未孕,这是为什么?"
内科,消化科,胃炎不吃药能好吗?,无
内科,消化科,肚子疼拉稀是什么病,本人34岁，最近不知道怎么回事总是感觉恶心想吐，胃部阴阴作痛有时有灼热反酸的症状，去医院看过好了一段时间后又开始犯了，请问肚子疼拉稀是什么病
内科,消化科,口苦胃胀脚无力吃饭不香怎么回事,"患者男,42岁,去年12月患慢性浅表性胃窦炎,此次病情;清晨起来口苦,十多分钟后就不苦了,胃有点胀,睡觉梦多,脚无力,吃饭不香,"
内科,消化科,胃溃疡反反复复求治疗？,本人34岁，最近不知道怎么回事总是感觉恶心想吐，胃部阴阴作痛有时有灼热反酸的症状，去医院看过好了一段时间后又开始犯了，请问胃溃疡反反复复求治疗？
内科,消化科,为什么宝宝四五天不大便,本人34岁，最近不知道怎么回事总是感觉恶心想吐，胃部阴阴作痛有时有灼热反酸的症状，去医院看过好了一段时间后又开始犯了，请问为什么宝宝四五天不大便
内科,消化科,左下腹部疼痛应该查什么,无
内科,消化科,胃痛会是浅表性胃炎吗,胃痛，心潮现在做的胃镜说是浅表性胃炎，但是发觉食管下段近齿状线有凸起的白片，黏膜发白。不只是什么问题？紧要吗？曾经的治疗情况和效果：吃的奥美拉挫不见症状好在乎怎样的帮助：想问问要不要紧是什么病？
内科,消化科,胃胀和嗳气,有十多年的病史，火烧心，胃胀、嗳气、口干、不通气。闻烟味和生气时嗳气特严重。饭后无其它症状，不吐不拉。
内科,消化科,肚子气涨怎么回事,"
最近不知道怎么回事，消化一直不怎好，吃东西很久也不消化而且还有胀气，吃了要没有什么明显效果，每天都特难受，请问肚子气涨怎么回事"
内科,消化科,胃寒哪种东西能养胃,"女　２３　学生
胃寒杂办？这两天天冷，胃就疼
哪种东西能养胃呀？
最好是什么茶之类的
比较方便"
内科,消化科,胃病可以做磁共振检查吗？,"病史有20十多年,胃镜做了10年,确珍胃窦炎,12脂肠球部溃疡.可以做核磁共振吗？"
内科,消化科,胃胀打嗝便秘,"男50岁，全身检查正常，胃镜检查为浅表性胃炎。
主要症状胃里总有大量气体，经常打嗝。食少便秘，不吐酸水。"
内科,消化科,胃炎呕吐..,胃炎呕吐
内科,消化科,胃胀胃痛要怎么办？,胸口有东西堵上背后肋骨里面一呼息痛胃胀痛呼息有点困难
内科,消化科,呛咳会导致食管炎吗？,本人34岁，最近不知道怎么回事总是感觉恶心想吐，胃部阴阴作痛有时有灼热反酸的症状，去医院看过好了一段时间后又开始犯了，请问呛咳会导致食管炎吗？
内科,消化科,胃炎便秘引起的口臭如何能根治?,"某些胃肠疾病 如消化不良、萎缩性胃炎、胃溃疡、胃下垂、便秘等。由于这些疾病常会导致食物在胃内滞留时间过长，引起胃肠之气上行而产生口臭。 
象这样的情况又该如何根治呢? 该服用哪些药物?"
内科,消化科,"大便时肛门有出血,肚子不痛,有便秘感觉是怎么","本次发病及持续的时间:几天前晚上出现一次,第二天正常.今天又出现排便时有血."
内科,消化科,一岁七个月宝宝伤食还能喝奶粉吗,一岁七个月宝宝伤食还能喝奶粉吗一岁七个月宝宝伤食还能喝奶粉吗
内科,消化科,怎样吃饭可以缓解消化内科疾病,一直消化不好
内科,消化科,不想吃饭是不是厌食,没胃口  恶心  吐
内科,消化科,肋骨下腹部两侧偶尔痛是什么原因引起的,三周以前肋骨下腹部两侧偶尔有痛；腹胀，小腹也胀痛。腰肌有时也点痛。大便不成性
内科,消化科,胃炎食道炎怎么办,了，感觉症状清了，但还是有时候会腹痛，您好是什么原因？我这病严重吗？还需要有怎样治疗？奥美拉唑、阿莫西林胶囊得吃多长时间？
