department,dep,title,ask
内科,消化科,更昔洛韦可以治疗肠胃炎和肠系膜淋巴结炎吗,无
内科,消化科,"大便带血还有小血块,过两天又沒有了","这几天才发现,身体无其它症状,没有就医"
内科,消化科,怎么解决消化不良,"平时饭菜中哪些东西吃多了会导致消化不良？哪些东西吃了对肠胃好？
哪些东西吃了容易长胖？哪些东西吃了有消耗脂肪的效果？"
内科,消化科,三天前发过39度高烧现已好，但今天肛门出血，,患者，女，44岁今天小便时发现肛门出了好多血
内科,消化科,舌苔发白有异味该如何缓解,病情描述:24岁男性舌苔发白，有异味，表面有一层白色粘粘很烦恼。不知道我这是属于什么情况啊老师！能治吗？口气是因为这个引起的吗？麻烦指导万分感谢!曾经治疗情况和效果:工作忙，一直未去治疗特请教想得到怎样的帮助:能否治疗，最好能告诉我怎么样治疗。
内科,消化科,胃溃疡复发怎么办,你好，我老公曾经有过胃溃疡病史，进行过治疗，但是之后还是会偶有胃部不适；最近更是严重，一到晚上11-12点就开始胃疼，有时候还会伴有呕吐，把晚上所吃的食物都吐出来，近来体重急剧下降，身体也感觉很虚、乏力、有时还伴有头晕，因为都没胃口吃饭，所以他最近有常吃甘蔗跟橘子，这个会有关系吗？
内科,消化科,胃溃疡癌变机率大吗？谢谢,无
内科,消化科,吃什么东西都吐是怎么了,吃什么东西都吐是怎么回到
内科,消化科,怎么预防急性肠胃炎？,20岁，经常拉肚子。一不小心吃了什么东西就会肚子不舒服。平常难免会吃许多食物，怎样才能预防工作肠胃炎呢?
内科,消化科,下腹有液体流动感用什么药治疗,"医生:
   您好！我做过通液手术，手术经过:经过液体10ML后开始有轻阻力，且双侧下腹有液体流动感，输入20ML后迫流3ML。我的问题严重吗？还需要用什么药，或者再做通液。"
内科,消化科,胃不舒服如何解决,本人34岁，最近不知道怎么回事总是感觉恶心想吐，胃部阴阴作痛有时有灼热反酸的症状，去医院看过好了一段时间后又开始犯了，请问胃不舒服如何解决
内科,消化科,半夜胃痛怎么护理呢？,"您好！我在工厂工作，经常中午在饭堂吃得不好，所以晚餐回去后会吃得较午餐多一点。并且，我下班晚、家离工厂较远，一般回家吃完后我就累得早睡。常常到夜里十二点多醒来腹部痛，我就喝苹果醋，喝后过半个小时会好。有时就算我只吃一点面条都会痛。我从小就消化能力差，但我不知道这样频繁地腹胀痛是否是什么异常的病症。有什么养生之道有利于改善自己的消化能力？
另，全身检查是否合适二十多岁的年轻人，全身检查"
内科,消化科,胃里总是不舒服有点恶心怎么办,我每天总是有一点点的恶心，首先声明哦，我可不是怀孕了哦，我不知怎么回事呢，喝口水就会好的，不会想吐的呢，就是有一点点的恶心呢，请医生能提示我一下吗？这会是哪方面的问题呢？谢谢哦．
内科,消化科,男性腹痛怎么回事,"就是腹部疼 精神因疼就不好 打隔就疼 伸直腰就疼
有两天咯 星期六吃饱去打篮球就开始咯"
内科,消化科,大便带血是得了痔疮这种病吗,这段时间我每次去厕所的时候大便都是有血丝，而且身体也是非常的疼痛难忍，我是非常忧心自己的身体情况，想知道这是不是痔疮？
内科,消化科,成人消化不良性腹泻用药,了，但大便化验一切正常。
内科,消化科,医生我每到秋天就会犯胃病怎么办？,胃胀，嗳气，隐约有胃疼，右侧肋骨里面有时也会有疼痛感，是不是慢性胃炎？需要有怎么治疗呢？
内科,消化科,放射性食道溃疡能不能够病变？,2010年9月，附属医院诊断为是食道癌，作放射治疗。后再次出现放射性食道溃疡，食道狭窄，并再次出现疼痛。曾经的治疗情况和效果：放射治疗后效果良好?长时间不能够全愈是不是还会再次病发
内科,消化科,胃病用什么药治疗?,做胃镜仔细检查结果是:1胃底溃疡；2慢性浅表性胃炎。我有乙肝，ASP阳性做定量为30。听人讲胃药对肝副作用很大，我该如何用药？
内科,消化科,导致便秘的原因有哪些,引发便秘的原因是那些
内科,消化科,口臭放屁有两年了怎么办？,口臭，胡说八道，有两年了，问几下吃点什么药，要留意哪些？
内科,消化科,急性盲肠炎和慢性盲肠炎有什么区别,无
内科,消化科,功能性消化不良如何治？,本人今年30岁，患胃病十多年，两年前胃镜仔细检查返流性食管炎，慢性浅表性胃炎，去年犯病胃镜仔细检查胆汁返流，今年又犯病上星期胃镜仔细检查慢性浅表性胃炎，症状无反酸就痛得嗳气得舒服点但一会又痛一吃东西就痛，只有等很长时间饿了才舒坦点医生说是功能性消化不良（本人开过胆结石）曾经的治疗情况和效果：配了胃舒颗粒莫沙必利和个增进胆汁排泄和消化酶的药服药一周无效再去看医生换了药莫沙必利奥美拉唑肠溶胶囊和气滞胃痛颗粒好象效果也不大，?我这病该这么治疗呢怎么都没效果呢谢谢！
内科,消化科,胃息肉手术7天敢吃米饭吗,"
最近不知道怎么回事，消化一直不怎好，吃东西很久也不消化而且还有胀气，吃了要没有什么明显效果，每天都特难受，请问胃息肉手术7天敢吃米饭吗"
内科,消化科,胃炎能不能吃花生米,胃一直不舒服，前段时间在医院做仔细检查后说我是胃炎，平时饮食也是许多东西不敢吃，现在有的说花生米也不能够吃，得了胃炎到底能不能吃花生米？
内科,消化科,消化不良怎么处理,近大半年早上都拉肚子，人也消瘦，只剩七十多斤，不能沾油腻，医院检查都没大问题，胃肠检查未见大问题，人体质很弱，有时都不能久站，想往下蹲。 
内科,消化科,胃胀怎么办才能完全治愈呢？,胃胀，偶然有点疼不经常，饭后胀痛，没有反酸症状，近几天有点胃热，已有半年多。
内科,消化科,腹部两侧疼痛是怎么了,无
内科,消化科,天天打饱嗝胃胀气呼吸急促怎么办？,好长时间·胃吃了东西总不消化。小肚子成天胀胀的腰有点酸，怎么办？
内科,消化科,为什么会有便血的情况,想问一下，为什么这段时间会尿频？况且有时会便血？是不是身体太热气了？尿色很浓很黄！想知道应该从哪方面治？
内科,消化科,便秘用艾灸是灸什么位置,据说艾灸可以救治便秘，最近我饮水太少再次出现了严重的便秘现象，这使我非常苦恼，这种治疗方法让我看见期望，但是我想理解几下艾灸到底是灸的什么部位，好让我有个底。
内科,消化科,直肠炎会有哪些明显的症状表现呢？,您好，我想问一下直肠炎会有什么明显的症状和表现呢？是不是会有腹痛的表现。
内科,消化科,想了解腹泻如何治疗,腹泻屙水状便三天整
内科,消化科,怎么喝蜂蜜水可以治便秘,最近我是一直肚子疼，其实分不清是胃疼还是肚子。而且还发烧，咳嗽。疼痛有时候想上厕所。什么都上不出来。有时候疼痛不严重。晚上睡觉的时候也疼。这种请问怎么喝蜂蜜水可以治便秘
内科,消化科,胃溃疡可以吃面条吗,胃溃疡可以吃面条吗
内科,消化科,幽门螺旋杆菌成阳性是什么意思,无
内科,消化科,咨询孩子挑食厌食是怎么回事,我的宝宝经常不好好吃饭，总是挑食厌食，不知道他到底想吃什么饭量也很小，真的不知道怎么办？请教医生帮助，希望得到您的答复。
内科,消化科,大便常规检查有隐血是怎么回事,大便常规检查有隐血是什么原因
内科,消化科,十二指肠溃疡又有肠炎该什么治啊?,"我有十二指肠溃疡又有肠炎(大便有粘液,有时早上两趟厕所)还有痔疮(大便有时血红色)这3种病是有什么内在联系引起的?我该什么治疗?去开有什么药物治疗这3种病?大家帮帮我吧!我都不知道该什么办!又不想让家人着急.我会谢谢你们!"
内科,消化科,萎缩性胃炎活动期是什么意思,无
内科,消化科,我为什么会经常胃痛,"我已经断断续续胃痛了一年了,有时候吃完饭之后就会好好的胃痛了,而且有时候还会痛的很厉害,医生我的胃是不是有问题阿?"
内科,消化科,右腹涨是什么毛病,您好，在前三个月一次急跑后右腹痛，后休息几天没事了，前一个多月又跑步，右腹又痛，休息后也没事了。做过肝胆脾B超也没事，吃钡餐做过胃检也没事。但这些天肚脐右三公分左右处按下去有点微疼，还有肚脐右45度角即肋骨下有点胀，但又不像胀，总之有点不适。请问:1.做肝胆脾B超时有吃一碗云吞，会影响检查吗？2.吃钡餐能检查到十二指肠的问题吗？也就是能查出有结肠炎吗，如果是肠炎的话，或是胃炎的话可以吃地瓜或牛奶
内科,消化科,十二指肠溃疡的症状有什么,十二指肠溃疡有那些症状
内科,消化科,慢性胃炎病人性生活有何禁忌,"专家你好:慢性胃炎病人过性生活该注意些什么。
  恳请回复    谢谢"
内科,消化科,怀孕七个月，为什么胃口总是不好，该吃些什么,无
内科,消化科,胃溃疡服用什么药好？,胶体果胶铋胶囊可以与兰索拉唑片一同服食吗？可有副作用？
内科,消化科,胃胀应该如何治疗,饭后，胃胀，大便稀，有便秘，多放臭气。
内科,消化科,如何治疗吃强骨胶囊后导致便秘,最近我是一直肚子疼，其实分不清是胃疼还是肚子。而且还发烧，咳嗽。疼痛有时候想上厕所。什么都上不出来。有时候疼痛不严重。晚上睡觉的时候也疼。这种请问如何治疗吃强骨胶囊后导致便秘
内科,消化科,胃炎不吃药能好吗,无
内科,消化科,肠胃病怎么保养？,我有6.7的肠胃病史了，前段时间肠胃病又犯了！现在都好了！想要得到的帮助:我想知道这个肠胃怎样保养才好呢？吃饭饮食是怎样呢？忌什么来的？还有就是怎样去保养好呢？
内科,消化科,经常吃饭后胃胀又拉肚子怎么办,我最近总是感觉胃有些胀，还会有一些拉肚子的情况，以前拉肚子也没有出现胃胀的现象，想问一下，经常吃完饭后胃胀又拉肚子怎么办？
内科,消化科,右下腹疼怎么回事,本人34岁，最近不知道怎么回事总是感觉恶心想吐，胃部阴阴作痛有时有灼热反酸的症状，去医院看过好了一段时间后又开始犯了，请问右下腹疼怎么回事
内科,消化科,胃溃疡和肥厚型心肌病如何一起治疗,"患者性别:
病史:4个月
以往的诊断和治疗经过及效果:胃溃疡及肥厚型心肌病"
内科,消化科,胃病的治疗的方法有哪些,我一直都有胃病好久了，但是可能因为是慢性的，所以我的病情也不是很严重，就是很烦人而已，夏天到了我想吃一点冰淇淋了，请问胃病的治疗方法有哪些？
内科,消化科,我近一周前感觉空腔到胃部有寒凉的感觉,患者女，33岁以前身体状况良好，一周前咽喉痛，又感冒的感觉，嗓子有痰，伴有反酸水，胃胀，不消化的感觉，从口腔到胃部有寒凉的感觉
内科,消化科,有关便秘怎么调理,"大便时间长,2周以前大便带血,喝蜂蜜以后就好了.问可以坚持喝蜂蜜吗?听说回产生依赖性?第一次问题补充:我的意思是喝蜂蜜以后就正常了，是否可以长期用此方法?另外我的血糖有点高,因为蜂蜜是甜的,是否摄取糖类过高?"
内科,消化科,大便多年不成形怎么办,自记事起就大便不成形，现在粘稠油状，排便时间长排不净，酒后大便更浠。长期下肢夏天汗，秋春天冷不温，冬冷。腰膝麻木。，长期早起多清痰反胃返酸，有慢性咽炎。本人1.65m体重164.不爱运动。想请中医给指导一下，吃些什么中成药或者中药。谢谢。
内科,消化科,大便解不下来如何治疗,大便怎么也解不下来，用开塞露，也只是吧门口一点点解了出来，只是一些小疙瘩。站起啦i觉得又要解。就是解不出。第二天便意很明显，就去解，还是不行。
内科,消化科,胃胀反酸胃体水肿怎么办,胃胀反酸胃体水肿，胃胀吃不进东西，做胃镜确诊为浅表性胃炎全胃炎，胃胀反酸胃体水肿怎么办？
内科,消化科,06年开始总是饭后反流,病情描述:患者女，60岁。身体状况良好，有慢性结肠炎病史。06年开始经常饭后反流，吐食物，不吐酸水，不烧心。在山西省人民医院就诊。曾经治疗情况和效果:刚开始让吃马叮宁，后来吃一些其他的增加肠胃蠕动的药物，以及奥美拉唑等，至今不见任何效果。想得到怎样的帮助:目前该如何检查，确诊，治疗呢？有什么好的食疗或者其他非药物治疗办法？
内科,消化科,慢性浅表性胃炎伴糜烂如何治疗会比较好呢？,2004病发，胃会时不时的痛，很会吃，但人一直消瘦，有在市二医院仔细检查但都以服中药为基础曾经的治疗情况和效果：曾经坚持服中药，胃有好偏过，但中间有停了一年多，胃就病发了而且跟严重了在乎怎样的帮助：这病现在这个情况严重吗？应当怎么治疗要治多久方才能自愈？
内科,消化科,胃部膨胀是什么毛病，如何治疗,我母亲胃部老是不舒服，吃点东西就觉的胃部膨胀。我母亲她胃不疼，就是膨胀的不舒服，吃了东西后就说难过。她现在老是怀疑自己胃里长什么东西。（我父亲是三年前得肺癌去世的）。
内科,消化科,医生请问有时说话有口臭是怎么回事儿？,有时答话有口臭，有时又没，这应到啥科室复诊，是怎么回事儿？
内科,消化科,患有胃溃疡吃什么药较好,常隐隐庝，靠肋骨边处痛
内科,消化科,幽门螺杆菌检验值9.70正常吗,幽门螺杆菌检测值9.70是正常？还是高？胃不疼能吃能喝的。
内科,消化科,便秘要做的五项检查吗,兄弟媳妇天天在我妈家吃，每餐都得吃两个人的饭但是她光吃不拉经常出现便秘的情况，尤其是最近一段时间，您好便秘要做的五项仔细检查是什么？
内科,消化科,饮食调理急性胃炎该怎么办,我老公不知晓是吃了什么不干净的东西还是怎么的，前天已经开始的总往厕所跑，每天大便的次数低于了3，4次呢，除了下腹部胀痛的症状，怕他失水呢，带着他到医院打了吊瓶，现在回家了，巧用饮食调理急性胃炎该怎么办？
内科,消化科,伴腺上皮肠化（轻度）如何诊疗，如何确诊,"详细病情及咨询目的:胃镜检查发现:慢性浅表性胃炎伴胃底、胃体糜烂　HP＋；病理检查报告诊断:胃（窦近幽门口）浅表粘膜慢性炎伴腺上皮肠化（轻度）。
如何确定病情；如何进一步治疗；如何用药；饮食注意什么？
本次发病及持续的时间:慢性浅表性胃炎7年，本次发病1个月。
目前一般情况:刚用药2天。保护胃粘膜；治疗HP；及阿莫西林去炎症。
病史:
"
内科,消化科,乳糜泻是什么类型得病 ,乳糜泻有什么特征？
内科,消化科,成年人要不要定期杀蛔虫？,我朋友最近老是肚子痛，怀疑是不是有蛔虫，是不是成年人或定期杀蛔虫？用哪些药？
内科,消化科,大便后纸上有鲜血是怎么回事,"本次发病及持续的时间:15天左右
详细病情及咨询目的:拉完大便，纸上有少量鲜血，有时喊肚子痛
目前一般情况:身体免疫力低，常感冒"
内科,消化科,糯米会引起便秘吗糯米上火吗,无
内科,消化科,60岁老人忽然大小便不通,老人60岁，忽然有一天大小便不通，现在已经四五天了，并不像便秘，小便昨天有了，今天又便不出来了，肛门附近疼痛，有时肛门附近还会又大便
内科,消化科,我老打嗝是什么病,我不知道是什么病，有2年了，老打嗝。
内科,消化科,消化内科疾病和胃有关系吗,"肚子里面老是呼啦呼啦的？有时候经常放屁,屁不臭 有时候有响声是怎么回事啊"
内科,消化科,身上长出很多小红痣怎么回事,来，身上长出很多小红痣，但不痛不痒。
内科,消化科,慢性胃炎溃烂有三高有什么好办法,重时想打咳上腹部隐痛
内科,消化科,胃溃疡有哪些症状表现,"悬赏10个健康币
来自山东,






感谢医生为我快速解答——该怎么样治疗和预防"
内科,消化科,50岁女性结肠炎患者腹痛难忍怎么办,"患者女，50岁，患有结肠炎。
昨天吃了西瓜后并吹了空调，导致今日腹痛严重，伴有腹泻呕吐症状。"
内科,消化科,右下腹痛是什么原因,右下腹痛是怎么回事，有3年的时间了，一上火就痛。
内科,消化科,孕妇贫血便秘怎么治疗,我老婆已怀孕6个月了 但便秘如何解决？谢谢 可以用开塞路吗？
内科,消化科,最近饿的很但吃不进去饭还恶心怎么回事,无
内科,消化科,在服用奥克，阿莫西林，克拉霉素的治疗慢性胃炎,"请问专家，在服用奥克，阿莫西林，克拉霉素的治疗慢性胃炎时，能服用活血化瘀的中药汤剂吗？在什么时候服用比较合适？还有上述三种药物何时服用效果会好？饭后两个小时，或晚上睡前服可以吗？
第一次问题补充:可是上海仁济医院的医生要我在饭前一个小时一起服用，一小时内禁食禁饮，我想这与空腹服药没有区别吧，那么为什么服药后的一小时要吃东西呢？"
内科,消化科,吃什么食物对胃炎糜烂好,"
最近不知道怎么回事，消化一直不怎好，吃东西很久也不消化而且还有胀气，吃了要没有什么明显效果，每天都特难受，请问吃什么食物对胃炎糜烂好"
内科,消化科,你好今早开始右下腹疼痛，间歇性的一会疼一会不,昨晚有点发冷，今早开始右下腹疼痛，请问是阑尾炎的症状吗
内科,消化科,食管黏膜病变是什么病,食管黏膜病变是什么病
内科,消化科,肚脐眼上方一阵阵痛怎么回事,无
内科,消化科,直肠粘膜充血水肿怎么办,"
最近不知道怎么回事，消化一直不怎好，吃东西很久也不消化而且还有胀气，吃了要没有什么明显效果，每天都特难受，请问直肠粘膜充血水肿怎么办"
内科,消化科,"大便次数增多,伴有便不尽且坠胀感,无腹痛腹胀","患者女,44岁.以前身体状况良好.此次病情;大便次数增多,伴有便不尽且坠胀感,无腹痛腹胀,胃部稍有不适."
内科,消化科,胃溃疡患者应如何治疗和饮食?,无
内科,消化科,什么情况下要做胃镜,早上醒来，胃感不适，大便不痛快，日三次。
内科,消化科,急性浅表性胃炎的症状,您好，我想问一下急性浅表性胃炎都有哪些症状呢？谢谢您
内科,消化科,长时间牙齿出血怎么处理,您好！我很长一段时间牙齿老爱出血并且带有腥味，不知是咋回事？
内科,消化科,胃脘胀痛是何缘故导致的,胃脘胀痛数日  胀的感觉有时像胀到喉咙是的 胃脘胀痛且打嗝 吃东西后严重 晚上睡前严重  睡后轻松 
内科,消化科,21岁便秘三四年了该怎么办？,病情描述:患者，女，21。便秘三四年，尿频一年。曾经治疗情况和效果:经常靠喝所谓的肠清茶来解决想得到怎样的帮助:不再靠那些什么肠清茶来解决便秘问题，能通过食疗最好。
内科,消化科,萎缩性胃炎的症状及治疗 严不严重好不好治,无
内科,消化科,慢性结肠炎和慢性结膜炎有关系吗,慢性结肠炎与慢性结膜炎一样吗？
内科,消化科,胃痛，反复发作，又没有幽门螺杆菌感染,去年12月份开始胃痛，打了针，吃了好多西药效果不明显，后来去医院检查，做了胃镜，呼气实验，慢性浅表性胃炎，没有幽门螺杆菌感染，医生开了马来酸曲美布汀片，奥美拉唑，铝碳酸镁，吃了一个月，反反复复，还是胃痛，后去中医医院看了，医生说脾胃虚弱，开了中药，吃了有效果，但是还是反反复复胃痛，都一起吃了21付中药了，现在一停药，又开始胃痛，不知道怎么办？几个医生都说胃镜检查结果不严重，但是就是没彻底看好病，请
内科,消化科,患有肠胃病怎么办,"严重时整个腹部的肠子都会疼痛,轻微时腹部的右下方和右下方疼痛.现在很影响我的生活，想了解一下患有肠胃病怎么办？"
内科,消化科,食道炎怎么治,"医生:
   您好!
   我妈妈今年47岁了，她患有食道炎和浅表性胃炎。
   我妈妈的主治医生没有说是什么类型的食道炎，不过我觉得根据她的症状有可能是反流性食道炎。
   我妈妈今天做了胃镜，结果如下:
   食道:食管黏膜充血，片状糜烂，齿状线清晰。
   贲门:粘膜充血，片状糜烂。
   胃底:充血。
"
内科,消化科,肚子涨，血多怎么办,"患者年龄:
详细病情及咨询目的:
本次发病及持续的时间:
目前一般情况:
以往的诊断和治疗经过及效果:
辅助检查:"
内科,消化科,胆囊切除和脾切除后会有哪些影响,我一个月以前因为球细胞争多证做的胆囊和脾切除手术现在还可以不知道以后有没有影响吃东西应该注意点什么
内科,消化科,饭后胃喷门疼是怎么回事,无
内科,消化科,吃完饭总肚子疼排便怎么处理,本人34岁，最近不知道怎么回事总是感觉恶心想吐，胃部阴阴作痛有时有灼热反酸的症状，去医院看过好了一段时间后又开始犯了，请问吃完饭总肚子疼排便怎么处理
内科,消化科,"小孩九岁今天又呕又拉,检查说是急性胃肠炎,头",无
内科,消化科,胃胀闹肚子伴有干呕现象,一开始是胃胀，随着就咕噜咕噜地响，然后已经开始不停地上厕所便出的都是液态状的便，还想干呕胃胀闹肚子伴有干呕现象？
内科,消化科,肚子里感觉呼吸困难怎么回事,"
最近不知道怎么回事，消化一直不怎好，吃东西很久也不消化而且还有胀气，吃了要没有什么明显效果，每天都特难受，请问肚子里感觉呼吸困难怎么回事"
内科,消化科,返流性胃炎复发怎么办？,医生，我就是在前段时间查出来胆汁返流性胃炎，但是吃了药好了，然后最近又痛了，医生，我可以吃以前的药吗？我i前段时间查出来胆汁返流性胃炎吃了药好了最近又是怎么办？
内科,消化科,如何治疗慢性浅表性胃炎,两个多月 上腹正中有时 胀闷 有时隐痛 
内科,消化科,口臭是胃还是镶牙引起?,我口臭6年了，主要症状:口苦、口干、经常便秘、而且有蛀牙，胃肠道我自己也不知晓可有问题，但是有时候会感觉胃有点疼，怎么回事？
内科,消化科,胃不易消化要用什么方法好,病情描述:胃斗有灼热感，胀，吃了饭不易消化，对于生活方面该怎么调理曾经治疗情况和效果:效果不怎么好想得到怎样的帮助:得了病的人都问问医生，怎么办哦
内科,消化科,食管裂孔疝到底是什么意思？,本人34岁，最近不知道怎么回事总是感觉恶心想吐，胃部阴阴作痛有时有灼热反酸的症状，去医院看过好了一段时间后又开始犯了，请问食管裂孔疝到底是什么意思？
内科,消化科,心脏病气管有啖液肠胃病怎么办？,心脏病、气管有啖液、肠胃病、血脂稠、去年心脏病住过两次医院、今年病情有病发怎么办？
内科,消化科,经常放屁是什么原因?,无
内科,消化科,催吐出血是胃出血还是拔牙出的血呢？,催吐快一年了每次吃多了都会自然得吐出来;平常胃部没备感什么不适;可是今天下午拔了两棵智齿;流了好些血;晚上吃多了吐得时候;呕吐物里有血;这是胃出血;还拔牙的伤口出的血？
内科,消化科,胃下垂治疗方法是什么？,最近我是一直肚子疼，其实分不清是胃疼还是肚子。而且还发烧，咳嗽。疼痛有时候想上厕所。什么都上不出来。有时候疼痛不严重。晚上睡觉的时候也疼。这种请问胃下垂治疗方法是什么？
内科,消化科,胃胀吃哪种药有效,胃胀吃什么药比较好，请多多说几种，以供参考第一次问题补充:大便还算正常，就是每天感觉胃不舒服，像是生气了一样
