department,dep,title,ask
内科,消化科,慢性萎缩性胃炎重度能治好吗？,本人34岁，最近不知道怎么回事总是感觉恶心想吐，胃部阴阴作痛有时有灼热反酸的症状，去医院看过好了一段时间后又开始犯了，请问慢性萎缩性胃炎重度能治好吗？
内科,消化科,大便化验有吞噬细胞一定是痢疾吗,.4宝宝拉肚子有些日子了，大便呈蛋花状、水状和黏液状，后来医院验大便常规和隐血发现吞细胞，说是痢疾，打了4天针后又输了3天液，今天去验大便没有吞噬细胞了，但大便还是以前一样拉稀，请问医生是不是误诊
内科,消化科,为何会得胃息肉,什么因素会引起长胃息肉
内科,消化科,孩子厌食要吃什么,我家孩子6岁了，什么东西都不好好吃，可瘦了，请问孩子厌食吃点什么？我很担心，怕影响宝宝发育成长，希望得到解答。
内科,消化科,我现在肚子疼的厉害啊！就是在肚脐附近啊！怎么,"医生您好:
　　我现在肚子疼的厉害啊！就是在肚脐附近啊！今天和同学去聚会啊？今天下午５点开始疼啊？两个月前第一次疼！原因是天气冷／我穿的少可能是冻的啊？疼到凌晨２点多啊！一个周后就又开始了
第三次疼我实在是支持不住了
就去医院让医生给我打了尔特品啊
上个月
我输了三天水啊
没有什么起色啊
医生现在让我坚持吃盐酸环"
内科,消化科,手术后吃哪些能润肠胃通大便,"
最近不知道怎么回事，消化一直不怎好，吃东西很久也不消化而且还有胀气，吃了要没有什么明显效果，每天都特难受，请问手术后吃哪些能润肠胃通大便"
内科,消化科,九味元浆能只好胃病吗？,无
内科,消化科,请问太瘦了怎么办,你好我就是太瘦了我身高176体重50公斤怎么吃也吃不胖该怎么办呢？
内科,消化科,急性肠胃炎发病的原因是什么呢,我这阵子总是恶心呕吐，去检查是急性肠胃炎，想知道病因是什么呢？
内科,消化科,0个月宝宝便秘口臭出汗要如何解决,前段时间生病吃了清火去热的药，主要是治疗扁桃体，结果孩子再次出现了恶心呕吐，后来给吃了婴儿健脾散和炒江米的水（说可以治疗恶心呕吐，效果很好，用了也有效），之后孩子不恶心呕吐了，改便秘了，而且这两天再次出现口臭，每次睡午觉醒了都有，尤其是晚上，大便也很臭，睡午觉爱流汗，食欲还可以 曾经的治疗情况和效果：给吃过2天益生菌，香蕉，苹果等水果在乎怎样的帮助：我该给孩子吃点什么调养呢
内科,消化科,复方消化酶可以长期服用吗,无
内科,消化科,结肠炎大便变细吗,"
最近不知道怎么回事，消化一直不怎好，吃东西很久也不消化而且还有胀气，吃了要没有什么明显效果，每天都特难受，请问结肠炎大便变细吗"
内科,消化科,胃息肉切除后需要注意什么,两个月前检查出得了胃息肉，立马做了手术进行切除了，那么做手术后怎样调养好呢？
内科,消化科,便秘有一年多,便秘有一年余
内科,消化科,婴儿便秘怎么治疗才好呢？,宝宝出生70多天了，半个月前已经开始大便不正常，上个星期5天还不拉大便，我们去看了医生，医生开了汉森四磨汤和开塞露，四磨汤吃了2天，开塞露用了一次，拉了一次大便。之后到现在又有3天没拉了。一直是母乳喂养，每天喂水3-4次，一次30-50毫升，母亲吃得也算清淡，没吃油炸的食物。
内科,消化科,胃切除后有烧灼感吃什么药好,我于今年11月28日进行胃切除手术，切除了四分之三，现已出院，最近两天总是觉得胃烧得很，不知是怎么回事，吃什么药好谢谢
内科,消化科,肚子有气左边疼有便意怎么治,开始时肚脐左边有点疼 大便形状正常开头带血  后期开始腹痛总有便意且大便不成形时好时坏  最进老觉得肚子有气打咯排气后稍缓解请问这是什么病 如何治疗
内科,消化科,胃窦炎和胃炎有什么区别,爷爷得了胃窦炎进了医院，医生说救治不好的话，有可能会有生命危险，爷爷平时很留意身体的，这个是不是胃炎来的，所以想问下胃窦炎与胃炎的区别？
内科,消化科,大三阳为何要注意定期检查？,我的未婚夫是一个有乙肝的大三阳的患者，非常痛苦，已经出现比较明显点的肝病病容，而且脖子和胸口那边出现了红色的蜘蛛痣了，很难看。没复查
内科,消化科,肠胃痉挛对孕妇有影响吗,"
最近不知道怎么回事，消化一直不怎好，吃东西很久也不消化而且还有胀气，吃了要没有什么明显效果，每天都特难受，请问肠胃痉挛对孕妇有影响吗"
内科,消化科,胃胀胃疼该吃些什么药？,两个月，胃胀，不消化，吃完东西，明显胃部鼓起来。伴发疼痛
内科,消化科,小肠出血严重怎么办,病情描述:患者45岁，病情2年，中间出血4次，最近6、8月各出血一次，没出血时血色素较快上升，最进出血，血色素从110下降到88，两年中查过胃镜，肠镜都没问题，做过胶囊胃镜都没发现问题。最后还是怀疑小肠出血，心里压力很大，不知如何是好曾经治疗情况和效果:两年中当胃病治疗。中间出出血4次，当都能很快愈合，近期出血严重怎么办
内科,消化科,幽门螺杆菌感染吃哪些药好一些,男，33岁，平时不怎么吃饭，吃了饭就胃胀，有时不吃胃也胀难受，
内科,消化科,连续好几天胃痛到醒是胃溃疡吗,吃晚饭的时候总觉着有气顶着，伴发会干呕。早上的时候会胃部绞痛，伴发拉稀现象。连续好几天胃痛到醒是胃溃疡吗？
内科,消化科,为什么宝宝白天睡觉晚上哭闹,宝宝出生27天，白天怎么吵也吵不醒，到了晚上11点左右就醒，吃饱了也不肯睡觉，不停的哭，刚刚出生的时候不是这样的，就是几天前因为肚子痛，害她晚上不能安宁，到后期好了就是爱晚上不睡觉，我现在要怎么做呢？
内科,消化科,经常便秘所导致的长痘痘怎么办,你好我是一个经常便秘所导致的长痘痘我也喜欢挤痘痘现在就有一些黑色痘印我还是个油性皮肤问一下应该用什么更快的去掉 
内科,消化科,喝山楂水能治疗胃炎吗,我前段时间胃一直不舒服，到医院仔细检查，医生说是我有胃炎自己，平时也有喝牛奶的习惯，所以我目前想理解几下，有胃炎还可以喝牛奶吗？
内科,消化科,肠胃不好引起的夜间磨牙怎么办,由于肠胃不好引起的夜间磨牙。已近好几年了。
内科,消化科,胃萎缩与胃溃疡哪个更容易癌变,"
最近不知道怎么回事，消化一直不怎好，吃东西很久也不消化而且还有胀气，吃了要没有什么明显效果，每天都特难受，请问胃萎缩与胃溃疡哪个更容易癌变"
内科,消化科,饭后突然胃痛是怎么引起的和如何改善,"患者女，43岁，以前曾有胃痛
  此次病情：突然发作"
内科,消化科,青年大便带血是怎么回事,主要症状:像女性月经一样还有血块发病时间:30岁化验检查结果:
内科,消化科,浅表性胃炎伴胆汁反流怎么办？,本人34岁，最近不知道怎么回事总是感觉恶心想吐，胃部阴阴作痛有时有灼热反酸的症状，去医院看过好了一段时间后又开始犯了，请问浅表性胃炎伴胆汁反流怎么办？
内科,消化科,胃炎治了好长时间都没治好如何治疗,好长一段时间啦，经常呕吐  肚子痛      趴一趴就好了        吃不下饭
内科,消化科,做胃镜对人体有伤害吗,无
内科,消化科,下腹痛是什么病,患者男，55岁，肠胃一直较差此次病情：发病时间十天前主要症状：左下腹痛，饿的时候痛得厉害，饱饭后不痛。大便每天4~5次。
内科,消化科,胃酸应该怎样治疗,每天胃酸便稀拉3到5次，胡说八道都能带出屎花，现每早必服奥美拉唑方才能确保每天不胃酸但是大便次数多便稀？
内科,消化科,小米饭对胃好不好,"
最近不知道怎么回事，消化一直不怎好，吃东西很久也不消化而且还有胀气，吃了要没有什么明显效果，每天都特难受，请问小米饭对胃好不好"
内科,消化科,引发慢性便秘有什么病因,引发慢性便秘的原因有什么
内科,消化科,请问什么叫腹胀？,我最近肚子有点外突，偶尔有涨的感觉，但躺下后就平了。经常打嗝，我这是腹胀吗？算胃病吗？
内科,消化科,口臭的诱发因素是什么？,从小有口臭的毛病，口腔还好没什么疾病，洗完口也有味道，看过中医院消化科，医生做了仔细检查没查出来什么毛病，说可能会是胃火，开了些中药，吃了没一点儿用，怎么治疗？
内科,消化科,胸骨痛咽干异物感是什么病状,6月初胸骨痛，咽干异物感。胃镜；食道；管腔通畅，粘膜光整，血管纹理清，蠕动好。齿状线清。贲门；粘膜光滑，开闭好。胃底；粘膜光整，脑回状，粘液湖清，量中。胃体；粘膜光整，红白相间，分泌物不多。胃角；呈拱形，末见溃疡及新生物。胃窦；粘膜光整，蠕动好红白相间，以红为主，分泌物不多。幽门；圆，开放闭合好，无充血。十二指肠球部末见异常。胸部X片正常。B超肝胆正常，心电图正常。
内科,消化科,左腹疼小便混浊带有血丝怎么回事,我左腹特疼 小便疼有浑浊并带有血丝
内科,消化科,如何治疗胃炎啊,我是反流性胃炎吃了好些药，一直，不见好我想尝试吃中药，可以吃吗，如何治疗胃炎啊？
内科,消化科,食管裂孔疝挂什么科,本人34岁，最近不知道怎么回事总是感觉恶心想吐，胃部阴阴作痛有时有灼热反酸的症状，去医院看过好了一段时间后又开始犯了，请问食管裂孔疝挂什么科
内科,消化科,去医院怎么治疗十二脂肠溃疡的效果最好呢？,大夫你好，我有胃十二脂肠溃疡。我做14碳呼气试验的结果是454.请问大夫吃什么药谢谢了。
内科,消化科,请问怎么治疗厌食症,后，以后有好转，现在不时会产生厌食。
内科,消化科,痢疾吃啥子药？,医生我最近在学校吃晚饭的时候，感觉肚子不舒服，去医院儿童医院看了看，医生说可能会是得了痢疾，我不知晓这种病厉害不厉害，想必进行咨询几下大夫，这种病好治么？得了痢疾吃啥子药？
内科,消化科,小孩脸上长有蜘蛛痣为何做了两次微波都不行,2010·8曾经治疗情况和效果做了两次微波都是已经开始还好过一段时间有长了还是原来的部位化验、仔细检查结果：蜘蛛痣怎样能治好
内科,消化科,乳糜泻如何治疗,我一直有早上腹泻的习惯一个晚上腹部突然不适结果是结肠功能紊乱
内科,消化科,每天腹泻是何病，如何治疗,每天早上腹泻2~3次吃药也没用，已有半年在湘潭一医院治疗过
内科,消化科,胃肠痉挛怎么办,晚饭后容易出现胃肠痉挛，通常在22点以后。疼痛持续时间长。有时会先出现腰腹胀痛然后痉挛。服用颠茄片后可以缓解
内科,消化科,绦虫病有什么危害？,最近再次出现腹痛恶心呕吐现象，还伴有恶心干呕的现象，每次都很痛。夜间发烫，全身乏力瘙痒痛，整夜不能安睡，已经第三天了，到医院做了粪检，发觉是绦虫病作祟，请医生指导。期望获得的帮助:绦虫病有什么危害？
内科,消化科,便秘吃哪种药好,我已经便秘三周了，这期间偿试过吃水果，多喝水，好象效果都不好，不知晓自己的身体出了什么问题，那便秘吃什么药好，用什么药物治?
内科,消化科,2周男孩。吞咽硬币。呕吐不止,早上7点左右吞咽一个一元硬币
内科,消化科,肠易激综合征有治疗的药吗,因腹痛、恶心呕吐或便秘等症状到医院治病。各种消化道非消化道的详细检查做了个遍，均证明没异常。医生说我可能会有肠易激综合症，而肠易激综合症有治疗的药吗？
内科,消化科,24岁女生2星期不大便什么原因,无
内科,消化科,胃炎是否能吃牛油果,老婆患胃病已经很多年了，是慢性胃炎，平时食欲也不怎么好，饭量小，这次出府的时候看见有卖有有果的，想买许多给老婆尝尝鲜，不知晓胃炎能不能吃牛油果？
内科,消化科,病人长久不想吃饭 不觉得饿可能是什么原因？,无
内科,消化科,萎缩性胃炎伴糜烂怎么治疗？,老公是一位货车司机，可能会是由于上班太辛苦，饮食上多次出现的问题，他最近这段时间总感觉到胃特别的疼痛。我很担心他的身体，陪她去医院做了仔细检查。萎缩性胃炎伴糜烂怎么治疗？
内科,消化科,胃胀胃痛怎么办,无
内科,消化科,胃胀，吐酸水,下午的时候总是胃胀，早晨还会吐酸水，想知道这是怎么回事
内科,消化科,我在大便的时候有时出的是鲜血，有时是浓血便，,"详细病情及咨询目的:我想了解是什么病
本次发病及持续的时间:4个月
目前一般情况:每次都有血
病史:6年
以往的诊断和治疗经过及效果:没有
辅助检查:没有
其它:没有"
内科,消化科,慢性萎缩性胃炎可不可以吃山药,患有慢性萎缩性胃炎已经很长时间了，能不能吃山药呢？
内科,消化科,幽门螺旋杆菌会传染给婴儿嘛,了，平时也会一直抱他亲他，因此请问如何避免传染幽门螺旋杆菌给我家的宝宝。谢谢
内科,消化科,厌食症是否需要住院医治 ,去年因嫌自己太胖开始节食减肥，迅速降至110斤，现情绪低落，每餐进食极少，拒绝增加饭量，手脚冰凉，小便少且黄，大便5-6天一次很少，月经已近3个月没来，强迫锻炼，每天必须走一个小时路，不然心情焦躁。
内科,消化科,半夜胃疼是因为胃炎吗,您好！我20岁。前天半夜突然胃疼，一阵一阵的。最疼的时候还会吐一些酸水。胃感觉有点胀又有点像绞痛。一直持续到第二天上午。去医院打点滴后有所缓解。这两天仍觉胃部不适，虽已没有疼痛，但总有种说不出的隐约的难受感。没再吐酸。吃了一些沉香花气丸。食欲和以前一样。大便正常。舌苔发白。平时饮食也较规律。以前少有胃疼发生。您看我这属于胃炎吗？是急性的吗？如果再去检查是不是必须要做胃镜或者吃钡餐？谢谢您！
内科,消化科,胃镜说是慢性胃炎和十二脂肠球怎么治疗呢？,我昨天刚做了胃镜说是慢性胃炎和十二脂肠球炎您好怎么治疗，
内科,消化科,胃炎吃药效果不佳怎么办,发作时胃不怎么痛，有点胀，干呕，嗳气，触及全身神经不舒服，很难受，时有头晕心慌。曾用泮托拉唑，奥美拉唑，克林霉素，阿莫西林，吗丁啉，西沙必利片等治疗，效果不隹。
内科,消化科,胃肠神经功能紊乱。脾胃功能会低下吗？,家里出了较大的变故，心情不好，总是焦虑，引起植物神经功能紊乱，感觉胃肠消化吸收不是很好，经常睡醒后有些恶心，有时候会有些痉挛。心情好些的时候这种情况则不明显。
内科,消化科,便秘口臭是哪些原因引起的,老是便秘，还有口臭，是什么原因呢
内科,消化科,慢性胃炎中医辨证治疗效果好吗？,29岁男06年患胃病，已经有4年了吧！胃镜仔细检查慢性浅表性胃炎胆汁返流型吃的很少就饱了，饭后3-4个小时胃脘伤心不舒服（不是疼的感觉），不想喝水，但胃脘推拿有很大的水声，大便2天时好时微干成型，屁多。舌体肥大边有齿痕，看过许多大中型中医院和西医，没转好，身体很瘦1。8米102斤。头晕，没精神……曾经的治疗情况和效果：曾经吃过摩罗丹两月大约，没转好，都服食六位安消胶囊，蜂胶胶囊，仍没转好，汤药吃了不下三百付仍不见症状转好！在乎怎样的帮助：请根据我的症状和舌象辨证论治我患有中医的那种类型，我现服食的“补益资
内科,消化科,男，左腹部疼痛一个月左右，请问需做什么检查？,"患者男，49岁，慢性肠胃炎、肾结石、腰椎、颈椎增生；去年痔疮重，肛周肿痛，波及右腿部皮肤炎症，像带状疱疹（痊愈后色素沉淀）
一月前感觉双肾部位疼痛，近期左腹部夜间疼痛加重，大便干，早前长期大便不成形"
内科,消化科,胃部不适。舌头麻木。烧心,"详细病情及咨询目的: 胃部不适。舌头麻木。烧心咳嗽有谈。饭后胃部赌的慌。全身酸痛。无力。食欲不错，大便基本正常
本次发病及持续的时间:3个月
目前一般情况:胃部不适。舌头麻木。烧心咳嗽有谈。饭后胃部赌的慌。全身酸痛。无力。食欲不错，大便基本正常
病史:无
以往的诊断和治疗经过及效果:吃中药，效果不太明显，医生说是肠胃不好，肝胆阴湿"
内科,消化科,头晕胃胀应该怎么办,医生我一年前头晕脑要昏倒一样胃胀吃一口东西头就晕心烦去医院仔细检查抽血说没事儿我问医生到底什么回事医生说我有一点贪血又给我吃补血药减轻药。
内科,消化科,便秘吃什么可以缓解,最近我是一直肚子疼，其实分不清是胃疼还是肚子。而且还发烧，咳嗽。疼痛有时候想上厕所。什么都上不出来。有时候疼痛不严重。晚上睡觉的时候也疼。这种请问便秘吃什么可以缓解
内科,消化科,粪便有白点，肛门会流液体是什么原因,"一个月前医生检查出我有内痔,用了肤痔清.后来肛门里面没有什么感觉之后我就停止了用药,但是每次大便时,开始粪便上都有白色的东西.现在肛门会流出很少的液体.请问是怎么回事?"
内科,消化科,什么方法治便秘更快,我朋友今年有20岁了，皮肤状态不好，总是皮肤黯沉，毛孔粗大，而且上大便也3-4天才上一次，每次都很辛酸，拉出的都是一粒一粒的，经常要拉好几次才拉的出的，这样已经有1个都月了，您好我朋友现在该怎么办啊？救治便秘拉不出大便的最快方法是什么
内科,消化科,经常放屁，而且很臭，肚子总是机了咕噜的。怎么,我经常放屁，不管吃了什么东西都是这样，尤其到了晚上更是屁多。放屁很响，肚子总是机了咕噜的，总有气，我很苦恼，怎么办。
内科,消化科,食管炎反流怎么治疗？,半个月前我儿子被确诊出食管炎反流，在医院住了一个多月，稍微好了点，但是还是没好彻底，我想问问食管炎反流怎么治疗？这个能缓解吗？可有比较权威的治疗方案？
内科,消化科,尿素氮偏低怎么办,"
最近不知道怎么回事，消化一直不怎好，吃东西很久也不消化而且还有胀气，吃了要没有什么明显效果，每天都特难受，请问尿素氮偏低怎么办"
内科,消化科,消化不良要怎么进行治疗,"详细病情及咨询目的:每次吃过饭后，总是放臭屁。有的时候，饭后2，3个小时了还放，但并不是一直放。我想问一下专家，我这是为什么，是脾虚吗？另外，我吃饭不能吃凉的，辣的，酸的，若吃了，就拉肚子。我应如何治疗？请从中医学的角度说一下病因好吗？
本次发病及持续的时间:有半年了
目前一般情况:在上面说过了
病史:3年前，我得了慢性肠炎，1年前，我又得了浅表性胃炎
"
内科,消化科,准备要孩子胃胀怎么办？,准备要孩子不知怀了没，胃胀的很历害，觉的里面有气，怎么吃药
内科,消化科,便秘如何摆脱对潘泻叶的依赖,无
内科,消化科,几年的胃胀怎么办？,胃胀是两年前就已经开始涨的，但也没不舒服，也乎没有胃痛过，但最近的胃胀到感觉很撑的样子，太饿就有想吐的感觉
内科,消化科,小孩胃胀怎么办？,肚子老是抽痛吃不下任何东西肚子老是鼓鼓的看上去全身软弱无力脸色都很苍白，有去给人看打了点滴还是照样跟原来的差不多
内科,消化科,孕妇便秘怎么治疗才好,我妹妹最近怀上，但是她不知晓为什么再次出现了便秘的情况，在怀上之前都是没过便秘的，但是怀上之后的便秘很严重，然后就会觉着肚子很不舒服，可有什么比较好的解决方法呢？
内科,消化科,反流性食管炎会导致咽喉不适吗,本人34岁，最近不知道怎么回事总是感觉恶心想吐，胃部阴阴作痛有时有灼热反酸的症状，去医院看过好了一段时间后又开始犯了，请问反流性食管炎会导致咽喉不适吗
内科,消化科,女性右腹部微痛怎么回事?,"患者性别:   女                            
详细病情及咨询目的:今年4月份得过急性乙肝,通过治疗7月份转阴,过后皮肤有变黄.最近腹部微痛,不知道是不是又复发了?"
内科,消化科,孕妇便秘怎么办 有没有效果快的方法,无
内科,消化科,一周岁宝宝经常便秘应当怎么治疗？,经常便秘，一般两到三天才一次大便，很干，要费很大劲才解下来应该怎么治疗呢？ 曾经的治疗情况和效果：水果，清火宝，水，蜂蜜水都给他吃了还是没用想得到怎样的帮助：请问医生还可以吃些什么帮助降火？
内科,消化科,食道烧胃吃啥药好？,食道烧胃烧
内科,消化科,腹部有气，发胀是什么病,我胸口下面，也就是腹部有气，发胀，老有气来回走，面积围着腹部还挺长的，但不是一起胀，有的时候左边有气，有的时候右边，有的时候中间，偶尔还疼，右边疼的时候多，这些都伴随大便出不来的现象，有便秘现象，大便经常便秘，疼的时候还常发生在早上４－７点钟期间，肝功正常，无肝病，做胃镜也没什么．我感觉好象是肠子的问题，医生我这是什么病呀，六年前我还没有疼的时候呢，只是有气，现在偶尔疼．从小就有发生便秘的时候．
内科,消化科,熬夜了想吐吃什么药,无
内科,消化科,浅表性胃炎半糜烂怎么治疗,胃胀好几年了胃镜做下来是浅表性胃炎半糜乱总感觉涨吃东西胀不吃东西也胀胃还会跳，想要问一下这种情况怎么治疗？
内科,消化科,十二指肠多发性粘膜隆起如何治疗,一年之前胃溃疡   之后治疗复查治愈   但仍经常胃痛 ，今做胃镜发现十二指肠多发性粘膜隆起   慢性浅表性胃窦炎   县人民医院
内科,消化科,幽门螺杆菌显示为弱阳性怎么回事,因家人查出幽门螺杆菌为阳性，故前两天本人至医院抽血检查出幽门螺杆菌显示为弱阳性，此前10年8月刚生完宝宝且身体并无不适症状。
内科,消化科,右边生体感觉空空的难过是什么原因,就是这段时间咳嗽才有的  右边生体感觉空空的难过就好像没吃饱饭是的 右边生体胸部向下感觉空空的难过
内科,消化科,孩子腹部经常阵痛怎么办,"儿子今年十岁了,今年3月份开始,每隔几天,心窝到肚脐1/3偏右一寸处发生一阵一阵的疼痛,一般半个小时之内疼痛能缓解,或者发作时吃半粒解痉挛的药.前几天一个晚上,严重发作了一次,并有轻度腹泻和呕吐,打了针""强痛定""后,第二天也就没事了,可是轻微的疼痛一直还有.
做过肝胆胃等部位彩超,正常；胃镜正常；生化检查全套正常；血程正常。不正常的是脑电图，医生说可能是腹型什么的毛病，我说不清楚。还"
内科,消化科,胀气打饱嗝怎么办,我怀孕吐了三个月。但是后来也就不吐了。断奶时吃了回奶药吃多了。吐了一天。后来到现在。每天吃点东西，喝点水就打饱隔。有种涨气的感觉。请问医生碍事吗？需要做胃镜吗？有没有什么食疗的办法？
内科,消化科,什么原因引起婴儿便秘？,婴儿便秘几天都不拉大便，经开塞露塞肛后解出但大便色黄稀无粘液破皮 曾经的治疗情况和效果：在医院看了经喝药如四磨汤，乳果糖，益生菌但都无明显效果在乎怎样的帮助：我能怎么做稳定症状，能考虑什么原因引来？
内科,消化科,左侧小腹隐痛有气和大便不拉 会更痛什么原因,无
内科,消化科,胃溃疡最快多久会癌变？.,胃溃疡最快多久会癌变？
内科,消化科,42岁胃病4年一月前钡餐结论是胃炎,"详细病情及咨询目的:42岁胃病4年一月前钡餐结论是胃炎吃神怡唯克和西沙比利和溃疡灵不见效现在吃活胃素效果不很好怎么治疗
本次发病及持续的时间:两个月
目前一般情况:总感觉烧心打嗝
病史:4 年
以往的诊断和治疗经过及效果:4年前吃药后症状消失
辅助检查:一月前钡餐结论是胃炎"
