department,finaly_result1,finaly_result2,dep,title,ask
外科,泌尿科,外科,泌尿科,身体容易肾结石怎么办才好,39男一段时间感觉到身体很累，去医院检查就知道得病了，请问：身体容易肾结石怎么办才好
外科,泌尿科,外科,泌尿科,如何去判断自己是否存在包皮过长的现象?,怀疑自己出现了包皮过长，可是该如何去判断呢？
外科,泌尿科,外科,泌尿科,小便为什么会有很大异味,我最近总是感觉尿尿的时候，尿道口有一些特别不舒服，天冷的时候就是有尿尿次数增多，尿没有力气，很害怕啊，怕得很严重的疾病，请问小便为什么会有很大异味
外科,神经科,内科,泌尿科,查出了包皮过长怎么办,包皮过长，实在是不好意思去医院检查这个病，是否要手术治疗呢？查出了包皮过长怎么办
外科,泌尿科,外科,泌尿科,肾结石排出后有哪些症状,我今年53岁，我患肾结石已经一年多了，平时留意多喝水，老是想尿尿又尿不出来，肾结石排出来时有什么症状，肾结石排出来后的症状？
外科,泌尿科,外科,泌尿科,环剥包皮环切术用取线吗？,环剥包皮环切术用取线吗？多长时间可以用不着包沙布，但是缝针了的，有啥要留意的？
外科,泌尿科,外科,泌尿科,包皮术后水肿治疗的好办法有哪些,包皮术后水肿厉害，很疼，有什么办法能消疼和彻底消除吗？包皮水肿，有什么办法彻底消除水肿？
外科,神经脑外科,外科,泌尿科,包皮能自己掀开吗,"
白天小便大致正常，晚上就尿频而且去了厕所又尿不出，总是滴几滴，但是自己又控制不住，请问包皮能自己掀开吗"
外科,泌尿科,外科,泌尿科,肾结石激光碎石费用要多少,我现在是被肾结石摧残得特别的痛，吃晚饭也感觉吃不下，就很想去实施激光了，但是一般的肾结石激光手术的费用是多少呢？
外科,泌尿科,外科,泌尿科,白带也有点浊伴有尿痛怎么办？,医生，怀孕一个多月餐餐只好喝白粥吃水果后会拉稀左下腹痛会干呕肠鸣，吃甘庶可止吐但过后胃又痛，上边眼睛会出眼屎；这几天白带有点浊伴发尿痛外阴庠这些都是病么？谢谢
外科,泌尿科,外科,泌尿科,包皮后伤口撕开怎么办?,你好老师，割完包皮有7天了今天了早晨睡午觉晨勃把伤口划开了，下来上厕所发觉破皮了除了许多黄黄的东西，龟头黄黄的除了许多小点点，除了许多看不清的东西像泡泡，请你老师解疑
外科,泌尿科,外科,泌尿科,为什么输尿管结石病人腰部会胀痛？,以前经常会腰痛，小便时也会疼痛，去医院仔细检查，有肾结石、输尿管结石，当时也没管，就是饮食很少吃豆制品，抑止没犯病，最近有点操劳，现在腰部酸痛，还有点胀。在乎怎样的帮助：为什么输尿管结石病人腰部会胀痛？
外科,泌尿科,外科,泌尿科,包皮过长应该选择怎样治疗呢？,包皮覆盖住尿道口，但能上翻，现出尿道口和阴茎头，包皮阴茎头黏连使包皮不能够上翻，不能够现出尿道口和阴茎头。这拥有包皮症状吗？
外科,泌尿科,外科,泌尿科,总想去小便是怎么回事,"
白天小便大致正常，晚上就尿频而且去了厕所又尿不出，总是滴几滴，但是自己又控制不住，请问总想去小便是怎么回事"
外科,泌尿科,外科,泌尿科,包皮手术后第六天还有渗血严重么,我做包皮手术，到今天已经第六天了，换药的时候大夫说伤口还有渗出，有炎症。怎么办，严重吗？
外科,泌尿科,外科,泌尿科,怎么判断自己是否是包皮过长,怀疑自己出现了包皮过长，可是该如何去判断呢？
外科,神经内科,儿科,泌尿科,泌尿内科疾病怎么治,晨起为白色尿，劳累后更甚，差不多有一年
外科,泌尿科,外科,泌尿科,医院包皮过长手术怎么样?,有点不舒服很久了，请问医院包皮过长手术怎么样?
外科,泌尿科,外科,泌尿科,如何区分羊水破了和尿频,无
外科,泌尿科,外科,泌尿科,泌尿感染输液几天能好？,一大早上床睡觉就感觉腹部胀痛得厉害，后来委实是受不了了，去了医院仔细检查才知晓是尿路感染，回去得匆忙，有个问题忘问了，所以想在这里您好一下，泌尿感染输液几天能好？
外科,泌尿科,外科,泌尿科,我小便尿里面有渣渣东西是怎么了,无
外科,泌尿科,外科,泌尿科,如何让肾结石快速排出体外？,"
白天小便大致正常，晚上就尿频而且去了厕所又尿不出，总是滴几滴，但是自己又控制不住，请问如何让肾结石快速排出体外？"
外科,泌尿科,外科,泌尿科,尿痛外阴经常很痒有什么办法治疗,"年龄:25 
我感觉尿道口有些红肿，偶尔有尿痛，尿道有时有些痒，外阴经常很痒，而且经常感到有些潮湿。小腹有些痛。我去很多医院做过检查，但都说没什么问题。前列腺检查过没问题。有医生判断是附睾发炎，吃过药没什么效果，我现在很着急以为有这种症状已经有很长时间了，我怕会发展成很严重的什么疾病。这是我最近做的尿常规和前列腺液常规检查。请医生帮我看看有什么办法治疗？谢谢！
前列腺液常"
外科,泌尿科,外科,泌尿科,尿路感染一直不好,从两年前就有的尿路感染，也没太当回事，买了些医生开的消炎药吃了，后停药就又反复，不知不觉连带着有两年多的时间，一化验尿就有感染。这些日子让我不得不谨慎起来，发现有些疼痛在小腹的左边。有医生说我是打环璘宪胺治肾炎有关系，可我有一年多没在打这个药了。
外科,泌尿科,外科,泌尿科,尿崩症应该做哪些检查？,无
外科,泌尿科,外科,泌尿科,导致早泄的诱因都有啥,性交3年而且有包皮过长且有早泄精液不液化想问下致使早泄是什么原因还是前列腺炎
外科,泌尿科,外科,泌尿科,尿频怎样治疗好得快,性交两年了？现在有尿频尿急勃起缓慢。勃起硬度还不够。勃起不持久戒掉性交增强锻炼身体能自愈吗？
外科,产科,妇产科,泌尿科,切包皮过长手术全部花多少费用?,"因为自己以前就发现自己包皮过长，一直以来也没去医院割，但是现在准备结婚了，现在就是想去医院割包皮,我对这个手术不是很理解，我想求救切包皮过长手术全部花有多少费用?"
外科,泌尿科,外科,泌尿科,尿路上皮癌是什么癌,无
外科,内分泌科,内科,泌尿科,尿道口松如何改善,病情描述:尿道口变松的感觉，勃起的时候张开得明显，如果这时候摩擦到内裤久了会出现尿道口外翻。除此外没有其他不适。曾经治疗情况和效果:以前霉菌治疗好了，而且治疗前也没什么症状，治疗后反出现我觉得没什么合理性，所以我觉得可能是治疗过程中需要取分泌物检查，还复查过，痛死！可能是这个原因导致出现尿道口的后遗症想得到怎样的帮助:请医生帮我分析和建议，有什么方法可以改善吗？好象很多人都有这问题，吃什么药都没用？
外科,泌尿科,外科,泌尿科,输尿管结石会引起这些症状吗？,我于1月21日有过一次不洁性交，一直没什么症状，没分泌物，没尿频，晚上几乎不睡觉时，只是仔细检查出支原体阳性和晨尿中发觉潜血，前两天晚上由于憋了尿，感觉到右腰、右小腹和右边的睾丸很痛，赶紧下来小便，第三天早上所有疼痛都没了，只是感觉到右腰酸涨，昨天晚上6点多又再次出现右腰、右小腹和右边的睾丸有疼痛感，因为原来我就有肾结石，所以今早就去了医院仔细检查B超，仔细检查结果如下:（1）双肾大小正常，包膜光整，结构清晰，皮质回音呈低回音，集结系回音呈中高回音，右肾窦扩展16MM，左肾窦无扩展。CDF:双肾血流呈指状
外科,泌尿科,外科,泌尿科,肾结石为什么会左肾多,我总爱得肾结石，而且绝大多数时候都是左侧肾长满结石，而右侧却没，去医院救治时也发觉患肾结石的人以在左肾为最多，想知道为什么肾结石总是左肾多？
外科,泌尿科,外科,泌尿科,女性尿完有灼热感吃什么药,"
白天小便大致正常，晚上就尿频而且去了厕所又尿不出，总是滴几滴，但是自己又控制不住，请问女性尿完有灼热感吃什么药"
外科,泌尿科,外科,泌尿科,输尿管结石手术后双管能性生活吗？,"
白天小便大致正常，晚上就尿频而且去了厕所又尿不出，总是滴几滴，但是自己又控制不住，请问输尿管结石手术后双管能性生活吗？"
外科,生殖医学科,妇产科,泌尿科,双肾结石症状有哪些,我三十二岁，男最近上厕所的时候特别疼，去医院仔细检查诊断了肾结石，请问双肾结石症状有哪些
外科,泌尿科,外科,泌尿科,尿频尿痛吃药没用怎么办,尿完后还想尿，除了尿痛，在吃妇科千金片，吃了四天了，感觉没啥用，还是痛
外科,产科,妇产科,泌尿科,尿路感染饮食方面要注意什么,感染后有什么忌口吗
外科,消化科,内科,泌尿科,包皮手术后多久能吃辛辣,无
外科,泌尿科,外科,泌尿科,包皮手术包皮切得多了点,曾经的救治情况和效果：包皮手术包皮切得多了点我今年2月份在一家2级甲等综合医院做了包皮环切术，可术后我发觉医生多切了点，感觉很不好看，术后到现在我也没过性生活。我想问的是包皮切的多了对性生活会有什么影响？除了可以插手医生的有关责任吗第一次问题补充:怎么回没影响。比如说阴茎弯曲。我觉着医生有责任在里面，没估量好
外科,神经科,内科,泌尿科,传统包皮手术多少费？,我的包皮过长了，很想去割掉它，可是担心费用太高，您好传统包皮手术有多少费？
外科,泌尿科,外科,泌尿科,没有什么尿频尿急症状是肾炎吗？,男，32岁，近段时间经常的会在半夜上厕所，一到了晚上就尿多，还有刺痛感，想先在这里问一下，没有什么尿频尿急症状是肾炎吗？
外科,泌尿科,外科,泌尿科,肾结石怎么样治疗好,我今年39岁，女，这几天小便的时候疼，也不知道怎么回事，去医院检查是肾结石，请问；肾结石怎么治疗好？
外科,泌尿科,外科,泌尿科,西安哪个医院包茎手术做得好,西安哪个医院包茎手术做得好
外科,泌尿科,外科,泌尿科,女人肾结石能影响怀孕,我跟老公离婚已经两年多了，可是一直都没怀上，最近去健康检查，发觉我有肾结石，难道我不怀孕跟这个肾结石有关系吗？
外科,生殖医学科,妇产科,泌尿科,包皮垢较多且伴有龟头瘙痒,最近一段时间（快两个月了），龟头瘙痒，包皮垢较多，必须每天擦洗，擦洗后瘙痒症状不明显，龟头光滑无化脓，冠状沟处于勃起时足见小红点，其他无明显症状化验、仔细检查结果：无曾经的救治情况和效果：无在乎怎样的协助：想问大夫是怎么回事？应该怎样治疗？
外科,泌尿科,外科,泌尿科,小便带点小血是什么原因,我最近总是感觉尿尿的时候，尿道口有一些特别不舒服，天冷的时候就是有尿尿次数增多，尿没有力气，很害怕啊，怕得很严重的疾病，请问小便带点小血是什么原因
外科,妇产科,妇产科,泌尿科,老人晚上上廁所不趕趟尿褲子怎么办,上廁所來不及，經常尿褲子
外科,泌尿科,外科,泌尿科,有过尿路结石会影响要孩子吗？,"我老公有过尿路结石，但做过手术已经好了，我想问下尿路结石影响我们要孩子吗？
"
外科,消化科,内科,泌尿科,为何我经常会尿路感染,我从去年开始得了尿路感染，刚开始吃了药，打了针，好了。后面又病了几次，我以为是卫生问题，所以特别的讲卫生，可是这一年来经常有这种症状是怎么回事啊，该怎么办呢？
外科,泌尿科,外科,泌尿科,包皮术费用需要多少,我的包皮一直都特别长，龟头从来没有现出来过，和老婆的性生活一直都不和谐，老婆一直都小气我，最近准备去医院做包皮手术，但是没理解过，您好做包皮手术需要有多少钱啊？
外科,泌尿科,外科,泌尿科,龟头和包皮有红斑怎么回事？,前几个月在网上聊了个女网友，双方聊的很愉快。一直都先见第二面，女网友也同意了。见面我们都对对方很有感觉，于是顺理成章的一同开了房，发生了性关系。但是没过几天我发现自己的龟头和包皮上有红斑。您好医生龟头和包皮有红斑怎么回事？是不是得了性病？急急急！
外科,产科,妇产科,泌尿科,割过包皮有啥要注意事项吗？,今天割了包皮想知道有啥需要有注意的没，深蹲等活动还可以做不，包皮割过之后会疼几个小时，有啥要注意事项吗？
外科,泌尿科,外科,泌尿科,尿结石是怎么形成,"
白天小便大致正常，晚上就尿频而且去了厕所又尿不出，总是滴几滴，但是自己又控制不住，请问尿结石是怎么形成"
外科,泌尿科,外科,泌尿科,男的尿出血怎么治,无
外科,泌尿科,外科,泌尿科,做完包皮手术后四五天了阴茎肿怎么回事啊,无
外科,泌尿科,外科,泌尿科,尿路感染会引起白细胞减少吗?,无
外科,生殖医学科,妇产科,泌尿科,压力性尿失禁该去哪个科室看诊？有什么治疗方法,无
外科,耳鼻喉科,儿科,泌尿科,尿道口有红点小便疼痛怎么办,去过几家医院，吃了消炎药，用了百多邦
外科,泌尿科,外科,泌尿科,尿道炎应在哪里治疗,内衣上有分泌物
外科,泌尿科,外科,泌尿科,血尿包皮长术后可以换医院换药吗？,一个星期前血尿包皮也长仔细检查说质疑是前列腺炎，现在每天去吃药说复检又没复前天把包皮给割了可以换医院换药吗？
外科,泌尿科,外科,泌尿科,包皮环切手术注意事项是什么呢？,包皮环切手术，我去了个私立医院，他跟我说要拆线，真的需要有吗，两个星期了，现在清创的地方线没掉。怎么办呢？
外科,泌尿科,外科,泌尿科,宝宝尿液不正常怎么回事?,医生您好，我家的4岁大的宝宝尿液不正常，需要怎么治疗吗？
外科,泌尿科,外科,泌尿科,术后男性尿道出血是怎么样,无
外科,泌尿科,外科,泌尿科,8*5mm的肾结石可以自行排出来吗,女，35岁，最近我媳妇和我说腰部痛，刚开始也没当回事，后来却发现却越来越严重了，之后我就在附近找了一家医院做了检查，医生告诉我媳妇换上了肾结石，8*5mm的肾结石可以自行排出来吗
外科,泌尿科,外科,泌尿科,怎样治疗滴虫性尿道炎比较好？,滴虫性尿道炎该怎么治疗？去医院仔细检查说是什么滴虫性尿道炎，得了这个病该怎么办啊？?怎样治疗滴虫性尿道炎比较好
外科,泌尿科,外科,泌尿科,伤口破皮要清理吗?,小孩四周岁包茎，在21号割包皮环切术每天要用药水泡2次，药水泡半个小时泡过后小JJ下浮起一层灰色皮一样东西清理掉的话会破皮每天重复这样好象伤口永远绝不会好一样破皮要清理吗?
外科,泌尿科,外科,泌尿科,尿尿疼痛流脓怎么能治好,无
外科,泌尿科,外科,泌尿科,有了尿道炎要怎么办才好？,男，29岁，上周上厕所时觉得好像有点不太畅快，这周觉得尿道有点疼，而且还有点分泌物，尤其是夜尿好像有点偏多，这个应该是尿路被感染了吧！请问：有了尿道炎要怎么办才好？
外科,泌尿科,外科,泌尿科,包皮翻过来后翻不回去了需要做手术吗,今天泡澡的时翻了一下包但是没想翻过来了之后擦洗完翻不回来您好这样的情况是不是要做手术？
外科,消化科,内科,泌尿科,尿路感染吃黄藤素分散片有效吗,我最近总是感觉尿尿的时候，尿道口有一些特别不舒服，天冷的时候就是有尿尿次数增多，尿没有力气，很害怕啊，怕得很严重的疾病，请问尿路感染吃黄藤素分散片有效吗
外科,营养保健科,儿科,泌尿科,做包皮手术效果怎么样,自己这段时间总是会再次出现早泄的现象，女朋说是因为自己的包皮有点过长了，所以想要自己去做个有关包皮的手术，但是自己也不确认做了手术之后会怎么样，做包皮手术效果怎么样呢？
外科,泌尿科,外科,泌尿科,病床上怎么小便呢,我前段时间做了一个大手术，需要卧床休息，我已经在病床上躺了半个月了，但是每次小便都特别困难，有时候还会尿到外面，所以我想咨询一下，在病床上怎么顺利小便？
外科,神经内科,儿科,泌尿科,割完包皮几天拆线？,做完割完包皮手术得个星期多了，想进行咨询一下这个割完包皮几天拆线？
外科,泌尿科,外科,泌尿科,尿频的症状是怎么回事呢,外阴红肿尿频，尿量少阴道早总是感觉很湿是什么回事啊，总是反反复复复发，尿常规正常。有时候解小便的时候尿道口和阴唇那里会痛
外科,泌尿科,外科,泌尿科,包皮过长常见医治措施怎么样？,婚后我们房事生活不怎么协调一致，大婚没多久老婆就发觉我有包皮长的问题。一开始我不怎么认为，后来异味越来越大，去医院仔细检查还真是包皮过长炎症。怎么办？
外科,泌尿科,外科,泌尿科,包皮手术如何治疗？,我的包皮过长，影响身体健康了。我想要去做包皮手术，因此想问下包皮手术如何治？
外科,呼吸科,内科,泌尿科,包皮长包怎么办？？,以前是个小包，碰也不疼，没在乎，现在突然变大了，一碰感觉很疼能治好吗？
外科,泌尿科,外科,泌尿科,尿路传染怎么才能缓解？,我今年25岁了，平时也不太爱喝水，不知是天气太干燥，还是闹肚子的原因。最近一直都有一些不适感，去厕所的时候特别多，还很着急，还疼，仔细检查说是尿路传染了。想问一下，尿路传染能缓解吗？
外科,泌尿科,外科,泌尿科,阴茎短小还有包皮咋办？,男盆友的阴茎短小除了包皮，有异味，每次他想要的时候都很抵触，而且感觉他也不怎么硬，十有八九时候都是做爱只办到一半儿就软了，我问他啥感觉，他总是说疼，总是建议我给他口，很烦恼怎么办
外科,泌尿科,外科,泌尿科,包皮太长与性生活有关系吗？,勃起全漏出来不勃起不漏出来平时性生活在5分钟左右有时会长许多是不是因为包皮过长的原因太敏感了，包皮过长与性生活有关系吗？
外科,泌尿科,外科,泌尿科,支衣淋全是阴性是不是不存在尿道炎了,无
外科,泌尿科,外科,泌尿科,请问这是阴囊湿疹还是阴囊炎？,长了有几个月了，一开始觉着没什么，就最近这两天长了个好大的个脓包，周围也长了好几个小小的白点点。请问这是阴囊湿疹还是阴囊炎？
外科,泌尿科,外科,泌尿科,尿道炎需要治疗多长时间?,无
外科,泌尿科,外科,泌尿科,包皮过长的治疗方式有什么呢,请问一下包皮过长早泄怎么治疗。我经过多方面的查看，已经确定自己是包皮过长了，而且我也感觉到有早泄的症状了，21岁包皮过长如何治疗?
外科,肛肠,外科,泌尿科,割包皮多少钱能做,不知晓是怎么回事，我觉的好郁闷，就是我的包皮里面有的时候会有白白的东西，起初以为是女友的白带，就没太在乎，但是后来我擦洗了之后，没碰女友，还是有白色的东西，割包皮多少钱？
外科,泌尿科,外科,泌尿科,一喝水怎么会就想要上厕所,"我一喝水就要上厕所,好象要把喝下的水排完那样子,喝的越多水上的次数就越多,其它没什么不适,请问可能是什么问题?"
外科,神经内科,儿科,泌尿科,月经后第六天同房出血怎么回事,"月经第六天,已经没有了,同房后一觉醒来阴到有点血同房后"
外科,生殖医学科,妇产科,泌尿科,男性包皮过长手术费多少呢？,孩子这几天总是说自己尿尿今天我看他的小鸡鸡头处泛而且感觉好象有点包皮就像带他去做一下包皮过长的手术。市区男性包皮过长手术费大概需要有有多少呢？
外科,泌尿科,外科,泌尿科,小孩尿道口下裂裂口不到1厘米用做手术吗,主要症状尿道下裂裂口不到1厘米:发病时间出生就有:化验检查结果尿道下裂:曾经治疗情况和效果无:
外科,泌尿科,外科,泌尿科,水麻叶能治肾结石吗,前几天突然感觉腰不疼的特别厉害，后来到医院仔细检查后，医生说是肾结石。所以想用中药来治疗，据说水麻叶有好些功效，不知晓水麻叶能治肾结石吗？
外科,泌尿科,外科,泌尿科,小便分叉怎么改善,全部症状:小便分叉，射精有些痛，四肢无力腰有些酸痛发病时间及原因:发病时间在5前原因可能是性生活在频繁引起治疗情况;没有治疗过想要得到的帮助:请医师告诉我怎么治疗
外科,泌尿科,外科,泌尿科,包皮过长的临床表现有哪些呢？,我也不确认是不是有包皮过长的情况，主要情况就是在勃起的时候龟头可以现出来，但是在疲软的时候却不能够现出来，除了，最近感觉龟头又痛有痒，想抓去不敢抓。包皮过长的临床表现有哪些呢？
外科,消化科,内科,普通外科,怎么治疗右上额窦炎,患者女，43岁，流清鼻子，有时额头部疼痛，右边眼眶下边疼痛，有绿黄色鼻涕
外科,普通外科,外科,普通外科,右小腿后软组织拉伤有血肿块怎样会好,已有十几天了经诊断是右侧小腿肌肉拉伤有血肿
外科,普通外科,外科,普通外科,一侧腰疼是什么情况,我23岁，男睡饱后腰疼，蹲下弯身抬腿都疼，有点肿，是不是肾有毛病，请问一侧腰疼是怎么回事
外科,普通外科,外科,普通外科,前列腺癌多处转移怎么解决,"之前一直身体不错，血压血糖血脂等老年人常见的症状，他都比较正常。去年冬天开始小便困难，腰椎疼痛有好几年了，间歇性的，检查过说椎体骨质增生，伴有骨刺，腰2、3椎体后突，疼的时候就贴点止疼膏药或服用止疼药，今年初小便困难加剧，在当地医院检查是前列腺肿大，服用保列治和哈乐两种药物后有所改善，到今年6月份骨痛加剧，就一直卧床，在忻州市医院检查后医生不要求做磁共振，还是腰间盘突出加骨刺年龄大了也无需手术，小便也只能靠尿管，服用止疼药物也没有效果，疼痛时强时弱持续了近两个月，饮食一直很差，到8月3日突然不疼了，接着双腿无知觉，吐过几次黑水，内热，经检查前列腺Ca伴盆腔淋巴结和骨盆骨质多发转移，胸12至骶椎多发骨转移瘤。
目前病人体质较弱，双腿无力，左腿能在大腿根的带动下轻微晃动，掰动双脚脚腕有麻胀的知觉，摁脚趾无感觉"
外科,普通外科,外科,普通外科,疝修补术后几天下床活动？,宝宝在查出得有疝气之后，就在医院的医生的安排下做了疝气手术。不过宝宝在手术后一直是想活动，我想请问一下疝修补术后几天下床活动啊？
外科,普通外科,外科,普通外科,老年疝气是怎样形成的？,老年小肠气，妈这些时日往往感觉有一些身体不是很舒适，后来专家对他进行诊断才知道这是因为她出现了小肠气现象造成的，请问老年小肠气是怎样形成的？
外科,普通外科,外科,普通外科,站久了，弯腰时腰疼,"站久了,包括走路,坐车站立.弯腰时就会酸痛,感觉像弯不下腰一样,位置要腰中间近期,好像是有天晚上,出了汗,光着身起来打蚊子."
外科,消化科,内科,普通外科,男18岁，腰痛了一个多月了，一弯腰就痛,无
外科,肛肠,外科,普通外科,我孩子一个月前劲部有一个淋巴结是由炎症引起的,我孩子一个月前劲部有一个淋巴结是由炎症引起的淋巴结不需吃药，
外科,普通外科,外科,普通外科,骨折手术后食欲不好怎么办？,无
外科,普通外科,外科,普通外科,初期疝气有什么治疗方法？,近一个来月，祖母往往感觉下腹部坠胀，便便拉不出也比以前严重，略微腹痛，时常感觉疲倦，身体也没那么好了，晚上的时候时常性的拉尿次数多，小便很急，抽时间去一家医院看讲是小肠气。初期小肠气怎么治疗方法？
外科,神经内科,儿科,普通外科,什么是21三体综合症,无
外科,产科,妇产科,普通外科,大网膜（腹腔）结核怎么治疗,"胸腔积液（少量）,盆腔腹腔积液2009年9月4日持续低烧至今"
外科,普通外科,外科,普通外科,右下腹坠胀是不是疝气?,晚上在睡觉的时候感觉右下腹有坠胀的感觉，很长时间都没有睡着，不知道该怎么办，不知道是不是疝气，我想知道右下腹坠胀是不是疝气呢？
外科,普通外科,外科,普通外科,什么是结肠癌的放疗禁忌症,结肠癌的放疗禁忌症
