department,finaly_result1,finaly_result2,dep,title,ask
外科,神经脑外科,外科,神经脑外科,帕金森综合症晚上总是上不来气怎么办？,我是个帕金森综合症患者，晚上后半夜总是上不来气，怎么办？
外科,神经脑外科,外科,神经脑外科,患脑瘫的症状有哪些?,妹妹的女儿六月大，可是到现在还不会翻身，和他同时出生的邻居女孩却要比他看着懂事的多了，都会坐了，妹妹要我和他带着女儿去县里的医院看看去，怀疑是脑瘫，脑瘫都有哪些症状表现 想得到怎样的帮助：脑瘫儿的症状表现都有哪些
外科,神经脑外科,外科,神经脑外科,儿童脑瘫治疗仪,我妹妹是个脑瘫儿，听妈妈讲是因为当时怀孕后一直在外婆家过的，外婆家住在深山里在那里一直没有出外面，更别说去医院检查来，结果生下了个妹妹，还是个脑瘫儿，为此妈妈也十分的后悔自己当初的想法。
外科,内分泌科,内科,神经脑外科,脑供血不足吃什么中成药,病情描述:就是时常感觉头昏，，，老想躺的曾经治疗情况和效果:以前也会有些昏，，感冒时严重些想得到怎样的帮助:就是咨询一下吃什么药比较好
外科,消化科,内科,神经脑外科,怎么样防止脑中风复发？,"后出院.出院后仍觉头脑不清醒,宛如在梦中一般,于是我决定出外旅游散心.从10月1日玩到11月1日,从珠海澳门玩到西双版纳大理丽江,回来后病情大有好转,那种梦境一般的感觉已基本消失.现在关键的问题是不知怎样防止脑中风的复发,因为我患的中风是两种类型（出血与栓塞）都有,我对医学一知半解,认为:脑出血是高血压所致,而脑栓塞则是血压不够高所致,（这次中风前的一两个月,我曾老是嗜睡,医生说是脑供血不足,是否"
外科,神经脑外科,外科,神经脑外科,北京看脑瘫出名的医院都有哪些？,哥哥家的小宝贝由于是个早产儿导致了脑瘫了由于不懂得如何护理现在宝宝都不能走路吃饭还要人喂家里的条件有限也没能给好好的治疗现在想给治疗。
外科,计划生育,妇产科,神经脑外科,偏瘫导致上肢肌肉萎缩怎么办,偏瘫导致上肢肌肉萎缩怎么办？
外科,神经脑外科,外科,神经脑外科,脑溢血后遗症,无
外科,神经脑外科,外科,神经脑外科,垂体瘤术后可否吃中药,垂体瘤术后不想放疗，吃中药可以吗？
外科,神经脑外科,外科,神经脑外科,昏迷病人的护理要点及方法,患者性别:患者年龄:问题描述:
外科,妇产科,妇产科,神经脑外科,我三叉神经痛这个病一年了一直吃药不吃药血糖就,我三叉神经痛这个病一年了一直吃药不吃药血糖就上来了我该怎么办？
外科,神经脑外科,外科,神经脑外科,我一个亲戚左边手脚无力在医院检查说是脑瘫又说,"患者 男 38岁    以前身体很强壮   此次病情   左边手脚无力使不上劲

"
外科,营养保健科,儿科,神经脑外科,脑梗塞后遗症哪种药有效？,2004年半身不遂曾经的治疗情况和效果：株着拐杖可走20米在乎怎样的帮助：寻到能自食其力的药方
外科,消化科,内科,神经脑外科,北京儿童缺血缺氧性脑病哪家医院好一点？,右脑出现软化灶，发病一个月了，左侧肢体不灵活，伴有痉挛
外科,神经脑外科,外科,神经脑外科,请问癫痫会遗传小孩吗？,您好癫痫会隔代遗传小孩吗？我和我老公想要小孩可是我们有癫痫病。如果会隔代遗传我们就不要小孩了。
外科,神经脑外科,外科,神经脑外科,中风偏瘫如何针灸治疗,中风，高血压，中风偏瘫，一般怎么治疗好啊，针灸是最有效的方法吗 
外科,神经脑外科,外科,神经脑外科,脑震荡后头痛如何缓解,我前段时间开摩托车的时候，不小心摔到了头部，去医院仔细检查，稍微有点脑震荡，当时没什么感觉，过了段时间后，我察觉到出现头痛，脑震荡后头痛怎么办？
外科,神经脑外科,外科,神经脑外科,15岁中学生 重度脑瘫,五年脑瘫患病时间长 头疼 说胡话
外科,消化科,内科,神经脑外科,多发腔腺性脑梗塞怎么办？,前段时间再次出现了头晕头痛的症状，后来直接有些意识模糊，被带到医院之后验证是得了脑梗塞，经过详细的仔细检查诊断是多发腔隙性脑梗塞，想要进行咨询一下得了这种病应当怎么治疗效果才比较好呢？
外科,神经内科,儿科,神经脑外科,老年人头晕是怎么引起的,身边有个朋友最近一直喊头疼而且有时候会抽风，也不想去医院检查，请问老年人头晕是怎么引起的
外科,肛肠,外科,神经脑外科,脑梗塞会引起眼睛左侧看不清楚吗,脑梗塞右枕叶阻塞后遗症为什么眼睛左侧看进去在动偏盲呢．
外科,神经脑外科,外科,神经脑外科,脑梗塞后遗症头晕等症状,男33较近一段时间特别容易累，也干不了活，这是让家人挺担心的，请问脑梗塞后遗症头晕等症状
外科,耳鼻喉科,儿科,神经脑外科,水蛭对治脑梗塞有作用吗?,病发至今43天，在康复中，三高都有，右上半身崩溃，失语。
外科,神经脑外科,外科,神经脑外科,小儿脑瘫有哪些危害,我的孩子都好几个月了可是跟正常的孩子很不一样，现在不仅不会爬不会翻身，头也特别沉好像抬不起来，孩子也不是很胖总是流口水，逗他时也不爱笑，带孩子检查才知道是脑瘫，不知道脑瘫的危害有哪些啊。
外科,神经脑外科,外科,神经脑外科,脑炎后遗症有哪些办法治疗,身边有个朋友最近一直喊头疼而且有时候会抽风，也不想去医院检查，请问脑炎后遗症有哪些办法治疗
外科,内科,儿科,神经脑外科,"间隙性脑梗塞怎么能很好的控制治疗,谢谢",我家老人经常性会出现手臂大腿不停哆嗦的毛病，走路时候腿脚也不好使，量过血压血糖都正常，去医院检查了结果是得了间歇性脑梗塞，这个病要怎么样才能很好地控制它发作呢
外科,神经脑外科,外科,神经脑外科,小儿脑瘫是怎么引起的，有什么原因吗？,小儿脑瘫是怎么引起的，有什么原因吗？
外科,神经脑外科,外科,神经脑外科,求问脑溢血后遗症怎么办？,脑溢血后右手完全不能够动脑溢血致使曾经的治疗情况和效果：做手，胳膊等局部推拿在乎怎样的帮助：如何才能彻底恢复，
外科,普通外科,外科,神经脑外科,治疗帕金森那个医院最好？,我这个月以来双腿总是难以描述的酸，胀，麻木，但是经敲，捶打后可缓解。去医院检查，医生说是帕金森。
外科,妇产科,妇产科,神经脑外科,脑淤血导致右半边身体瘫痪，最近做康复恢复不错,脑淤血导致右半边身体瘫痪，最近做康复恢复不错，但是，出现，右胳膊出虚汗的状况，想咨询一下，这是怎么回事？
外科,产科,妇产科,神经脑外科,脑溢血后遗症怎么恢复,脑溢血后遗症（认知障碍右手脚无力）
外科,生殖医学科,妇产科,神经脑外科,面神经损伤怎么办，如何快速恢复,8月5日晚由于车祸造成左眼眶下框骨折，现在左侧鼻孔周围及左侧嘴唇周围麻木，说是面神经断裂或是损伤
外科,神经脑外科,外科,神经脑外科,腔隙性脑梗塞症状,女主要症状:我母亲前两个星期头晕，吃点药就好了，3月17号突然头晕的站不起来，恶心呕吐的厉害，到医院作脑部核磁医生说是脑部小血管里有多处小腔点，还没形成血栓，住院输了6天液，现在好点，但是每天凌晨两三点钟还是头旋恶心一阵，睡眠不好，输的液体就是按脑血栓病人用药，查血脂有点高，血压正常，血常规，血糖，肾功能，尿常规都正常，
外科,神经内科,儿科,神经脑外科,患有癫痫病的原因到底有什么,我孩子刚上初中 今年12岁  家里没有癫痫病史  但是后期居然检查出了患有癫痫病   出了遗传  还有别的患病原因吗 ？  到底是什么导致的癫痫病呢 ？
外科,神经脑外科,外科,神经脑外科,脑瘫想在暑假做包皮手术要特别治疗吗,脑瘫儿童，12岁，包皮长，想在暑假做手术，需要特别治疗吗
外科,普通外科,外科,神经脑外科,息宁的药哪里能买到,颤抖走路困难
外科,神经脑外科,外科,神经脑外科,脑梗塞可以吃这种药吗?,我母亲脑梗塞有五年啦，在这五年期间住院三次，现在可以要自立，走路也可以，吃晚饭也可以就是答话不清，我父亲让我母亲胡喝药，现在又让吃脉络宁颗粒，我想进行咨询几下医生可以吃这种药吗，
外科,神经脑外科,外科,神经脑外科,哪里是北京是治疗脑梗塞的首选医院,"右腿有知觉,会笑,双腋有知觉,右手也有知觉"
外科,神经脑外科,外科,神经脑外科,轻度脑梗塞应该如何治疗呢?,朋友的妈妈又轻度的脑梗塞。平时血压不稳定。有的时候最大的时候能超越180，有的时候也是120，除了晕眩。有的时候晕眩完全不能够上床睡觉，您好如果想要彻底救治或者不在加重病情应当如何治疗呢？
外科,神经脑外科,外科,神经脑外科,脑梗塞的前期症状?,脑梗塞怎么治疗身体一直好好的，前几天早晨醒来嘴角有点歪斜，说话不清楚了。
外科,神经脑外科,外科,神经脑外科,脊髓肿瘤术后麻木疼痛是否正常？,核磁显示是脊髓肿瘤，在医院做了肿瘤切除手术，病理报告为脊髓髓内室管膜瘤二级（C4-6），手术后十天拆线出院了。现在手术完已经一个月了，胸部以下还是麻木的，右边肩膀空着痛，痛感很强烈。
外科,神经脑外科,外科,神经脑外科,脑神经痛睡不着有什么药可以治疗,你好，我最近脑神经通的睡不着，有什么药可以治疗？第一次问题补充:　　你好，可以采取什么措施吗，喝点什么药？
外科,神经脑外科,外科,神经脑外科,防治二次中风可选什么中成药？,我父亲今年53岁，过去有高血压，去年年底心肌梗塞后，做了心血管支架手术，术后彻底恢复很好，目前血压正常。但是10月4日，再次出现了中风，致使嘴歪眼斜。去医院仔细检查，从CT上并没有瞧出脑部有任何病灶，西医建议服食中成药并互相配合理疗，并告之两周后才可以实施针灸救治；但是，中医建议现在就已经开始实施针灸救治，到底怎么治？
外科,神经科,内科,神经脑外科,孩子脑瘫疾病该去哪治疗,了，不会走，不会坐，特别爱哭闹，有时候一哭就上不来气
外科,神经脑外科,外科,神经脑外科,颅内穿刺手术,颅内积血、积液做颅内穿刺手术是否安全有效？
外科,神经脑外科,外科,神经脑外科,完全治好脑瘫一共需要花费多少钱呢？,"公公是突然间得了脑瘫这个病的,因为来的太突然了,让我们措手不及啊,住院治疗了一段时间,现在回到家里了."
外科,神经脑外科,外科,神经脑外科,帕金森影响智商吗？,家人得了帕金森，经常反反复复的病发，常年喝药输液还是没转好的迹象，有人说这个病将来会影响智商，我就是想问问这个病到底会不会影响智商。我想验证一下在乎怎样的帮助：帕金森影响智商吗？
外科,神经脑外科,外科,神经脑外科,植物人可以催醒吗,2014年十月由于脑出血过多 手术后变植物人 经过一段时间治疗
外科,内分泌科,内科,神经脑外科,老人血栓应该怎么办,我父亲今年74岁，在25天前，突然血栓送到医院。确诊为颅内两条之一的主动脉血栓（心源性栓子），手术融栓，结果没有疏通。我父亲是10多年前得过心梗，好了后始终没有再犯过。目前，我父亲在医院恢复不错，除了左半身上下都没有知觉（零度）外，意识、语言、喝水、大小便等都恢复不错，有望继续恢复。但是，目前的右脑血液是靠左侧血管的枝线供给，弱不惊风，怕再有栓塞的话就会立即丧失某些功能。另外，听说目前有医生能在
外科,营养保健科,儿科,神经脑外科,脑萎缩治疗好办法是什么？,前几天在电视剧上，看见了个年过60的老奶奶，那个老奶奶出了车祸，大概已经有一年多的时间了，现在人已经再次出现了脑萎缩的情况，他家人非常想给他治好，脑萎缩治疗好办法是什么呢？
外科,神经脑外科,外科,神经脑外科,家族有帕金森遗传怎么办,我们家族有帕金森隔代遗传。我爷爷就是帕金森。我和我叔叔。都是手抬起来的时候手自然有轻微的颤动。应当怎样预防工作？
外科,神经脑外科,外科,神经脑外科,脑梗塞后遗症有哪些?,姥爷患了脑梗塞大半年了，之前一直是服药控制，前段时间刚动手术，现在是静养着，平时饮食都很留意，不知晓以后会不会有后遗症，脑梗赛的后遗症有什么
外科,神经脑外科,外科,神经脑外科,脑梗塞的症状及九种治疗方式有什么？,脑梗塞患者可不要以做手术的？脑梗塞的症状及九种治疗方式是什么？
外科,神经脑外科,外科,神经脑外科,新生儿脑瘫该不该舍弃,今天遇见老同学，瞧见他一脸苍老，原来是他小宝宝不怎么睡午觉，爱哭，吃奶也费劲，全家很着急，抱到省上的医院去仔细检查，结果是脑瘫，他们全家正陷入悲伤，您好新生儿脑瘫该不该舍弃？
外科,神经脑外科,外科,神经脑外科,癫痫的症状是什么呢,癫痫的症状是什么呢
外科,神经脑外科,外科,神经脑外科,面肌痉挛手术后多久可以恢复,手术做完多长时间方才能彻底恢复脑袋里面还不适应低头久了伤口沉困在乎的帮助：手术做完多长时间方才能彻底恢复脑袋里面还不适应低头久了伤口沉困
外科,神经脑外科,外科,神经脑外科,脑梗塞应该如何治疗有效,我的父亲平时好好的，不知怎么了，突发脑梗塞，我们家里人都吓坏了，请问脑梗塞应该如何治疗有效
外科,肛肠,外科,神经脑外科,头晕出虚汗怎么回事,无
外科,产科,妇产科,神经脑外科,脑膜炎患者还有救吗？,"我有个祖父得了脑膜炎，在医院已经住了快一年了，基本已经瘫痪．请问一下有没有办法可以治疗啊？
急盼回音，不胜感谢！第一次问题补充:转为慢性后没发治疗了吗?谢谢第二次问题补充:没有办法了吗?第三次问题补充:很感谢您的回答,我是帮朋友问的,他的祖父已经在医院度过两个春秋了,一直瘫痪,家里人都比较灰心,所以想问问目前有没有好的办法,寻求希望而已,再次像您表"
外科,泌尿科,外科,神经脑外科,患帕金森十几年还能治好吗,身边有个朋友最近一直喊头疼而且有时候会抽风，也不想去医院检查，请问患帕金森十几年还能治好吗
外科,神经脑外科,外科,神经脑外科,高血压脑梗塞可以吃鱼吗,我公公有高血压血脂高脑梗塞，他又爱吃鱼，这病能吃鱼吗？
外科,肛肠,外科,神经脑外科,多发腔隙性脑梗塞是什么疾病,医生说我是多发腔隙性脑梗塞，我没听说过这个疾病，多发腔隙性脑梗塞是什么疾病？
外科,神经脑外科,外科,神经脑外科,我想知道我的孩子到底是不是脑瘫？,CT显示大脑很正常，可是在康复中心看了说孩子可能是脑瘫。 曾经的治疗情况和效果：出生一个月做CT显示也是正常的想得到怎样的帮助：我想知道我的孩子到底是不是脑瘫
外科,妇产科,妇产科,神经脑外科,老人患脑梗塞会不会瘫痪,你好，医生我想了解下脑梗塞会不会瘫痪？？？？:
外科,神经脑外科,外科,神经脑外科,脑积水治疗方法怎样,我的奶奶换脑积水已经一年了，一直采用的药物救治，但是不怎么起效，但是我们家都想让她全愈。所以我想问几下医生脑积水治疗方法怎样比较好？
外科,神经脑外科,外科,神经脑外科,严重脑震荡后记忆力衰退怎么办,以前我记忆力超好的但后来我有过一次严重脑震荡在那期间我没好好休息现在我的记忆力非常差头经常昏昏的这是遗留下后遗症了吗
外科,神经脑外科,外科,神经脑外科,我妈妈偏瘫10多年了还有康复的可能吗？,"全身无力嘴歪,时有大小便失禁.97年得病,血栓."
外科,神经脑外科,外科,神经脑外科,老年人脑积水 治疗,无
外科,内分泌科,内科,神经脑外科,中风后遗症怎么解决？,患中风，偏瘫。环湖医院。曾经的治疗情况和效果：住院后，扎针灸。病情转好。能站立走路。在乎怎样的帮助：天天锻练。就是右侧筋短，走路费劲。您好有锻练能使筋长的器械吗？
外科,神经脑外科,外科,神经脑外科,脑梗塞的前兆性症状有哪些,请问有关专家这是不是脑梗塞的前兆?
外科,计划生育,妇产科,神经脑外科,小脑萎缩的症状与治疗都有哪些？,我叔叔就是最近一直觉着头晕，医生说是可能会是脑萎缩，我想问问医生，小脑萎缩的症状与治疗都有哪些？
外科,神经脑外科,外科,神经脑外科,脑供血不足输液用培他啶行吗？,无
外科,神经脑外科,外科,神经脑外科,哈尔滨哪个医院治疗脑瘫,四肢、脊柱肌肉张力高，不能坐，翻身，不能拿物，不能自主进水、进食、剪刀脚
外科,营养保健科,儿科,神经脑外科,小脑萎缩的症状都有哪些呢,小脑萎缩从脑细胞已经开始增加（核磁共振已经能瞧出有变动），到病人自身有所感觉，比如走路不稳等初级症状，小脑萎缩的症状都有哪些呢
外科,神经内科,儿科,神经脑外科,小脑萎缩的症状初期有哪些表现？,最近总是感觉脑子痛，而且还会头晕，很怕自己得了小脑萎缩，因此想问小脑萎缩的症状初期有哪些表现出？
外科,普通外科,外科,神经脑外科,七个月宝宝有这些症状，是不是得了脑瘫？,了，还不会坐；抱着能抬头，但不大喜欢抬，喜欢趴在肩上；躺在床上喜欢两个脚抬起用力蹬；翻身也是6个月左右才会的；还有就是拖着他让他站，好像喜欢用脚尖。请问这些症状是不是脑瘫啊？
外科,神经内科,儿科,神经脑外科,脑骨质增生如何处理,2006年，当时头疼，做CT查过好多医院，症状是，左侧额顶骨见卵圆形异常信号影，T1w呈现等信号，T2WI呈等高混杂信号，境界交清，临近额叶受压，双侧大脑半球对称，灰白质对比正常，未见局灶性信号异常，各脑室，脑池大小形态正常，中线结构居中，幕下小脑，脑干无异常。左侧上颌窦粘膜增厚。
外科,神经内科,儿科,神经脑外科,轻度脑梗塞怎么治疗需要注意什么吗,检查结果是右额叶见片状低密度灶，边缘模糊，幕上脑室略扩张，边缘圆钝，脑沟裂增深增多，中线结构居中。腔隙性脑梗塞，轻度脑积水，轻度脑萎缩
外科,神经脑外科,外科,神经脑外科,脑外伤出院可以做哪些康复训练,脑外伤车祸3月15日晚，出院后做事迷迷糊糊，中心医院
外科,神经脑外科,外科,神经脑外科,脑血栓引起的脚肿怎么治,我平时的伴随症状（食欲好，食量大，睡眠可以，大小便还行，）12年了，最近淋了大雨。但能自理，现在56岁了。我现在想了解的是怎样冶我的脚脱肿。平时经常吃着降压药。
外科,泌尿科,外科,神经脑外科,请问为什么会眩晕,今天午后2；00钟先怕热，接着晕眩、四肢无力、出冷汗，直到现在还怕冷
外科,神经脑外科,外科,神经脑外科,小孩快两岁确诊为脑发育不全怎么办,走路左腿有点软，后来检查确诊为脑发育不全。这该怎么治疗啊？
外科,消化科,内科,神经脑外科,陕西治疗癫痫病最好的专科医院是哪个,贫血血糖高发作像是癫痫病一样但是发作前没有一点提示。
外科,计划生育,妇产科,神经脑外科,脑部疼痛并迷糊如何治疗,治疗情况:未见好转想要得到的帮助:发病原因，如何治疗
外科,神经脑外科,外科,神经脑外科,如何治疗头颅修补后遗症,病情描述:您好，我于2000年在福建省解放军医院做了颅骨修补。我现年２9，身体健壮，手术后恢复的很好，去年有时候会头疼，过几天就会自行不痛，今年从4月中旬左右开始痛，到现在一直是轻微的头疼，严重影响睡眠，请问这跟手术有关系吗？曾经治疗情况和效果:治疗过，一直就是头痛。脑CT，脑电图都有做过，查不出所以然想得到怎样的帮助:有什么好的治疗方法吗？有没有什么检查方法！
外科,妇产科,妇产科,神经脑外科,孩子小脑积液7MM怎么办,"我怀孕5个时做B超说孩子小脑积液7MM,以后再做时也没有再发展一直到出生还是7MM.现在我儿子8个月了一切正常,那小脑积液这个问题还用不用担心.用不用检查,像小脑积液会有什么表现.谢谢!第一次问题补充:到多大能完全扣除呢,为什么要定期检查呢,如果等他长大检查如果没事的话是不是就能放心了呢.第二次问题补充:像这种现象会不会自然消失呀?那多大可以做头部的检查呢?"
外科,神经内科,儿科,神经脑外科,两位长辈有癫痫病我会不会也得癫痫病,大小便失禁，清醒了什么事情都不记得了。
外科,生殖医学科,妇产科,神经脑外科,三叉神经痛是什么原因引发的,平常村里谁家的狗来他家啦，都会给狗东西吃，她家自己也养有两条狗，今年51回家玩时，总是听伯母说自己头痛，而且严重里来，痛得她吃晚饭都吃不下，昨天去医院看，医生说伯母患三叉神经痛。在乎怎样的帮助：三叉神经痛是什么原因引起的
外科,神经脑外科,外科,神经脑外科,小脑萎缩抽搐有时清醒或者糊涂怎么办,老人88岁小脑萎缩，经常全身抽动有时候一天，有时候清醒有时候糊涂，卧床7年了不能够自食其力
外科,神经脑外科,外科,神经脑外科,帕金森氏病早期症状有哪些？,男，65岁，我爷爷这一段时间手老是抖得厉害，拿不稳东西，有时候不由自主地流口水，别人说这是帕金森的症状，帕金森氏病早期症状有哪些？
外科,神经脑外科,外科,神经脑外科,脑梗塞有哪些症状？,脑梗塞有哪些症状？
外科,神经脑外科,外科,神经脑外科,中风要怎么治可以康复,前两天在医院仔细检查发觉得了脑中风后遗症。中医脑中风要怎么治？
外科,计划生育,妇产科,神经脑外科,脑出血引起头晕怎么办,96年脑梗过一次，输了一月的液好了。2009年脑出血，输液后有后遗症，说话不很清，左腿略有不稳感觉，脑子反应慢。后来也出现过轻微脑梗，现在头一直晕，输液，吃药只管三天。过后还晕 
外科,神经科,内科,神经脑外科,在五年前开始小脑萎缩发病怎么办？,在五年前已经开始小脑萎缩病发，生存不能够完全自食其力(可以走路，已经糊涂但是可以认人)，有腔梗，过了一段时间，完全不能够自食其力(无法走路，可以认人)脑血管梗塞，压制腿神经和干咽神经(四年前医院的仔细检查确诊)，期间点过打通血管的药，住过四回院。干咽费劲，排便困难，痰多，呼吸困难，基本无法答话，现在已经吃不下去饭了，不知晓该怎么办，如何解决以及照料老人？
外科,神经脑外科,外科,神经脑外科,运动神经元病与外伤有关系吗,"主要症状:一年前外伤后开始出现上肢无力,逐渐扩大至全身.发病时间:08.5.12化验检查结果:广泛神经元损害"
外科,妇产科,妇产科,神经脑外科,九个月去检查说有少量脑积水如何处理,我宝宝九个月去检查说有少量脑积水，发育都很正常，有必要打针吗
外科,神经脑外科,外科,神经脑外科,脑梗塞入院治疗病情加重，正常吗,我爸爸高血压已有8年，今年2月16日感觉反应迟钝，视力模糊，血压180/120.在家输液，无明显改善。2月19日入院诊断为脑梗塞，医生根据CT说梗塞位置较好。7天后将慢慢恢复，现在7天过去了，血压倒降下来了，但病情反而加重，左手感觉无力，双脚不灵便无力，走路需要人搀扶。这正常吗
外科,神经脑外科,外科,神经脑外科,怎么处理大小便失禁,2年无法行走
外科,产科,妇产科,神经脑外科,真有无色无味让人昏迷的药吗,真有无色无味让人昏迷的要吗?
外科,神经脑外科,外科,神经脑外科,三叉神经痛应当如何治疗才稳妥？,女，40岁，得病后，吃药也没有什么效果，还是不舒服，请问：三叉神经痛应当如何治疗才稳妥？
外科,消化科,内科,神经脑外科,治疗癫痫病的最好办法是什么？,孩子得了癫痫病，治疗癫闲病的最好办法是什么是药物还是手术手术能确保治好吗？
外科,神经脑外科,外科,神经脑外科,脑溢血后遗症应该怎么治,脑溢血后遗症怎么治
