department,dep,title,ask
外科,神经脑外科,拔牙会损伤神经吗,我有颗蛀牙，一开始没事最近吃东西不能着冷着热的，所以我决定拔了它。可是拔了以后，总感觉一边神经疼，而且记忆力还有些减退，难道拔牙影响了神经？
外科,神经脑外科,右锁骨骨折取钢板过程中二次骨折怎么办,你好，医生！我是2013.12右锁骨骨折，做了钢板固定手术，今年4.2日取钢板醫生把我右锁骨又弄成骨折了，用可思针固定了！我想问我这需要多长时间可以恢复，会不会以后影响工作生活?
外科,神经脑外科,中风偏瘫后遗症服用清血八味片能否得到改善呢,吞咽困难，左半边肢体麻木，双手无力，只能够做一些简单的动作，常流口水，嘴巴和眼睛歪斜，讲话的时候表达不清
外科,神经脑外科,因外伤导致腰椎中枢神经损伤,无
外科,神经脑外科,多发性脑梗塞应咋办?,脑内多发性脑梗塞叫基底动脉间综合评价证入院8天，用药中，现在经常头痛怎么办什么原因
外科,神经脑外科,脑梗塞有必要输液预防吗?,病情叙述头疼、头晕，有一年。并血压高。因外伤曾做过脾脏切除术
外科,神经脑外科,儿童脑瘫早期症状是哪些,孩子再次出现嚼和吞咽困难，淌口水，不追视。现在症状是左脚跟不着地，右手内收绝不会拿东西，一星期前在班上昏倒老帅说手脚有抽动。是脑瘫症状么在乎怎样的帮助：儿童脑瘫早期症状是哪些
外科,神经脑外科,请问脑萎缩治疗方法有哪些,爷爷已经很老了，最近他经常头胀痛，头昏。口服过中药，头痛转好，现在有头昏，医生说是脑萎缩，您好这是怎么回事？需要有怎么治疗？
外科,神经脑外科,运动神经元损伤的危害是什么？,我弟弟爱好体育，经常参加一些比较高危的活动，上周从高台掉下来，引发现在左脚行动不便，肌张力减低、局部姿势照射消失、下肢腱反射消失。?运动神经元损伤的危害是什么？
外科,神经脑外科,得了面肌痉挛现在针灸一天了想问问有什么好的方,得了面肌痉挛现在针灸一天了想问问有什么好的方法没有针灸会不会刺激到？
外科,神经脑外科,脑梗塞引起大夸疼痛吗?,"病发1年,原因是一侧手脚麻木,血压高150-170/80-90"
外科,神经脑外科,由癫痫引起的后遗症有哪些？,我同事的小孩才11岁就患癫痫，得了癫痫以后能遗留下后遗症吗？由癫痫引来的后遗症有哪些？
外科,神经脑外科,癫痫病有哪几种治疗方法,孩子晕倒之后一直在抽搐，我现在都是一直不知道应该怎么办的啊，我很着急的，该怎么治疗啊？
外科,神经脑外科,颞叶癫痫手术治疗后会有什么后遗症？,女，44岁，家里人突然出现了，流口水、头痛、呕吐，特别的吓人，别人都说是癫痫的症状，请问颞叶癫痫手术治疗后会有什么后遗症？
外科,神经脑外科,脑瘫痪的治疗方法有哪些的？,最近回老家看姥爷才知道，表弟身体不是很好的，一直出现无力及痉挛，下肢较上肢明显，无力首先累及内收肌的情况，医生说有可能是患了脑瘫，怎么办才呢？
外科,神经脑外科,脑出血患者大小便失禁该怎样护理,脑出血治疗后左腿能动但是下不了地，大小便没有感觉，处于失禁状态，现在正下着尿管，怎样才能让老人恢复正常大小便
外科,神经脑外科,满月的孩子做脑ct对大脑发育影响大吗？,因为早产，担心孩子的发育情况不好，就去医院，医生建议作脑ct，孩子吃睡玩都正常，我在犹豫做不做？请问各位专家，听说ct辐射量很大，孩子这么小，做了以后会不会有什么后遗症？
外科,神经脑外科,锁骨骨折后留下的钢板，经多长时间取出最佳,医生你好，我今年19，两年前的一次意外导致左锁骨断裂，之后做了手术，被固定钢板。到目前为止，钢板在体内已有两年了，因为一直比较忙，没有时间取出，身体也没什么不适。我想问下，钢板在体内时间长了，会有哪些后果。今年过年再取，算晚吗？锁骨骨折的人平时都应注意些什么呢，谢谢
外科,神经脑外科,请问得了这个病还有医治嘛,发病我不知道
外科,神经脑外科,癫痫发病是有哪几大病因呢？,今年22岁，女性，癫痫发作一般在晚上十点左右，症状为抽动和干呕。以前都是吃药抑制治疗，但近期有发作了，请问癫痫发病是有哪几大病因呢？
外科,神经脑外科,癫痫孕妇失眠多梦怎么办,无
外科,神经脑外科,腔隙性脑梗塞是什么病,60岁的亲戚患上了腔隙性脑梗塞，准本帮他买许多药，您好什么药物能有效救治腔隙性脑梗塞?
外科,神经脑外科,头疼时从外边按会疼吗,左边头会时不时的疼，并且从外边按按也会疼
外科,神经脑外科,急性脑梗塞咋治疗呢?,我的身体比较肥胖，血压有点偏高，但有在吃降血压药，前两天在睡午觉的时候，突然感觉到胸口好闷，好像透不过来，想吞口水很难，头脑晕晕的，想讲话，又很难开嘴，后来老婆叫镇上的医生过来帮我仔细检查，医生说是急性脑梗塞。
外科,神经脑外科,癫痫病对人们的健康带来了什么危害？,癫痫病往往会忽然发作，没有如何前兆，每次发作都会给癫痫患者带来不小的危害，癫痫病对人们的健康带来了什么危害？
外科,神经脑外科,老人小脑萎缩怎么办呢？,老人小脑萎缩怎么办，怎么治疗小脑萎缩才是最好的，用什么方法救治？
外科,神经脑外科,帕金森综合证是什么原因,我男友的父亲45岁得了帕金森综合证，而男友的伯伯是在四十岁左右因饮酒过度得小脑萎缩死的。请问我男友会不会在老年后得精神方面的病
外科,神经脑外科,轻度脑瘫的治疗方法,无
外科,神经脑外科,脑中风能不能治疗好？,"我朋友长辈68岁，男得了中风后性情大变,有时问什么都说不知晓,有时又好象什么都挺清楚,常疑神疑鬼,无理取闹,请问脑中风能不能治疗好？"
外科,神经脑外科,脑性瘫痪脑瘫可以治好吗?,出生时。脑出血，缺氧现三岁，能读力穿行，其它正常，能交流，答话清楚，就是左脚跟不着地，容易摔。做过脑核磁振，还没有用过药与治疗。在乎怎样的帮助：脑性瘫痪脑瘫可以治好吗?
外科,神经脑外科,西安治癫痫病医院哪个正规,早上起来之后就发现头不舒服，然后突然间就倒地了
外科,神经脑外科,脑瘫儿童都有哪些表现呢？,同事的女儿一岁了，但是表现有点不对，不会自己吃饭咀嚼，还不会走路，有时候拳头紧握，生气的时候用拳头使劲打自己的头，教她走路，她步态很不稳，走不好，感觉腿很没有力气。
外科,神经脑外科,缺氧缺血性脑病的婴儿有什么反应？,出生22天发现手脚阵发性抖动，入院检查核磁共振确诊缺氧，肝功受损，做高压氧10天，输液数天，打硫酸镁针剂，出院一周后还是出现抖动现象，做视频脑电图结果未发现癫痫症状。
外科,神经脑外科,有了脑梗塞应该怎么样治疗好？,父亲最近体检时被确诊为患有脑梗塞，全家都很忧心，请问医生，有了脑梗塞应该怎么样治疗好？
外科,神经脑外科,脑梗塞什么情况下需要手术治疗,男今年50最近因为突发性脑梗住院治疗的，我担心以后还会再病发，请问我想知道脑梗塞什么情况下需要手术治疗？
外科,神经脑外科,脑中风留下了后遗症怎么办,发生的时间是晚上11点30分钟。
外科,神经脑外科,煤气中毒昏迷不醒15天是否成植物人？,我男朋友前几天在家睡觉，煤气中毒了。从送去医院治疗开始算起都已近15天没醒过来了，听朋友说是不是超过十五天没醒过来就会变成植物人再也醒不过啦了啊?煤气中毒对身体的损害是永久的么，所谓用就是不是就是无法恢复的变成了植物人？
外科,神经脑外科,脑血栓手脚都不能动了,2011年5月3号
外科,神经脑外科,脑供血不足，该怎么改善？？,无
外科,神经脑外科,小脑梗塞与梗死有什么区别谁严重,无
外科,神经脑外科,三叉神经痛手术多少钱？,我被诊断为三叉神经痛，所以现在准本实施手术了。您好实施三叉神经痛手术多少钱呢？
外科,神经脑外科,我爸脑溢血偏瘫，走不了路，进行什么治疗可以走,2008年，走不了路，
外科,神经脑外科,肢体运动障碍康复可以治疗脑瘫吗,脑瘫
外科,神经脑外科,患脑炎后遗症的可能性大吗,我差不多5岁发病，现在26岁。主要四肢无力，手脚畸形，脚马蹄内翻，脚趾动不了，手腕处也开始无力，打字基本靠一根手指，脚还可以动但无法站立和行走。
外科,神经脑外科,得了脑瘫还可以要孩子吗？,脑瘫应该是在一岁的时候有发现 都是那时候家庭条件实在不行 现在9岁了还不会走路也不会站。
外科,神经脑外科,想知道脑供血不足怎么处理好？,无
外科,神经脑外科,脑梗的早期症状是什么啊？,我丈夫从今年年初已经开始，就会有的时候会出现异常状况，会突然说不出话来，很困难的那种，有点结巴，还会再次出现口歪眼斜现象，手脚会不自觉地发颤抽动，听朋友说这是脑梗，我不相信，脑梗的早期症状有哪些啊？
外科,神经脑外科,请问出现三叉神经痛用什么药物或者别的治疗方法,请问出现三叉神经痛用什么药物或者别的治疗方法？
外科,神经脑外科,脑梗塞能不能引起一直呕吐吃不了东西,身边有个朋友最近一直喊头疼而且有时候会抽风，也不想去医院检查，请问脑梗塞能不能引起一直呕吐吃不了东西
外科,神经脑外科,帕金森病有什么注意事项呢,"我爷爷今年72岁了,得了帕金森病已经5、6年,平时的时候都不能自己吃晚饭,天天的手脚发颤,什么事也做不了,全靠别人帮着,看见他这样.我的心里也很不好受。在乎怎样的帮助：帕金森病有什么注意事项呢"
外科,神经脑外科,老人得了脑梗脑该怎么护理？,脑梗到底该怎么办？这个事情真的很烦人，因为爸爸得了这个病，家里人又不敢掏钱给他医病，据说这个花费是挺大的，我想问一下，除了手术之外，除了没其他的途径可以治疗的呢？
外科,神经脑外科,脑外伤出院可以做哪些康复训练,脑外伤车祸3月15日晚，出院后做事迷迷糊糊，中心医院
外科,神经脑外科,小孩头部发育是否正常,余大夫:新年好，我想咨询一个问题，我家男孩2个月了，就是白天睡眠不好，一般睡了5-10分钟就醒了，晚上20:30-早上8:30就醒了（包括喂奶时间）现在也会笑了，还可以把尿，请问孩子大脑发育是否正常？
外科,神经脑外科,脑痉挛吃什么药效果好,我是之前有高血压的，一直在吃降压药，后来这段时候总是觉得头疼的厉害，总是昏昏沉沉的，就去医院看了，检查下来是脑痉挛，这样的话需要吃点什么药比较好。想得到怎样的帮助：脑痉挛吃什么药最好？
外科,神经脑外科,有治好脑血栓的方法吗,69岁，以前有高血压，此次发病突然，以至半身无知觉，现正在治疗，有效果。
外科,神经脑外科,迟发性脑病什么情况,所就诊医院科室：涿州市中医院 内科检查及化验：核磁显示大脑双聂侧有缺血造24小时心电图显示平均心率80次，最快159次，最慢53次，1。一过性窦性心动过速2，偶见室性早博治疗情况：甘露醇，奥拉西坦，长春西汀，转化糖电解质治疗住院十四天期间继续吸氧病史：2012年12月10日一氧化碳中毒碳氧值28。1，且在前4天一直有轻微煤气2013年正月初五晚九点多突然晕厥一次大约4。。。5秒钟后自醒当时倒在地上脸坏了，无二便失禁但在第一次中毒气后吸了十天高压氧无输液停氧后一月余开始有头晕，头痛，腿软，记忆力减退，直至初五晚中煤气当天头晕，头痛历害，腿软，吐，心慌，血压130 80想得到怎样的帮助：是迟发性脑病吗
外科,神经脑外科,先天性脑蛋白质发育不良,"我儿子三岁,至今不能独立行,在大人牵引走路时,下肢欠软,步行不稳,能扶墙行走,经医院诊断检查（核共振）为大脑蛋白质发育不良,血清检查结果为:1,AST谷草转氨酶44.50.0~40.0U/L2,LDH乳酸脱氨酶351.0135.0~225.0U/L3,肌酸激酶109.025.0~200.0U/L4,肌酸激酶同2酶57.00.0~24.0U/L请问大脑蛋白质发育不良要使用哪些药物治疗?"
外科,神经脑外科,脑炎做腰穿有什么危险吗,七八天，眼睛发直想说话说不出来，坐不住，有时候抽搐，胡乱说话
外科,神经脑外科,双侧额叶颞叶皮层下及半卵圆中心多发缺血灶,上述病情与脑腔梗治疗方案是否一样？请您告知。
外科,神经脑外科,脑梗病人瘫痪在床怎么护理？,脑梗病人瘫痪在床大概五个月，生活不能自理，最近两天脚上长了一个水泡，水泡越长越大，把里面的水抽干后又出水，不知道是什么原因引起的，怎样护理才能避免此类情况发生。
外科,神经脑外科,垂体腺瘤有什么药可以代替溴隐亭？,泌乳素470.垂体腺瘤的大小为2.3*2.3*3.1
外科,神经脑外科,腔隙性脑梗塞该病能怎么治疗,本人男54岁精神状态不好，感觉到生病了，一查是哪个病，请问：腔隙性脑梗塞该怎么治疗？
外科,神经脑外科,脑梗塞病中医治疗方法有啥?,"我现在就是很忧心妈妈,就是脑部阻塞严重,现在就是不知晓是不是可以用中医救治,据说就是中医可以缓解脑部阻塞,我妈妈已经吃不下东西了,口舌麻木不仁."
外科,神经脑外科,宝宝脑积水有什么症状表现,"问题描述:头不是竖的很好,卤们心比一般小孩宽,有时候好像卡了东西在喉咙."
外科,神经脑外科,头晕出虚汗怎么回事,无
外科,神经脑外科,脑中风后半身不遂不能动怎么办？,"我朋友长辈68岁，男得了中风后性情大变,有时问什么都说不知晓,有时又好象什么都挺清楚,常疑神疑鬼,无理取闹,请问脑中风后半身不遂不能动怎么办？"
外科,神经脑外科,患病有十余年时间 表现为右面部及嘴角不停抽搐,患病有十余年时间 表现为右面部及嘴角不停抽搐 双面部明显不对称。应该怎么治疗才好？
外科,神经脑外科,脑栓塞后遗症怎么治疗,脑栓塞一年半，房颤引起。肢体康复中感到头闷，眼皮发紧，是否属于后遗症？脑电图中显示仍有栓。
外科,神经脑外科,小儿脑瘫治疗误区,我姐姐家的小孩子，一出生就得了脑瘫，现在在家里接受治疗呢，我们一家人都很心疼这个宝宝，想给孩子早点治疗好，但不知道小儿脑瘫治疗存在哪些误区呢？
外科,神经脑外科,双侧多发性腔隙性脑梗死应该怎么治,双侧多发性腔隙性脑梗死消化发言：您好在吗
外科,神经脑外科,我脑瘫了怎么去治愈?,妈妈给我讲，我那小时候有天突然僵硬，往起抱我的时候身体感到困难，我的四肢下垂，也很少活动，闭嘴困难，妈妈就带我去医院检查，医生诊断为脑瘫。可是耽搁了没有治好，我还有希望吗?
外科,神经脑外科,老人小脑萎缩有什么症状？,我爷爷最近有事时手脚很难运动，去医院仔细检查后医生说他的小脑萎缩，想知道老人小脑萎缩有什么症状？
外科,神经脑外科,中风患者吃什么好？,老公最近得了中风，饮食上要比较注意许多，您好中风患者吃什么好？
外科,神经脑外科,中风患者会有怎样的症状,我爸是中风患者，这段时间不知晓他老是叫啊，一叫了然后突然就睡过去了，拍醒后又叫，吓死我了求医生解惑几下啊，会不会有危险啊，他是头痛还是什么
外科,神经脑外科,有治中风的药吗,后服用血栓心脉宁胶囊每天三次每次三粒疗效不是很明显
外科,神经脑外科,孩子脑炎后遗症治疗方法有什么,"患者年龄:一岁半主要症状:看为到东西病发时间:2009年9月10日突然发高烧,晕迷,抽动,及时送县医院,由于当时医院当时未确诊出病因,9月13日送省医院确诊是脑炎,住院治疗.现孩子已出院,但眼睛看不见东西.化验仔细检查结果:脑炎引来的眼睛看不见东西曾经的治疗情况和效果：现正在做高压氧,针灸等康复治疗,有什么好的康复治疗办法?"
外科,神经脑外科,怎样才能排除患癫痫可能,"除以上因素以外，还有没有其它情况引起此类症状的发生，比如脑瘤之类的。
是每个人在精神紧张和过于劳累时都会产生这样的情况吗？
另外，病人在白天时从未发病过，惟有在凌晨睡梦中发病，这种情况可以排除患癫痫的可能吗？
因为患者在发病时表现有些严重失常，望医生能给予详细的分析与回答。     谢谢！"
外科,神经脑外科,孩子得了脑瘫要注意什么,孩子是从1岁多的时候被确诊是脑瘫的，知道这个事情以后全家人都很痛苦，接受不了，我一直很长时间才缓过来，看着孩子的样子我很心疼，想了解一下这个脑瘫以后都要注意什么。
外科,神经脑外科,中风医院深圳,您好医生，我朋友的的父亲中风了，想在深圳找到一个好的中风医院，我想问下那个医院比价好
外科,神经脑外科,癫痫可以康复吗，该采用的什么治疗方案,癫痫可以根治么癫痫病可以根治么，可以不用长期治疗法么根治
外科,神经脑外科,脑瘫的症状主要有哪些,好友上个月才生了宝宝，可是孩子因为在她肚子里呆的时候太长了，生的时候又缺痒，所以造成了孩子成了小儿脑瘫，好友现在天天以泪洗面，我想帮问一下，脑瘫的症状是哪些。
外科,神经脑外科,小儿臂丛神经损伤如何治疗,"出生后察觉到右臂手指手腕能运动，手臂不能够抬起,这可担心坏了，也不知晓听谁的怎么治在乎怎样的帮助：期望各位专家给点意见"
外科,神经脑外科,脑梗塞颈动脉斑块怎么样治疗,无
外科,神经脑外科,褥疮该怎么治疗,20多天起泡溃烂
外科,神经脑外科,脑外伤开颅术后偏瘫癫痫怎么治疗,半月一至两次化验、仔细检查结果：有丙肝曾经的治疗情况和效果：服食丙戊酸钠仍复发怎么治疗
外科,神经脑外科,脑梗阻该怎么治,男，38岁。最近几天因脑梗阻住院，长期酗酒抽烟。希望得知较好的相关治疗方法及注意事项。感谢！
外科,神经脑外科,脑梗塞患者嘴巴唾液多怎么回事,无
外科,神经脑外科,小孩快两岁确诊为脑发育不全怎么办,走路左腿有点软，后来检查确诊为脑发育不全。这该怎么治疗啊？
外科,神经脑外科,脑梗植物人一般能活多长时间?,我婆婆脑梗塞由于就诊不及时成了植物人。
外科,神经脑外科,癫痫患者可以玩电脑吗,你好，我邻居家的孩子因为查出来了癫痫，一切运动都不敢做了，只在家玩电脑游戏，可是，病情也不见好转，还越来越厉害，就想问问癫痫患者是不是不可以玩电脑
外科,神经脑外科,三叉神经痛怎么减轻,我爸爸岁数大了，最近我发现他精神是不太好，而且爱忘记事情，头昏是他自己说的，说有时候走着走着就会有晕眩的感觉，我们家人也是很担心的，请问三叉神经痛怎么减轻
外科,神经脑外科,右眼闭不严嘴兜不住水怎么办,右眼闭不严嘴兜不住水
外科,神经脑外科,请问肺癌晚期引起的小脑萎缩用什么中草药可,健康进行咨询叙述：肺癌引来小脑萎缩癌症是有三年了小脑萎缩是前几天被查出来的走路摇晃，语言不清吃什么可以减低痛苦可以走路
外科,神经脑外科,糖尿病脑梗塞哪个科室治呢?,在床上躺着就好点，下地活动和洗个脸就干呕，头晕眩！3年前中过风，得过脑梗塞！
外科,神经脑外科,脑晕双腿站立晃动该怎么处理,脑蛛网膜囊肿，头晕双腿站立不稳
外科,神经脑外科,中风偏瘫患者足部浮肿是何因素或病因,患者女，54岁，7年前中风偏瘫（右偏瘫），至今未愈，不能独自行走，大多情况是坐和躺，现在出现足部浮肿现象（压下去成一个坑，隔好一会才恢复），且有蔓延至小腿的迹象，早晨睡醒时是足部正常，越到傍晚时分越肿。之前有出现过休克翻白眼现象，一次是坐厕小便时突然休克，一次是协助其进行运动时休克。
外科,神经脑外科,心脑康胶囊预防疾病服用量？有疗程吗？,无
外科,神经脑外科,脑血管硬化有哪些特效药,"；我的一位朋友到医院检查有高血压、脑血管硬化。请告诉我有什么特效药让我朋友好呢？
岁"
外科,神经脑外科,锁骨骨折术后恢复情况怎么样,了，请问现在能右侧卧睡吗？以后该怎么进行康复训练，应注意些什么？左手什么时候可以重？现在可以吃辣椒吗？谢谢！
外科,神经脑外科,脑梗塞早期治疗方法是什么,男61岁不知道为什么竟然会生病，也感觉到不舒服了请问：脑梗塞早期治疗方法是什么
外科,神经脑外科,如何预防脑梗塞再次发生?,1年前我老伴因为操劳过度，再次发生脑梗塞，在当地医院救治，经当地的医生救治后，转好出院，但是遗留下不少的后遗症，医生建议我们平时要留意点，防止再次发生脑梗塞的可能会。
外科,神经脑外科,脑出血引起头晕怎么办,96年脑梗过一次，输了一月的液好了。2009年脑出血，输液后有后遗症，说话不很清，左腿略有不稳感觉，脑子反应慢。后来也出现过轻微脑梗，现在头一直晕，输液，吃药只管三天。过后还晕 
外科,神经脑外科,脑积水治疗方法怎样,我的奶奶换脑积水已经一年了，一直采用的药物救治，但是不怎么起效，但是我们家都想让她全愈。所以我想问几下医生脑积水治疗方法怎样比较好？
外科,神经脑外科,舌头麻这是轻度中风吗？,去年12月份因小中风住院半个月，出院后一直吃尼莫地平和拜阿司匹林，血压一直正常，今年6月份停了尼莫地平，血压也正常，现在这段时间每到下午血压130、90您好这样的话血压高吗?需要有再吃尼莫地平吗？
外科,神经脑外科,中风病人如何补充营养,中风一周年，行走不便，身体较廋曾经的治疗情况和效果：住院半月，长期喝药，行走不便，身体较廋在乎怎样的帮助：吃什么补品，吃乳鸽可以吗？
外科,神经脑外科,脑血栓问题反反复复需要怎么做,女今年37岁，心痛，手脚不好使，头晕身子沉，嘴有点歪，走路慢，不想吃东西。说是脑血栓，请问我想知道脑血栓问题反反复复需要怎么做
外科,神经脑外科,锁骨骨折错位严重不施行手术复位可以恢复吗,我母亲于一个半月前摔伤锁骨骨折，在医院保守治疗打八字背带固定的，一个月后复查发现错位左右移动上下有缝隙。:
外科,神经脑外科,中国治疗缺氧缺血性脑病更好的医院有哪几家呢？,宝宝右侧会抽搐抖动，CT显示缺血缺氧性脑病，在NICU住了半个月，一直用营养脑神经的药，医生说已经好很多了
外科,神经脑外科,脑出血后头晕,年初我母亲高血压引起脑出血，住院一个月，出院后胳膊腿康复的还可以，就是走路感觉晕，又去医院，医生说是脑血管狭窄，请问专家该如何康复治疗？患者今年68岁，平时血压140左右
外科,神经脑外科,小脑出血的后遗症是什么,"详细病情及咨询目的:小脑出血的后遗症
本次发病及持续的时间:12月13日
目前一般情况:有时侯神智不清
病史:１０年脑梗塞史
以往的诊断和治疗经过及效果:较好"
外科,神经脑外科,脑中枢梗塞是什么原因,身边有个朋友最近一直喊头疼而且有时候会抽风，也不想去医院检查，请问脑中枢梗塞是什么原因
外科,神经脑外科,脑梗塞患者有哪些症状?,我同事今天补课了，原来是她昨天晚上睡午觉的时候，突然再次出现头痛，头昏以及不能够干咽口水的情况，送去医院仔细检查后，医生说是脑梗塞。怪不得我这个同事平常经常说头痛，觉着晕眩，原来平常的那些症状都是脑梗塞的前兆。这样我就能认同她平时的不舒服了。
外科,神经脑外科,治脑萎缩的简单方法都是什么样子,岁数大了，最近我发现他精神是不太好，而且爱忘记事情，头昏是他自己说的，说有时候走着走着就会有晕眩的感觉，我们家人也是很担心的，请问治疗脑萎缩好的方法？怎么治脑萎缩 
外科,神经脑外科,三叉神经痛应当如何治疗才稳妥？,女，40岁，得病后，吃药也没有什么效果，还是不舒服，请问：三叉神经痛应当如何治疗才稳妥？
