department,dep,title,ask
外科,神经脑外科,脑性瘫痪综合征怎么办?,我有个亲戚脑性瘫痪综合征，这个亲戚在我小的时候特别疼我。经常给我买好喝的，我爸妈不让吃，他也会给我买。可是他现在崩溃在床上，生存不能够自食其力，大小便还大小便怎么办。
外科,神经脑外科,七个月宝宝有这些症状，是不是得了脑瘫？,了，还不会坐；抱着能抬头，但不大喜欢抬，喜欢趴在肩上；躺在床上喜欢两个脚抬起用力蹬；翻身也是6个月左右才会的；还有就是拖着他让他站，好像喜欢用脚尖。请问这些症状是不是脑瘫啊？
外科,神经脑外科,脑血栓病人吃什么补品,无
外科,神经脑外科,脑梗塞患者需要注意什么?,我妈妈现在是全身麻木、因为是得了脑梗赛。没办法答话、还能吃一点儿东西。年纪大高强了这个病之后也一直在坚持救治。但是都没多大的效果。就想平时多留意一点儿就行了。
外科,神经脑外科,得脑萎缩的婴儿可以活多久,身边有个朋友最近一直喊头疼而且有时候会抽风，也不想去医院检查，请问得脑萎缩的婴儿可以活多久
外科,神经脑外科,先天性脑血管畸形可能造成永远失忆么?,我有个朋友最近被查出来有脑血管畸形，听邻居说，脑血管畸形会导致失忆。
外科,神经脑外科,脑溢血后遗症半个身子疼痛怎么治疗,健康进行咨询叙述：患者70岁，女，脑溢血后遗症8年了。近二年半个身子疼痛难忍。曾去过多家医院治疗无效果。在乎的帮助：您好如何治疗，用什么药。
外科,神经脑外科,脑炎后遗症有哪些办法治疗,身边有个朋友最近一直喊头疼而且有时候会抽风，也不想去医院检查，请问脑炎后遗症有哪些办法治疗
外科,神经脑外科,脑血栓还可以治疗好吗？,脑出血术后有发烧，烧了两天，现在没烧了。现在是第八天了，手脚会动，呼息正常，就是不清醒，请问脑血栓还可以治疗好吗？
外科,神经脑外科,血压升高经查有小脑萎缩怎么办？,"最近血压下降140/95不知什么原因,到医院做了磁共振经颅多勒血流分析仪,再做了CT仔细检查,结杲确诊意见是小脑萎缩,医生沒下定义,血圧高到底是怎么引来的,小恼膨胀怎样治？"
外科,神经脑外科,阻生齿拔出，神经损伤机率高吗,阻生齿，反复发炎。医生说，可拔出。但这颗牙靠近神经线，神经损伤机率高。
外科,神经脑外科,颅内肿瘤较大能否手术？,2014年9月3日生小孩50天出现头晕，头疼没劲呕吐，有一点贫血。
外科,神经脑外科,请问医生关于癫痫是怎样治疗的？,我儿子今年已经十岁了，他有时候会抽动，然后昏倒，甚至有时候还会吐白沫。而我的朋友说是癫痫病，但是我又不知晓这到底是不是癫痫病，所以我就想讨教一下医生，关于癫痫是怎样的？
外科,神经脑外科,老年人头痛症的原因,我爸爸岁数大了，最近我发现他精神是不太好，而且爱忘记事情，头昏是他自己说的，说有时候走着走着就会有晕眩的感觉，我们家人也是很担心的，请问老年人头痛症的原因
外科,神经脑外科,三个月的婴儿脑积水能治愈吗,"宝宝三个月时头趴着抬不起来,身体很软,眼睛有些下垂,两个月时做CT还没事,三个月时做CT有脑积水,有时逗她也会笑,叫她眼睛也会跟着转饿了也哭并吃手,"
外科,神经脑外科,轻微脑梗塞要怎么办?,"轻微脑梗塞我母亲07年11月得了蛛网膜下腔出血，做了插手手术，身体回覆的很好，前两天突然觉着头晕，在家躺了一天，第三天去医院仔细检查，血压165/100(血压从来没这么高过),照了CT，大夫说可能会由于手术的原因，有脑梗塞的阴影，让先打几天针稳固下血压再说，我想问下有什么办法可以彻底仔细检查出的"
外科,神经脑外科,脑萎缩吃什么水果比较好？,脑萎缩吃什么好，比如说水果了，哪类水果好，不宜吃什么？
外科,神经脑外科,脑萎缩的临床诊断症状是什么,我的爷爷患上了脑萎缩，现在记忆力下降的很厉害，我们应该怎么帮助他？请问脑萎缩的临床诊断症状是什么
外科,神经脑外科,脑外伤引起的癫痫好治吗,十四年前车祸脑外伤所至癫痫在吃丙戊酸钠以前`药量是早晚各一粒复查后让减量一天一粒（早晚各半粒）现大脑嗡嗡作响如何是好
外科,神经脑外科,如何防治三叉神经痛现在很着急不知道用什么方法,如何防治三叉神经痛现在很着急不知道用什么方法治疗？
外科,神经脑外科,继发性癫痫病的症状是？,孩子患有继发性癫痫几个月但是家长不了解继发性癫痫的症状请专家解释一下儿童继发性癫痫病症状？
外科,神经脑外科,老年人患有癫痫后要怎么护理,我婆婆不幸患有了癫痫，在生活中，明显的消沉了许多，也不喜欢说话了，要怎么护理才是正确的呢？
外科,神经脑外科,儿童大脑发育缓慢有什么症状？,我儿子今年3岁，但是我发现他和同龄人相比，我儿子比别人迟学会走路，而且到现在说话也不是很顺溜，是因为他大脑发育比较慢吗?想问一下，儿童大脑发育缓慢有什么症状？
外科,神经脑外科,脑瘫儿童恢复要注意什么？,女儿是个脑瘫儿童，小时候需要我们照顾。可是现在还是不能自理，我们也去脑瘫机构寻找恢复治疗，但是效果不怎么好，久病成医，我感觉对孩子最好的治疗，就是日常生活中的照顾，想在这里咨询一下，脑瘫儿童恢复要注意什么？
外科,神经脑外科,脑梗塞住院应该注意什么,父亲第二次脑梗塞住院，再次出现语言不清，能不能扎针灸治疗
外科,神经脑外科,老年脑萎缩吃什么药好？,爷爷年纪有点大了，忽然就感觉他反映有点慢，已经开始我们以为他是老人痴呆了，去医院看了，医生说他是脑萎缩。我们又忧心下来。您好老年脑萎缩吃什么药好？
外科,神经脑外科,中风后遗症治疗方法是什么,本人女80岁慢慢的身体就不舒服，也不知道怎么了，似乎没有精神请问：中风后遗症治疗方法是什么
外科,神经脑外科,老年性脑萎缩，怎么办呀？,老年性脑萎缩
外科,神经脑外科,初期脑梗塞症状有什么呢,我近期出现头晕头疼没有力气，检查得了脑梗塞，好伤心，想知道初期脑梗塞症状有什么呢
外科,神经脑外科,脑梗患者能不能吃生姜啊,脑梗患者能不能吃生姜啊
外科,神经脑外科,治癫痫怎样恰当解决情况比较好,今年不小了了，但是最近一段时间总是会出现眩晕的症状，而且特别容易累，也干不了活，这是让家人挺担心的，所以这里特地的来咨询一下这种情况呢，请问癫痫病怎么治疗较好？
外科,神经脑外科,脑血栓患者吃哪些好点,最近经常头晕，大脑供血不足，在服食天然生物调养的多肽地龙蛋白，我想问几下，脑血栓患者吃什么好？
外科,神经脑外科,我国治疗癫痫最好的医院在哪里,同事的孩子放在我们家里了。同事都出国了。现在孩子检查出了癫痫病。
外科,神经脑外科,这些症状是不是癫痫病,3月份出现腹痛·拉肚子，继而眼花晕厥持续十几秒后苏醒后感觉累，无力
外科,神经脑外科,脑炎后遗症哪些表现,我爸爸岁数大了，最近我发现他精神是不太好，而且爱忘记事情，头昏是他自己说的，说有时候走着走着就会有晕眩的感觉，我们家人也是很担心的，请问脑炎后遗症哪些表现
外科,神经脑外科,帕金森病的病因有哪些,无
外科,神经脑外科,脑梗塞缺血性中风后遗症怎么办,"我妈，因超量服食降压片致使脑梗塞，15年4月3日住院16天出院，现在是缺血性中风后遗症,不能够答话，右腿右手偏瘫，不听使唤，出没法力。有高血压高血脂，贫血。怎么治疗呢"
外科,神经脑外科,怎么判断是否属于脑外伤后遗症？,小时候9，10岁的时候头部后面被木棒击伤缝了3针当时拍ct说没事，到15岁的时候经常头疼（现在不疼了）还有种恍惚的感觉，现在就是感觉心情不怎么好有点强迫症有轻微耳鸣头脑不是很清晰，身体什么都没问题请问我这算是脑外伤后遗症吗，需要去做核磁共振吗
外科,神经脑外科,精神分裂和脑萎缩怎么办？,我在今年年初的时候做了好些的仔细检查，做了磁共振的仔细检查仔细检查出的我的脑部有点脑萎缩的症状了，特别的是我的小脑的位子，因为我前段时间的时候老是有点精神不大正常所以去仔细检查的，仔细检查出的我患这个病了，患精神分裂同时有脑萎缩，都不知晓怎么办？
外科,神经脑外科,北京最好的治疗脑血栓的医院是哪家？谢谢。,我爸爸情况比较严重。54岁了。主要在主干，分布的右脑左脑小脑都有。
外科,神经脑外科,晚上熟睡时发癫痫危险吗,去年八月份有史以来第一次发病  都是晚上凌晨发病 并且都是熟睡中发病  
外科,神经脑外科,脑外伤引起的偏瘫如何机智处置,6个月化验、仔细检查结果：右侧有软化zao曾经的治疗情况和效果：左侧有引留管现在偏tan在乎怎样的帮助：怎样康复治疗好
外科,神经脑外科,脑瘫的孩子能活多大,我大姐家的孩子是个脑瘫患儿啊，看起来非常的愁人还不会走眼神也很呆滞，现在我大姐整天哭，所以在这里我想咨询下医生脑瘫孩子能活多大呢，请医生为我作答。
外科,神经脑外科,脑外伤引起的脑萎缩如何治疗可以好点？,病人是本人父亲，2010年7月因车祸至弥漫性脑中枢受损，化验、仔细检查结果：CT体现还有点脑积水且有点脑萎缩曾经的治疗情况和效果：晕迷至4个月后慢慢苏醒，现在部分记忆恢复，走路困难须人掺扶在乎怎样的帮助：我想建议专家指点像我父亲这样脑外伤导致的脑萎缩如何治疗？
外科,神经脑外科,应该如何预防癫痫病？,应当如何预防工作癫痫病？
外科,神经脑外科,脑瘫挂什么科应该怎么治疗才好？,患者今年五岁肌张力高现在不能走路交叉步不能自己站起来只能是家人扶着才能站起来有流口水的。
外科,神经脑外科,颅内出血有什么后遗症,无
外科,神经脑外科,宝宝得了脑损伤性癫痫可以治疗吗？,我闺蜜的宝宝由于脑部遭到了伤损，所以就再次出现了癫痫病，宝宝得了脑损伤性癫痫可以治疗吗？
外科,神经脑外科,治脑梗塞比较专业的方法有什么,你好，咨询一下这种疾病，治脑梗塞比较专业的方法有什么
外科,神经脑外科,腔隙性脑梗塞有哪些症状,是腔隙性脑梗塞还是老年痴呆或其他什么？（如何预防和医治）经常白天晚上手舞足蹈大吵大闹而自己却不能控制不知道。今天去大医院做了核磁共振，放射诊断报告如下:临床诊断为记忆障碍；检查名称:磁共振扫描3.0T放射学表现:各序列扫描见脑内灰白界面清楚，皮层下多发小斑点状T2W高信号影，DWI上未见明显高信号影。侧脑室旁白质信号在T2W增高。脑室系统形态稍大，脑沟脑池稍宽。中线结构居中。所见副鼻窦未见明显异常
外科,神经脑外科,我确诊为帕金森病手脚不抖就小碎步怎么办？,我诊断为帕金森病、手脚不抖就小碎步严重、身体强直也有您好怎么会事、服药二年多了怎么治疗？
外科,神经脑外科,突发脑梗塞怎么治恰当,33男人较近总是有不舒服的情况，慢慢的之后也越来越不适，请问：突发脑梗塞怎么治恰当
外科,神经脑外科,帕金森患者服药后可不可以开车,医生不允许服药后坐车。为何服药后帕金森患者不能够坐车？
外科,神经脑外科,脑梗塞要怎么治才会好,我的父亲平时好好的，不知怎么了，突发脑梗塞，我们家里人都吓坏了，请问脑梗塞要怎么治才会好
外科,神经脑外科,面肌痉挛用啥好办法解决,本人面肌痉挛大概一年多，左眼下眼睑颤动，现在越来越厉害。有时还抽搐嘴角。影响到训练和练习。在乎的帮助：现在想做手术
外科,神经脑外科,癫痫病发作完以后该怎么做啊？,家人患癫痫，这几天复发次数也比之前多了许多次，癫痫病复发完以后该怎么做啊？
外科,神经脑外科,患脑梗塞右侧不能动，还有治疗希望吗,我大伯好象在他中年的时候就有高血压了，七八年前突发性了脑梗塞，一直到现在都有在吃药控制血压，和溶血栓，但是这几天发觉他的右侧身体有点运动障碍，偏瘫了，除了的治好吗？
外科,神经脑外科,如何治疗脑中风后遗症比较好？,脑中风后遗症怎么治疗好，吃什么药治疗脑中风后遗症有效？
外科,神经脑外科,脑中风脑出血高血压严重会怎么样,脑中风闹出血高血压化验、仔细检查结果：高血压脑中风出血曾经的治疗情况和效果：现在清醒但是头晕在乎怎样的帮助：想知道后果会怎么样
外科,神经脑外科,脑中风后遗症应该怎么样治才会好,最近我发现家里人精神是不太好，而且爱忘记事情，头昏是他自己说的，说有时候走着走着就会有晕眩的感觉，我们家人也是很担心的，请问脑中风后遗症应该怎么样治才会好
外科,神经脑外科,为什么在生活中会出现脑瘫这样的疾病,爷爷六十岁了突然出现脑瘫的症状了很多人都想不明白原来都没有什么病史的身体也一直都很好现在就是反应迟钝吃东西也嘴漏我想了解一下脑瘫出现的原因。
外科,神经脑外科,面肌痉挛能痊愈吗,病情描述:去年  发病时一边的眼睛不受控制的眨动，嘴巴攥起，牙关咬紧。发病时注射肉毒素，在长沙湘雅医院治疗曾经治疗情况和效果:可以控制，但经常复发。想得到怎样的帮助:一次治愈，不再复发。需要发费多少？要多长时间？
外科,神经脑外科,轻微脑梗的治疗与预防方法是什么,性别:男、年龄:65岁、CT片轻微脑梗，已康复，现在只用阿司匹林肠溶片。康复以后的症状比以前爱睡午觉，早上不爱醒。觉多，质量还行，便秘在乎怎样的帮助：看一看有什么好方法，再出有什么好的中成药
外科,神经脑外科,癫痫发病时紧咬舌头该怎么办,病情描述:患者发病时主要表现是四肢抽动，口吐白沫，牙关紧闭，意识突然丧失。曾经治疗情况和效果:吃药治疗中。想得到怎样的帮助:患者在发病的时候紧咬住舌头，家人或旁人该怎么办？
外科,神经脑外科,闭塞性脑血管病左动脉闭塞怎么办？,医生我叔叔现在50岁了，前一阵子他突然晕倒了，在送往医院之后仔细检查出了是闭塞性脑血管病（怀疑烟雾病）左动脉交通不便，我想理解一下，这个病要怎么治疗？
外科,神经脑外科,先天性脑动脉瘤可以手术吗,患者女，70岁，有心绞痛检查发现主动脉瓣钙化、狭窄（重度）；升主动脉增宽；左房增大、右房略大；三尖瓣反流轻度PASP：38mmHg；左室舒张功能减退；左房压增高LAP：20mmHg；LVEF67%
外科,神经脑外科,什么是脑中风疾病呢？,头疼、呕吐、恶心、偶尔还会晕眩，这样是不是脑中风后遗症？请问什么是脑中风疾病呢？
外科,神经脑外科,脑外伤后遗症怎么治疗,住院26天降压吸收出血、吸氧、针灸，保守治疗。
外科,神经脑外科,小儿脑瘫康复训练的方法是什么,身边有个朋友最近一直喊头疼而且有时候会抽风，也不想去医院检查，请问小儿脑瘫康复训练的方法是什么
外科,神经脑外科,脑积水手术要多少钱,无
外科,神经脑外科,颅内肿瘤4.5公分压迫神经，已经昏迷怎么治？,患者74岁，女性，近一星期来有呕吐，大小便失禁，头痛，到医院磁共振发现肿瘤，医生也说不清是什么肿瘤，现在患者几乎半昏迷，还可以进食
外科,神经脑外科,脑梗塞按摩哪些呢穴位推荐3个穴位,医生我公公今年已经76岁了，老人家患高血压的问题，已经好多年了，最近公公再次出现了轻微脑梗塞的情况，想问几下，脑梗塞患者推拿哪些穴位有救治的效用呢？
外科,神经脑外科,脑部严重受伤会成植物人吗？,身边有个朋友最近一直喊头疼而且有时候会抽风，也不想去医院检查，请问脑部严重受伤会成植物人吗？
外科,神经脑外科,脑溢血后遗症,无
外科,神经脑外科,得中风了怎样可以治好,医生我一朋友去年脚背肿起来了，吃药一天就好了，所以也没太留意，以为没什么的。今年夏天脚背又肿起来了，还肿到小腿肚子那里了，特别痛，还连着痛了个星期。去医院做了那个血尿酸仔细检查是偏高，医生说是中风。你看这个严不严重，可以完全治好吗？平时要留意点什么的。
外科,神经脑外科,脑瘫哪家治的最好？,身边有个朋友最近一直喊头疼而且有时候会抽风，也不想去医院检查，请问脑瘫哪家治的最好？
外科,神经脑外科,乙型脑炎后遗症症状是什么,我的小外甥最近总是发烧而且都是低烧、全身都感觉很痛、头痛、浑身没劲儿、总是睡觉，还总是嚷肚子疼。带他到医院仔细检查说是的了小儿脑炎后遗症。在乎怎样的帮助：乙型脑炎后遗症症状
外科,神经脑外科,脑梗塞半年多还可以用尼莫同么？,我婆婆去年的时候得了脑梗塞，一直在用尼莫同治疗，现在用药已经一年多了，我看着婆婆也没什么不舒服的症状了，婆婆一直想停药，说是药三分毒，我想问问，脑梗塞一年多还可以用尼莫同么？
外科,神经脑外科,中动脉狭窄致使的脑梗塞治疗方法有什么,左脑中动脉狭窄致使的脑梗塞反反复复复发除血管支架外除了其他治疗方法吗？
外科,神经脑外科,治疗好转脑梗塞较佳的方法是什么呢？,我发现家里人精神是不太好，而且爱忘记事情，头昏是他自己说的，说有时候走着走着就会有晕眩的感觉，我们家人也是很担心的，请问治疗好转脑梗塞较佳的方法是什么呢？
外科,神经脑外科,脑血栓脸发红是什么原因呢,我父亲患高血压，今年夏天查出脑血栓，住院治疗了一段时间。可近期时常眼睛发红，脸发红是什么原因呢。他每天都喝三两白酒，或者药酒~~每天睡前都喝袋牛奶，请问对身体有影响么？
外科,神经脑外科,中风偏瘫如何针灸治疗,中风，高血压，中风偏瘫，一般怎么治疗好啊，针灸是最有效的方法吗 
外科,神经脑外科,癫痫病的症状有什么,身边有个朋友最近一直喊头疼而且有时候会抽风，也不想去医院检查，请问癫痫病的症状有什么
外科,神经脑外科,治疗癫痫病的药物都有什么,病情描述:我想知道癫痫药的作用机制以及其药理性质
外科,神经脑外科,癫痫患者是不是应该少抽烟，少喝酒,你好，我大爷因为一次意外患上了癫痫，在没患上癫痫的时候天天喝酒，抽烟，现在有了癫痫也是这样，不知道可以不可以。
外科,神经脑外科,脑中风的病人能不能吃田七炖鸽子汤,脑中风的病人能吃田七炖鸽子汤吗？
外科,神经脑外科,老人家半身不遂怎么办呢,老人家半身不遂有二年了，生活基本在床上渡过有年多，现在没有办法治疗曾经的治疗情况和效果：医生开的药都是许多活血的药，不知晓是怎么回事在乎怎样的帮助：半身不遂怎么办啊，在中医方面可以有好的方法没
外科,神经脑外科,请问中风的症状都是什么,手指发麻，偶尔有高血压症状，有时候还头发晕，她母亲和许多亲人是高血压，曾经的治疗情况和效果：检查说供血不足，有冠心病问问您如何有患中风的可能，中风的症状都是什么
外科,神经脑外科,陕西哪里治疗癫痫效果最好？,每年发病一次，有时口吐白沫。
外科,神经脑外科,有什么预防脑血栓的药物,现在这个病很是常见，就是想了解一下，具体的形成原因是什么呢？是什么导致形成的呢？
外科,神经脑外科,怎么才能彻底治愈癫痫病,"两眼上翻,抽经,睡眠多,咬牙,出现两次小便,无直觉,体重正长，发病也无规律,头部受过伤。"
外科,神经脑外科,脑血栓引起的脚肿怎么治,我平时的伴随症状（食欲好，食量大，睡眠可以，大小便还行，）12年了，最近淋了大雨。但能自理，现在56岁了。我现在想了解的是怎样冶我的脚脱肿。平时经常吃着降压药。
外科,神经脑外科,脑梗好医生脑梗塞病发什么情况,就刚刚
外科,神经脑外科,脑梗塞已康复可服维生素B谷维素,医生您好，我爸今年69岁了，去年被查出来脑梗塞，在我们的努力下成功康复了，但是我爸现在还在忍耐服食维生素B、谷维素，我不知晓可不可以，想问下医生脑梗塞已康复可服维生素B，谷维素不？
外科,神经脑外科,得了脑梗怎么进行紧急处理,最近我发现家里人精神是不太好，而且爱忘记事情，头昏是他自己说的，说有时候走着走着就会有晕眩的感觉，我们家人也是很担心的，请问得了脑梗怎么进行紧急处理
外科,神经脑外科,头部受伤，昏迷6天，醒来以后话变多了，不,头部受伤，昏迷6天，醒来以后话变多了，不停的说，女59岁还能好吗
外科,神经脑外科,脑梗。偏瘫是什么症状,09年受刺激
外科,神经脑外科,脑出血引起的偏瘫能不能改善,老丈人昨天早上凌晨六点高血压脑出血十毫升，现在右半身不能动，不能说话，还听不见，看不清，医生说出血部位不怎么好，我想问下专家这种情况好治疗吗？能治好么？
外科,神经脑外科,脑萎缩术后检查费用多少？,脑萎缩仔细检查什么地方可以仔细检查脑萎缩？
外科,神经脑外科,询问一下什么是帕金森定律呢,你好，咨询一下这种疾病，请解惑一下什么是帕金森定律
外科,神经脑外科,咳嗽引起昏倒如何治疗,咳嗽有时候控制不住引起昏倒
外科,神经脑外科,脸部偶尔发麻去医院做了个中风有用吗,我也是脸部偶尔发麻去医院做了个中风预知也没事儿我也26岁了
外科,神经脑外科,骑车倒地脑中记忆空白会得脑梗吗,"本人今年有二次骑车倒地,整个过程三到四秒钟,但这四秒就是想不起来什么原因发生车倒地的。"
外科,神经脑外科,脑溢血中风是否会传染,经常脑溢血复发头晕头疼，很是痛，特来问几下这个病到底感染几率有多大脑溢血中风会感染吗？
外科,神经脑外科,得了脑梗塞要咋缓解治疗呢,我爱人是2017年5月28晚上得了脑梗塞，因为血糖22之前不知有糖尿病，现在有两个月了，正做着康复每天针灸理疗经卢磁推拿，还要每天打胰岛素喝药，甚至吃晚饭都不知咋
外科,神经脑外科,脑中风后遗症常见治疗方法,脑中风后遗症有有多少种治疗方法姨妈3个月前得了脑中风，经过治疗现在就是右边手脚不好用。脑中风后遗症的治疗方法有哪些？脑中风后遗症有有多少种治疗方法？
外科,神经脑外科,偏瘫康复训练方法,大舅舅最近经常到外面喝酒，然后就和舅妈吵架，突然有天回来就晕倒了，我们以为是喝醉了，结果喊了半天都没叫醒，就送往医院醒酒，医生说是脑出血，手术后就偏瘫了
外科,神经脑外科,颅脑是什么原因造成的,头顶疼有时想吐，失眠MRI检查报告单（颅脑）：矢状位T2FLAIR像上双侧额叶及左侧顶叶深部、左侧丘脑可见多发小斑片状高信号影。两侧侧脑室旁呈片絮状长T1长T2信号影。脑室系统稍增大、饱满。脑沟脑池稍增宽、增深。中线结构居中。两侧上颌窦及筛窦粘膜稍增厚。
外科,神经脑外科,脑梗塞这种病的治疗方法有哪些,我近期出现头晕头疼没有力气，检查得了脑梗塞，好伤心，想知道脑梗塞的治疗方法有哪些
外科,神经脑外科,手颤反应迟缓是帕金森吗？,我爸爸，今年62岁。近一段时间身体很古怪：手震颤，眼睛逼视表情少，走路迟缓。我们带他去医院仔细检查，医生说他可能会得了帕金森病，让我们再去大医院做个仔细检查。真的是帕金森吗？
外科,神经脑外科,右侧额叶腔隙性脑梗死情况严重吗？,我母亲最近头晕，去医院做了ct。您好右侧额叶腔隙性脑梗死情况严重吗？
外科,神经脑外科,脑瘫这个病用点什么药恢复的最好在哪里可以买到,脑瘫这个病用点什么药恢复的最好在哪里可以买到呢？
外科,神经脑外科,脑溢血后遗症造成脑梗死怎么办？,身边有个朋友最近一直喊头疼而且有时候会抽风，也不想去医院检查，请问脑溢血后遗症造成脑梗死怎么办？
