department,dep,title,ask
外科,神经脑外科,脑出血整13天了下步如何治疗,脑出血部位在上部出血量30-40毫升左右，伴有房颤、血小板减少、血糖高，保守治疗，做过2次腰穿，脑脊液稍浑黄，颅内压正常，颅内无感染；输过2次血小板、3次血浆。目前，有时清醒有时昏迷。
外科,神经脑外科,脚背外侧走路疼痛是什么原因导致的,已发病三月余，脚背外侧走路疼痛，原是右脚，现左脚走路已疼痛，就诊遵义医学院、航天医院等，只说可能是筋莫炎，吃消炎药，热敷等。
外科,神经脑外科,得脑中风以后该怎么办去处理？,最近做不了饭，然后总说头晕头胀。关键我也不知道怎么回事，就是看她精神不太好的，请问脑中风病发该怎么办
外科,神经脑外科,偏瘫患者脚疼是什么原因,我女儿是偏瘫患者，现在女儿说脚疼是什么原因，需要有吃什么来调整呢
外科,神经脑外科,八个半月宝宝发育迟缓咋办,八个半月宝宝发育迟缓，两只手经常像跳舞一样舞动，动的幅度很大，请问医生这是怎么回事？
外科,神经脑外科,医治骨髓炎有特效药吗,医治骨髓炎是否有特效药以往诊断治疗经过及效果:手术治疗伤口不渝合
外科,神经脑外科,脑梗塞可以吃这种药吗?,我母亲脑梗塞有五年啦，在这五年期间住院三次，现在可以要自立，走路也可以，吃晚饭也可以就是答话不清，我父亲让我母亲胡喝药，现在又让吃脉络宁颗粒，我想进行咨询几下医生可以吃这种药吗，
外科,神经脑外科,肌肉抽搐口吐白沫是癫痫么？,医生我刚才下班着的时候个同事突然肌肉抽搐，口吐白沫，是癫痫么？
外科,神经脑外科,小儿脑瘫的危害是什么？,我的孩子都好几个月了可是跟正常的孩子很不一样，现在不仅不会爬不会翻身，头也特别沉好像抬不起来，孩子也不是很胖总是流口水，逗他时也不爱笑，带孩子检查才知道是脑瘫，不知道脑瘫的危害有哪些啊。
外科,神经脑外科,请教，偏瘫哪家医院能看,本人就是通风机高点。和有点脑供血不足。这样老了是不是容易引来偏瘫疾病？
外科,神经脑外科,请问脑血栓如何预防,"家族里有脑血栓患者,这个岁数想要怎样预防脑血栓?出现什么症状需要及时去医院救治?另外我低压有点高110,是什么原因造成的?需要注意什么,怎样调理"
外科,神经脑外科,咋样避免癫痫病遗传给孩子,你好，我与我的爱人非常恩爱，虽然她不幸患有了癫痫病，但是我想通过我的努力和医疗，她会康复的，而且，最近我们在商量着要孩子，但是会不会遗传给孩子，该怎么避免呢
外科,神经脑外科,脑血管畸形治疗方法？,"患者女，50岁左右，以前身体状况良好。
此次病情：旅游时突发脑出血病，昏迷中"
外科,神经脑外科,脑震荡后遗症恢复其有多长？,21011月头部被人打后一直头疼头昏，恶心，心颤，特别是头痛头昏，胀痛，钝痛，针刺样痛，除了走路晃忽，特别痛苦，没个过一天正常人的日子，苦啊，帮帮我吧，好长时间才好啊曾经的治疗情况和效果：化验、仔细检查结果（请在下方创立病历）:ct没问题，中西药都吃了没效果，针灸也没效，医生说我没办法治，要我吃止痛药，您好我能好吗
外科,神经脑外科,得了脑梗塞还能康复吗?,我的个姑妈，十多年以来一直有高血压。一直在喝药控制。身体还算可以。去年又查出来了糖尿病。上个星期突然脑梗，幸亏送医院很及时。经过治疗，身体有所转好。脑梗能不能够全愈？
外科,神经脑外科,中风三个月可以服用牛黄丸吗？,病发时间:2011。1。14主要症状:言语表达出来有问题，生活无法自食其力大小便失禁在乎怎样的帮助：治疗方案，平常需要有留意什么？可以服食牛黄丸吗
外科,神经脑外科,太阳穴附近疼是哪类病症呢,"详细病情及咨询目的:经常不定期的头痛，有的时候连眉毛骨或者太阳穴这里都附带着疼，我妈妈也经常这样疼，请问是属于哪类头痛病症？
本次发病及持续的时间:估计会有半天
目前一般情况:半天
病史:15岁时就有
以往的诊断和治疗经过及效果:未治疗过
辅助检查:
其它:"
外科,神经脑外科,治疗脑瘫有名的专家是谁,我的邻居最近患上了脑瘫，看过去好像呆呆的，傻傻的
外科,神经脑外科,怀孕期怎样预防脑积水,"各位大夫,我怀孕30周,做三维彩超时,医生说胎儿有脑积水,现以引产,我想问的胎儿是怎样引起脑积水的,我母亲30岁生过一个男胎难产,当年在农村的医生说是脑积水,我现在是32岁怀孕,这是我第一次怀孕,会不会是遗传引起的,我以后还能不能怀孕,需要多久后才能怀孕,以后会不会还出现这样的问题?"
外科,神经脑外科,帕金森病的症状都有哪些个？,男，55岁，我大伯现在走路都非常的困难，尤其是坐时间长了的时候，刚走第一步非常的困难，而且手还不停颤动，脑袋也跟着晃，帕金森病的症状有哪些？
外科,神经脑外科,脑梗患者治疗后能活多久,最近我发现家里人精神是不太好，而且爱忘记事情，头昏是他自己说的，说有时候走着走着就会有晕眩的感觉，我们家人也是很担心的，请问脑梗患者治疗后能活多久
外科,神经脑外科,防止中风长期服用哪种药物,患者，男，69岁，有中风家族史，本人患有高血压去年感觉头晕，经服用硫酸氢氯比格雷片，头晕症状消失，为防止中风，继续服用该药。
外科,神经脑外科,缺氯缺钠有和何症状,"昏迷,口吐沫夜间"
外科,神经脑外科,高血压中风治疗方案和饮食上的注意事项是什么,五天前右侧面部中风表现，血压收缩压200毫米汞柱，舒张压130毫米汞柱，现在用药治疗卡托普利，牛黄甲压丸，甲钴胺治疗，请医生告诉我除了好的治疗方案和饮食上的注意事项。请告诉我除了好的治疗方案和饮食上的注意事项。，谢谢
外科,神经脑外科,脑梗患者血脂高吃什么好,六月五号上午发病，口齿不清，右手腿无力，结合医院就诊。
外科,神经脑外科,河南哪里有治疗脑瘫的医院？,经常摔倒，有些外旋拖地
外科,神经脑外科,健得福心脑血管治疗仪怎么样,我爸爸岁数大了，最近我发现他精神是不太好，而且爱忘记事情，头昏是他自己说的，说有时候走着走着就会有晕眩的感觉，我们家人也是很担心的，请问健得福心脑血管治疗仪怎么样
外科,神经脑外科,孕期检查轻度脑积水该怎么办,我今年31岁，这次去孕检检查出有脑积水，请问：孕期检查轻度脑积水该怎么办？
外科,神经脑外科,我脑梗患者吃喝呛咳请问咋办？,我脑梗患者，大吃大喝呛咳，走路300米左右，右侧腿根疼，脚还麻，我左侧肢体不好使，为什么不疼呢？
外科,神经脑外科,北京治疗脑瘫方法有什么,我的一个老家的一个叔叔，前不久，突然得了脑瘫，现在走路都走不稳了
外科,神经脑外科,癫痫怎么去治才可以缓解病情呢？,家里人突然出现了，流口水、头痛、呕吐，特别的吓人，别人都说是癫痫的症状，请问癫痫怎么去治才可以缓解病情呢？
外科,神经脑外科,患脑血管病平时吃什么药,，病情稳定，现在一切都正常，就是有时感觉头晕。在乎怎样的帮助：我想问:有时头晕，平时吃什吗药，可以预防工作？
外科,神经脑外科,脑瘫术后后续治疗,脑瘫康复术后现感觉双下肢站立久后无力，疼痛。现手术后已有5年了。
外科,神经脑外科,求问脑溢血后遗症怎么办？,脑溢血后右手完全不能够动脑溢血致使曾经的治疗情况和效果：做手，胳膊等局部推拿在乎怎样的帮助：如何才能彻底恢复，
外科,神经脑外科,怎样才能缓解脑梗塞,脑梗塞已有一年了，现在偶尔左臂会发麻，是怎么回事？这种病彻底恢复的很慢吗？
外科,神经脑外科,继发性癫痫治好的方法是什么,被确诊患了继发性癫痫病，无缘无故的患上了这个病，请问继发性癫痫治好的方法是什么
外科,神经脑外科,老人血栓应该怎么办,我父亲今年74岁，在25天前，突然血栓送到医院。确诊为颅内两条之一的主动脉血栓（心源性栓子），手术融栓，结果没有疏通。我父亲是10多年前得过心梗，好了后始终没有再犯过。目前，我父亲在医院恢复不错，除了左半身上下都没有知觉（零度）外，意识、语言、喝水、大小便等都恢复不错，有望继续恢复。但是，目前的右脑血液是靠左侧血管的枝线供给，弱不惊风，怕再有栓塞的话就会立即丧失某些功能。另外，听说目前有医生能在
外科,神经脑外科,在五年前开始小脑萎缩发病怎么办？,在五年前已经开始小脑萎缩病发，生存不能够完全自食其力(可以走路，已经糊涂但是可以认人)，有腔梗，过了一段时间，完全不能够自食其力(无法走路，可以认人)脑血管梗塞，压制腿神经和干咽神经(四年前医院的仔细检查确诊)，期间点过打通血管的药，住过四回院。干咽费劲，排便困难，痰多，呼吸困难，基本无法答话，现在已经吃不下去饭了，不知晓该怎么办，如何解决以及照料老人？
外科,神经脑外科,脑梗塞会引发头痛吗？,11月4号病发，晕迷，左边没感觉。曾经的治疗情况和效果：没能告诉我好点的药
外科,神经脑外科,脑出血后遗症偏瘫一年了还能恢复吗？,无
外科,神经脑外科,有糖尿病高血压脑梗塞等疾病吃什么药,老人有糖尿病高血压脑梗塞等疾病，走路走没法，成天躺在床上坐在凳子上，我想问的是，老人家有痰咳不出怎么办，有时还不够力气咳，喝水吃晚饭都很咳，老人家有时三四个月住一次院一出院就在家里，就是很咳，我想问的是，有什么办法，老人家是要吃点什么？留意点什么？开点什么药等等有什么好的办法，
外科,神经脑外科,三叉神经痛该如何治疗有何特效药,三叉神经痛该如何治疗有何特效药
外科,神经脑外科,放射性脑损伤该怎么进行治疗？,我最近觉着头很痛，仔细检查出我有放射性脑损伤，您好我该怎么实施治疗好呢？
外科,神经脑外科,老人出现多发性脑梗塞怎么治？,我爷爷患脑梗，医生说是多发性的，现在在吃中药，多发性脑梗塞怎么治？
外科,神经脑外科,共济失调症状表现都有哪些,说话比较慢，单调而含糊，吐字不清，音量时强时弱
外科,神经脑外科,右侧尾状核及内囊前肢腔隙性脑梗塞咋治,因为突发性头痛，差点昏倒，去医院仔细检查，做了脑部CT，最后确诊为右侧尾状核及内囊前肢腔隙性脑梗塞，这个病跟普通的脑梗塞有什么区别吗？右侧尾状核及内囊前肢腔隙性脑梗塞的治疗方法有哪些？
外科,神经脑外科,脊髓肿瘤导致血管畸形以致双腿无法行走怎么治？,"以前身体状况良好,半年前发现双脚无法行走。脊髓肿瘤导致血管畸形导致。"
外科,神经脑外科,右半部脑出血怎么办？,"10月16日晚，我爸爸不小心摔交，造成右半部脑出血，开始时在门诊治疗时出血30毫升，后转入住院部时
已经出血40毫升，主治医生考虑我爸爸神志清醒就没有做开颅手术，采用的是药物治疗的方法，主要使用
的药物有博坦（甘油糖注射液），鑫通，七叶皂，唯西，健脑灵，12天后出院回家治疗，已经将近一个月
，目前左手、脚活动受限制，使不上劲儿，但是胳膊能抬起来，腿能打弯，经人"
外科,神经脑外科,如何有效的根治三叉神经痛,三叉神经痛这个病能否根治有什么方法最简单最有效呢？
外科,神经脑外科,请问茴拉西坦能治疗脑萎缩吗,治疗输液脑梗塞症状转好就是脑萎缩严重在乎怎样的帮助：脑萎缩有什么好的治疗手段吗如果吃药能控制吗吃什么药
外科,神经脑外科,帕金森能医好吗,近两年记忆力减退，脚手颤抖，罗平看了估计是此病
外科,神经脑外科,轻微脑梗塞吃啥药最好,轻微脑梗塞吃啥药最好
外科,神经脑外科,脑袋上神经痛吃什么药,无
外科,神经脑外科,半年前患面肌痉挛抽搐症状消失长期不能见风头响,半年前患面肌痉挛抽搐症状消失长期不能见风头响
外科,神经脑外科,怎么才能医治脑梗塞这个病呢,最近我发现家里人精神是不太好，而且爱忘记事情，头昏是他自己说的，说有时候走着走着就会有晕眩的感觉，我们家人也是很担心的，请问怎么医治脑梗塞效果最好。怎么医治脑梗塞效果最好
外科,神经脑外科,半身不遂强迫他运动被动训练可以治好吗,身边有个朋友最近一直喊头疼而且有时候会抽风，也不想去医院检查，请问半身不遂强迫他运动被动训练可以治好吗
外科,神经脑外科,左侧枕叶皮层下腔隙性脑梗塞,以前有不定时头痛，但前几天头痛的厉害和以前的头痛不一样，会有头痛，头晕，呕吐不出，血压也高到140左右，发病都是起床之后就会那样，时间是短暂的，到医院照过CT和核磁共振后诊断提示是右侧基底节区，左侧枕叶皮层下腔隙性脑堵塞。诊断描述是右侧基底节区，左侧枕叶皮层下可见斑片状信号异常，T1W1等信号，T2W1高信号水抑制序列呈高信号，余脑实质未见异常信号影，脑室，脑池，脑沟未见异常，中线结构居中。严重吗
外科,神经脑外科,脑梗检查哪里比较好,最近总是头痛，言语不清，能走动弹，但力气不大，经检查是脑梗，请问隐秘脑梗严重吗？怎么预防？
外科,神经脑外科,帕金森患者检查费用大约多少,我爸爸岁数大了，最近我发现他精神是不太好，而且爱忘记事情，头昏是他自己说的，说有时候走着走着就会有晕眩的感觉，我们家人也是很担心的，请问帕金森患者要做哪些仔细检查呢？
外科,神经脑外科,患有脑震荡有后遗症吗,邻居家的儿子进去爬山不小心滑倒把脑袋撞了，去医院仔细检查出脑震荡，救治出院后还感觉得头晕头疼，您好脑震荡有后遗症吗？
外科,神经脑外科,脑血栓的危害有些什么?..,脑血栓的危害有些什么?
外科,神经脑外科,怎样治疗脑梗塞这种病呢,你好，咨询一下这种疾病，怎样治疗脑梗塞这种病呢
外科,神经脑外科,癫痫病史几年现经常发病怎么办？,我的癫痫病史有好几年了，但是通过积极治疗抑制的非常不错，结果从今年已经开始这个病却已经开始反反复复发了，不知道为什么，反正现在经常病发，这是不是预兆着什么？我就想问一下医生，发觉癫痫病史好几年最近经常病发怎么办？
外科,神经脑外科,脑中风后遗症能康复治疗吗？,本人患有脑中风，2002年确诊脑出血，2005年确诊脑梗塞。高血压。2012年呼吸不畅，诊断心肌功能严重下降。
外科,神经脑外科,脑出血引起的偏瘫能治好吗,老丈人昨天早上凌晨六点高血压脑出血十毫升，现在右半身不能动，不能说话，还听不见，看不清，医生说出血部位不怎么好，我想问下专家这种情况好治疗吗？能治好么？
外科,神经脑外科,脑梗后遗症吃什么药维持？,5月1号发觉腿脚不利索，嘴和手是麻木的，经仔细检查是脑梗，脑梗后遗症吃什么药维持？
外科,神经脑外科,医生你好：我头痛两个月了，磁共振检查有脑垂体,头痛，脸部有痉挛
外科,神经脑外科,视神经损伤要多休息还是多用眼？,"主要症状:复视,眼涨.发病时间:2009.09.17化验检查结果:开颅手术伤及视神经"
外科,神经脑外科,脑梗塞后遗症左手边不能用怎么办,患脑梗塞现在右手不能够自如我想问血管打通术能让我恢复健康吗、在乎的帮助：有那种办法快速彻底恢复
外科,神经脑外科,脑梗塞怎么治疗较好？,我爷爷自己一个人住在老宅，平常我们就三餐的时候会到老宅去。昨天晚上去开门爷爷没开，我们就冲进去发觉爷爷倒在地上了，送去医院被告之爷爷是脑梗塞了，想知道脑梗塞怎么治疗最好？
外科,神经脑外科,腔隙性脑梗塞需要怎么办?,"病人2012年2月5日脑梗住院治疗10天,仔细检查结果是腔隙性脑梗塞,住院输液期间情绪不稳定,烦躁,蹭手蹭脚的,医院给开了精神科的镇静类药物,出院后一直到现在肢体彻底恢复良好,有进攻能力,但容易感觉累,而且情绪烦躁,还比较爱哭!!!镇静类药物还用再服吗?有副作用吗?"
外科,神经脑外科,脑血栓多年现在间歇性头晕怎么办,老人脑血栓十多年，现在间歇性头晕，CT仔细检查多发性脑梗死，脑萎缩发生改变，脑积水。您好吃什么药能治疗头晕
外科,神经脑外科,治疗椎动脉感觉头皮发麻应该怎么办,男 33岁 有高血压病史2年半  半月前感觉头疼  经检查是椎动脉 静脉粥样硬化  平阴县医院
外科,神经脑外科,7岁小孩在脑梗塞治疗后左手不活动，拿不了东西,"在2009年小孩两岁时 ，左半身出现半身不遂还伴有昏厥。

在医院做脑部磁共振医生说是脑梗塞。"
外科,神经脑外科,哪里是北京是治疗脑梗塞的首选医院,"右腿有知觉,会笑,双腋有知觉,右手也有知觉"
外科,神经脑外科,脊髓肿瘤不手术可以用药物治疗吗?,去年6月份开始发病，四肢麻木，不发现疼痛
外科,神经脑外科,脑出血后梗塞，怎么弄好？,之前我们小区有人突然倒地，被仔细检查出是患脑出血。最近他又出去医院了，就是说因为查出来腔隙性脑梗塞，现在他的家人毫无办法，您好脑出血后，查出来腔隙性脑梗塞，怎么办？
外科,神经脑外科,怎样防止脑梗塞复发,脑梗塞病人怎样以防病情病发？谢谢有什么办法解决，很难受困扰很久心里也不舒服求解决办法
外科,神经脑外科,三叉神经痛症状会有哪些具体表现用什么方法可以,三叉神经痛症状会有哪些具体表现用什么方法可以提早的预防？
外科,神经脑外科,面肌痉挛伴萎缩能手术根治吗?会有后遗症吗,间隙面肌痉挛2年，伴面肌萎缩1年
外科,神经脑外科,平时怎样预防癫痫,宝宝19个月，有过两次低烧惊厥病史，做两次脑电图，均体现有棘波，一次为复检的脑电图体现有散在棘波。想问问这是癫痫的症状吗？平时孩子精神状态都挺好，近期有时会翻白眼。
外科,神经脑外科,脑萎缩有什么症状和表现,我爷爷昨天检查得了脑萎缩了，现在开始记不清东西了，胡言乱语，听不懂他说的
外科,神经脑外科,神经损伤吃什么药好,2011年3月份时大拇指、食指、中指麻木
外科,神经脑外科,脑瘫是为什么引来的啊？,朋友之前的时候羊水早破，去医院的时候，医生怀疑孩子有点缺氧了，就开始做了剖腹产的手术，后来孩子出生以后去医院检查的时候，医生说孩子可能会是脑瘫了，现在朋友家人都很担心！ 想得到怎样的帮助：为什么会得脑瘫呢
外科,神经脑外科,中风危害都是什么样子的？,中风偏瘫的危害大吗？我三伯去年得了中风，治疗效果一直不好，家里选择接回家，中风危害大吗？中风偏瘫会有什么危害
外科,神经脑外科,面肌痉挛手术后多久可以恢复,手术做完多长时间方才能彻底恢复脑袋里面还不适应低头久了伤口沉困在乎的帮助：手术做完多长时间方才能彻底恢复脑袋里面还不适应低头久了伤口沉困
外科,神经脑外科,脑供血不足输液用培他啶行吗？,无
外科,神经脑外科,脑梗塞后遗症治疗方法有什么？,身边有个朋友最近一直喊头疼而且有时候会抽风，也不想去医院检查，请问脑梗塞后遗症治疗方法有什么？
外科,神经脑外科,为何会得中风，中风是什么病？,我看见好多人都得了中风，怎么样防止那种病，怎么样治疗.
外科,神经脑外科,患脑萎缩应该如何治较好,脑我朋友的爷爷刚患了脑萎缩，他家里人现在可担心老人家的身体状况了，想了解下脑萎缩有什么好的治疗方法吗？
外科,神经脑外科,脑萎缩这种病能改善吗？,脑萎缩现在能救治好吗？这病我自己恐怕难吧但又不能够舍弃啊我一同事的爸爸得了这病有知晓的吗？
外科,神经脑外科,癫痫有根治的方法吗,身边有个朋友最近一直喊头疼而且有时候会抽风，也不想去医院检查，请问癫痫有根治的方法吗
外科,神经脑外科,五个月宝宝脑瘫咋回事？,身边有个朋友最近一直喊头疼而且有时候会抽风，也不想去医院检查，请问五个月宝宝脑瘫咋回事？
外科,神经脑外科,三叉神经痛晚期症状有哪些,我妈妈去年冬天在医院做的手术，当时我奶奶是三叉神经痛做了两次手术之后好了，可是在今年的10月份左右又病发了。在乎怎样的帮助：三叉神经痛晚期症状是什么啊
外科,神经脑外科,一般中风是什么样的状况吗,最近我发现家里人精神是不太好，而且爱忘记事情，头昏是他自己说的，说有时候走着走着就会有晕眩的感觉，我们家人也是很担心的，请问一般中风是什么样的状况吗
外科,神经脑外科,大，小脑萎缩吃什么药好,无意识、骨肉障碍、无意识、骨肉障碍，常在早晨上床睡觉前确诊为低血糖、脑功能不全。救治是一种直接的促动，如何预防工作日常生活，如何在疾病再次发生时解决紧急情况。
外科,神经脑外科,脑瘫怎么治疗好一些,我昨天回家看见邻居孩子在楼下玩，我就跟他玩了一会，发现孩子有点不对经，对什么反应都很迟钝，说话不利索，才知道孩子是脑瘫患儿。
外科,神经脑外科,癫痫病患者什么时候吃药是最好的,手脚抽搐，意识不太清楚
外科,神经脑外科,家族有帕金森遗传怎么办,我们家族有帕金森隔代遗传。我爷爷就是帕金森。我和我叔叔。都是手抬起来的时候手自然有轻微的颤动。应当怎样预防工作？
外科,神经脑外科,脑梗塞有哪些临床表现？,无
外科,神经脑外科,脑供血不足最佳治疗方法是什么？,身边有个朋友最近一直喊头疼而且有时候会抽风，也不想去医院检查，请问脑供血不足最佳治疗方法是什么？
外科,神经脑外科,哪些药可以治疗癫痫的简单部分性发作呢？,我患十多年的癫痫病，妻子给我买了利必通说可以简单治疗部分性的癫痫，利必通是不是可以治疗癫痫的简单部分性复发呢？
外科,神经脑外科,我想问下，突发的半月板二级损伤是不是只有车祸,"发病次数、部位、哪些不适感、曾经得到过的治疗，想得到的帮助（20字以上）
   "
外科,神经脑外科,关于癫痫病怎么去治疗？,突然就感觉开始头晕，之后就倒在地上，还口吐白沫，抽搐，把很多人都吓坏了，之后到医院去做详细的检查，才知道是得了癫痫病，想知道这个病怎么治疗比较好？
外科,神经脑外科,得脑中风需要怎么护理呢,你好医生，去医院检查我患了脑中风这种病，想问一下，得脑中风需要怎么护理呢
外科,神经脑外科,如何治疗轻度脑萎缩，脑萎缩发现的及时，医,如何治疗轻度脑萎缩，脑萎缩发现的及时，医生说只是轻微的，想问问，轻度脑萎缩可以治好吗？
外科,神经脑外科,脑梗塞的前兆性症状有哪些,请问有关专家这是不是脑梗塞的前兆?
外科,神经脑外科,癫痫求救为了下一代我现在真的是不知道该怎么办,想尝试停药 可就在昨天就发作一次。发作后 浑身无力。头痛。后背痛。心慌意乱。
外科,神经脑外科,腓总神经损伤后的康复训练,了。这期间吃了一些营养神经的药物。进行了针灸。足下垂症状恢复不明显。
外科,神经脑外科,面部痉挛有什么治疗办法,左脸眼部偶尔痉挛，两年 
外科,神经脑外科,有帕金森该如何治的好,我姥爷今年77了，现在手抖的厉害东西都拿不起来，身体也越来越僵硬，走不了路，请问有帕金森该如何治好
外科,神经脑外科,脑瘫怎么治疗的效果会比较好呢？,主要症状是肌张力大，头竖不稳。前几天在医院检查医生说是由黄疸影起的脑瘫。
外科,神经脑外科,老人说不出话来是脑血栓吗,身边有个朋友最近一直喊头疼而且有时候会抽风，也不想去医院检查，请问老人说不出话来是脑血栓吗
