department,dep,title,ask
外科,神经脑外科,婴儿先天性脑积水有办法治好吗,我家最近生了一个胖小孩子，可是孩子最近这几天经常哭闹，怎么办，我有点担心，就带孩子来医院检查一下，医生说我儿子是脑积水，我当里听到吓了一跳，怎么办
外科,神经脑外科,癫痫病能治好吗,发病不一定口吐白沫
外科,神经脑外科,患有三叉神经痛怎么医治 去哪个医院,三叉神经痛，大概10年了，今年5月份又发作，而且特别严重
外科,神经脑外科,脑供血不足的护理措施有哪些？,我外婆觉着有时候头痛头晕，仔细检查出的脑供血不足导致，脑供血不足的护理措施有哪些？
外科,神经脑外科,中风偏瘫后身上突然起满鸡蛋大的水泡怎么办,岁80岁中风偏瘫后一年，2011年春节期间身上突然起满鸡蛋大的水泡，在乡上检查，也不知是什么病。一般哪些情况会引起这样的病变。
外科,神经脑外科,颅内穿刺是怎样的,颅内积血、积液做颅内穿刺手术是否安全有效？
外科,神经脑外科,面肌痉挛医院？治疗面瘫效果怎么样？,我昨天骑电车去市里玩，忽然感觉到脸部有些麻木，口眼也往一边下垂，我赶紧来到家中，老公陪我到医院去仔细检查了一下，说是面瘫，得赶紧治疗，我问一下，面肌痉挛医院？治疗面瘫效果怎么样？
外科,神经脑外科,宝宝是肌张力高或者脑瘫么,宝宝现在三个月加十天，四肢很僵，穿衣服感觉还行，但是四肢经常掰不动，可以说是绝大部分时间都是，做弱势操反抗，完全不好做抱举时足尖朝下，扶着伫立已经开始脚尖朝下，过会可以脚掌着地，讨厌打挺，.有飞机手，脚趾下扣，双手现在经常握拳，拇指也是经常内收，比两个月的时候还严重，掰不开，睡午觉头讨厌后仰身体完全扭曲 曾经的治疗情况和效果：没治疗在乎怎样的帮助：想知道宝宝是不是肌张力高和脑瘫
外科,神经脑外科,脑震荡需要恢复多久,昨天我下楼的时候不小心从楼梯上摔下去了，我听家人说我摔下去的时候已经昏倒了，后来家人把我带到医院被仔细检查后是脑震荡，我想问一下脑震荡需要有彻底恢复多长时间？
外科,神经脑外科,半身不遂后遗症,五年前得的半身不遂，当时手什么东西也拿不了，治疗后能走也能干活了，现在右手一直冰凉，夏天也是冰凉，
外科,神经脑外科,嘴歪眼流泪是怎么回事,"突然的嘴歪一只眼流泪,"
外科,神经脑外科,治疗脑瘫有什么反应的？,最近父母为着孩子的病搞的睡不好，吃不香的。家人都愁坏了，跑遍了各个大大小小的医院，医生也都是建议做一些康复的锻炼，争取能让孩子自己自理起来，不至于总在床上躺着。孩子得了脑瘫，除了做康复训练还能怎么治疗？脑瘫
外科,神经脑外科,脑梗塞的病人饮食要注意什么呢,你好，我最近身体出现了一些问题，所以想咨询一下这种疾病，脑梗塞的病人饮食要注意什么呢
外科,神经脑外科,小脑萎缩抖得厉害腿走路没劲怎么办？,小脑萎缩抖得厉害，腿走路没劲儿，口齿不清，怎么办，犯病有两年了，21生了病，现在24，还怎么治疗？
外科,神经脑外科,怎样让孩子大脑发育更好呢？,"我孩子刚一岁,怎样让孩子大脑发育更好呢?我指的是除了饮食方面的"
外科,神经脑外科,帕金森哪里治疗好？,医生，你好。我爷爷今年60了，他帕金森挺严重的。我想带他去大医院给治一下，您好一下，帕金森哪里治疗好？可有比较好的医院可以收藏？比较权威的
外科,神经脑外科,怎么护理癫痫病人,患者患病已有两年多了，是由于车祸导致的，患者的疾病会在生活中经常发作，让家人都非常担心，发作时会口吐白沫，全身抽搐，
外科,神经脑外科,脑梗病人加重的前兆？,我岳父得了脑梗，现在情况还算不上糟糕，怕他突然病情有变，想问脑梗病人缓解的前兆是怎样的？
外科,神经脑外科,右上额窦囊肿可以手术吗,主要症状:发病时间:化验检查结果:
外科,神经脑外科,患有脑萎缩如何治疗会较好吗,最近我发现家里人精神是不太好，而且爱忘记事情，头昏是他自己说的，说有时候走着走着就会有晕眩的感觉，我们家人也是很担心的，请问患脑萎缩如何治疗？？。患脑萎缩如何治疗
外科,神经脑外科,脑动静脉畸形要做手术吗？,身边有个朋友最近一直喊头疼而且有时候会抽风，也不想去医院检查，请问脑动静脉畸形要做手术吗？
外科,神经脑外科,脑隙性脑梗是什么症状,有4年曾经的治疗情况和效果：无效
外科,神经脑外科,头晕感觉头昏沉沉的注意力不集中怎么办,头晕，感觉头昏沉沉的，白天头晕，夜晚好一些，没有就诊，已经好几天了。
外科,神经脑外科,头部左侧受撞击后应当看什么科,"医生您好；
    我今年55岁，女。在北京西城住。2月4日我头部左侧（具体说是略靠耳朵左上边，别人开门我正巧从门外走那个门边撞击到我的头部了）受撞击后去医院做CT印象：“未见明确颅内出血及颅骨骨折，必要时短期复查”。当时医生开了两瓶“健脑合计Ⅱ号”。其它无任何处理我就回家了。之后始终头的伤处有疼但很轻。一周前至今疼痛较前厉害，我第三次去神外看，医生仍说我片子没问题，并说我们神经外科没有处理方案，疼也不一点是摔的造成的吧。当时给我开了4盒“ 胞磷胆碱钠胶囊”，可吃了一点没见好。我又去骨科、外科、中医骨科均不给看，说是不属于他们科的病。"
外科,神经脑外科,脑梗塞较好护理方法是什么?,我父亲今年刚59岁，一直都患高血压，每天都离不开药，不知晓怎么的父亲就患上了脑梗塞，现在住院有1周多的时间了，我想问下，脑梗塞最好的护理方法是什么？
外科,神经脑外科,我一个亲戚左边手脚无力在医院检查说是脑瘫又说,"患者 男 38岁    以前身体很强壮   此次病情   左边手脚无力使不上劲

"
外科,神经脑外科,中风以后腿浮肿是怎么回事,我妈妈中风患者，这两天突然大腿根部再次出现浮肿一碰就疼，不知晓什么原因
外科,神经脑外科,脑萎缩分5种类型都有什么呢,春节昏倒1次，后来头昏放柔。颈椎牵引引来头昏且放柔。中医救治晕眩2-3月有转好
外科,神经脑外科,脑供血不足失眠多梦怎么办？,我最近总是头晕，失眠多梦，想睡但是睡不着，像是大脑供血不足的感觉，很痛，去医院仔细检查过，医生仔细检查说是脑血管痉挛，麻醉过一些有利大脑血液循环的药，也吃过这方面的药。有所缓解症状。但是现在来学校上大学了，最近又已经开始痛了。想问问脑血管痉挛脑供血不足失眠多梦怎么办？
外科,神经脑外科,脑膜炎患者还有救吗？,"我有个祖父得了脑膜炎，在医院已经住了快一年了，基本已经瘫痪．请问一下有没有办法可以治疗啊？
急盼回音，不胜感谢！第一次问题补充:转为慢性后没发治疗了吗?谢谢第二次问题补充:没有办法了吗?第三次问题补充:很感谢您的回答,我是帮朋友问的,他的祖父已经在医院度过两个春秋了,一直瘫痪,家里人都比较灰心,所以想问问目前有没有好的办法,寻求希望而已,再次像您表"
外科,神经脑外科,为什么脑积水手术后还头疼？,头晕脑胀、头痛、引流管、腹部疼痛2004/06/20、硫化氢中毒。曾经的治疗情况和效果：做的脑积水分流术。?想问问专家有什么方法治疗。
外科,神经脑外科,脑溢血可以治愈吗,身边有个朋友最近一直喊头疼而且有时候会抽风，也不想去医院检查，请问脑溢血可以治愈吗
外科,神经脑外科,臂丛神经损伤吃哪些,前段时间被确诊有臂丛神经损伤，臂丛神经损伤吃什么？
外科,神经脑外科,小儿脑性瘫痪康复缓解是啥？,我儿子得了小儿脑性瘫痪，现在动了手术，您好医生，小儿脑性瘫痪康复缓解是啥啊？
外科,神经脑外科,脑梗肩膀半脱位能自愈吗,身边有个朋友最近一直喊头疼而且有时候会抽风，也不想去医院检查，请问脑梗肩膀半脱位能自愈吗
外科,神经脑外科,中风前兆需要做什么检查？,我伯父因突发性脑梗塞住院治疗，出院后每天又出现，手发抖，就连拿钥匙开门，手都会发抖。医生说这是中风前兆，想在想去医院检查一下。
外科,神经脑外科,小脑萎缩怎治疗，会影响生命吗,发病一年，共济失调主要小脑蒌缩
外科,神经脑外科,这是得了甲状腺乳头状癌,急性脑梗半月有余，中间刺击诊治得了甲状腺乳头状癌。这能诊断吗
外科,神经脑外科,患帕金森病有哪些危害？,男，57岁，我大伯现在走路都非常的困难，尤其是坐时间长了的时候，刚走第一步非常的困难，而且手还不停颤动，脑袋也跟着晃，患帕金森病有哪些危害？
外科,神经脑外科,多发腔隙性脑梗塞是什么疾病,医生说我是多发腔隙性脑梗塞，我没听说过这个疾病，多发腔隙性脑梗塞是什么疾病？
外科,神经脑外科,运动神经元病与外伤有关系吗,"主要症状:一年前外伤后开始出现上肢无力,逐渐扩大至全身.发病时间:08.5.12化验检查结果:广泛神经元损害"
外科,神经脑外科,关于脑萎缩的治疗方法是啥,我的父亲从去年已经开始得了脑萎缩，经常头痛，而且晚上经常神经衰弱。动作比较缓慢，记忆也越来越差。我想了解一下关于脑萎缩的治疗。
外科,神经脑外科,小儿脑瘫怎么治疗呢？？,我邻家的小孩因为事故出现了脑瘫，治疗了一段时间，但是人还是傻呆呆的感觉，跟以前差别很大了。现在家里人都很担心，我想了解下小儿脑瘫该怎么治疗
外科,神经脑外科,患有左边珠膜网囊肿如何治,"尊敬的专家您好:
             我姐姐的儿子在意外的车祸中检查出了患有:“左边珠膜网囊肿”，现不知如何是好，请专家告诉我此类病症的相关信息，今后该怎么办，"
外科,神经脑外科,脑梗塞的临床症状是什么,"流口气、手不能正常握住水杯是不是脑梗塞的临床症状？
脑血管疾病发作后，可否通过CT排除脑出血的方法确定脑梗塞？第一次问题补充:wengweng先生，能否详述通过CT鉴别脑出血和脑血栓的方法和依据。听说脑血栓不能在24小时内通过CT查出，而脑出血则一有出血就可以查出。那么一个人有脑血管疾病症状时，CT检查又没有发现脑出血，是不是就可以往脑血栓考虑？"
外科,神经脑外科,外伤性颅脑动脉瘤形成需要多长时间,司法鉴定：车祸后颅脑损伤8个月，2个月前发现颅脑动脉瘤
外科,神经脑外科,中风的症状是什么?,身边有个朋友最近一直喊头疼而且有时候会抽风，也不想去医院检查，请问中风的症状是什么?
外科,神经脑外科,生活中脑瘫应该怎么有效的治疗那？,孩子现在开始很容易发脾气了动不动就骂人而且走路的姿势非常的异常啊我就觉得很奇怪后来咨询了医生才知道这是脑瘫病来的啊我都不知道怎么办啊。
外科,神经脑外科,脑中风后遗症医院去哪家？,本人，男，今年68岁。我身体一直都蛮好的，没什么重大疾病，近期突然脑中风了，得了脑中风后遗症，治疗后效果还可以，请问，脑中风后遗症医院去哪家？
外科,神经脑外科,中风后遗症是什么,患中风，偏瘫。曾经的治疗情况和效果：住院后，扎针灸。病情转好。能伫立走路。在乎怎样的帮助：天天锻练。就是右侧筋短，走路费劲。有锻练能使筋长的器械吗？
外科,神经脑外科,脑血管病检查中写的专业术语是啥意思,"部分血管可见错层,左侧大脑中动脉未见显示,右侧大脑中动脉可见错层，侧裂分支可见局限性狭窄，远端显示尚可，双侧大脑后动脉基底动脉管壁欠光滑，左侧大脑后动脉纤细，左侧后交通动脉走行于大大脑后动脉区，并可见限局性管腔显影较淡，基底动脉局限性狭窄"
外科,神经脑外科,贫血会导致脑供血不足眩晕吗？,我有贫血的症状，想问贫血会引来脑供血不足吗？最近感觉我的头有时候有晕眩感。
外科,神经脑外科,颅内肿瘤术后怎样才能更好地帮助恢复记忆力?,颅内肿瘤{去年开始就有症状，视力下降，头痛，月经失调；只是我们不知道是这种病}
外科,神经脑外科,引起脑梗塞的主要原因是什么啊？,引起脑梗塞的主要原因是什么？
外科,神经脑外科,带状疱疹导致左脸部面瘫如何治疗,5月7日左耳朵出现水泡，去医院确诊为带状疱疹。
外科,神经脑外科,得了脑梗塞治疗好了会不会有后遗症？,3年前得了脑梗塞，是因为心血管疾病引起的。但是是轻微的，坚持的在医院进行治疗，花了很多钱，现在检查，已经算是康复了！但是担心会有哪些后遗证
外科,神经脑外科,帕金森病到底应该治疗有哪些？,帕金森六年一直服食多巴胺，现在进攻未变，生存基本不能够自食其力怎么办？
外科,神经脑外科,请问专家偏瘫症状是什么？,我女儿上个月去医院仔细检查得了偏瘫，她下半身不遂，偏瘫症状是什么？
外科,神经脑外科,脑梗塞怎么缓解比较好,我家人最近一段时间总是会出现眩晕的症状，而且特别容易累，也干不了活，这是让家人挺担心的，所以这里特地的来咨询一下这种情况呢，请问脑梗塞自愈可以吸烟吗
外科,神经脑外科,脑梗塞需要多长时间才能出院,正月十一晚上七点突然跌倒，下来后左边手脚无力曾经的治疗情况和效果：在医院检查是脑梗塞，经过治疗现已转好何时能出院，有时间干扰吗？
外科,神经脑外科,血栓痔疮是怎么形成的？到咱们医院能当时就,血栓痔疮是怎么形成的？到咱们医院能当时就切除吗？还是要住院手术？如果不切除有没有害处，现在不痛不痒。8月18日突然发现的，20日到我们卫生院看说是血栓痔疮，说是三天可回去（吃药，盐水洗），目前没有回去，我要出去旅游，如果能当时做可以吗？
外科,神经脑外科,脑梗塞现在昏迷怎么办?,爷爷高龄80现在晕迷了两天，之前患过脑梗塞，现在睡午觉是有鼾声的，有一边的身体没痛觉的，也在医院打氧气的
外科,神经脑外科,面肌痉挛刚开始是眼皮跳动现在带动嘴角有时眼睛,面肌痉挛刚开始是眼皮跳动现在带动嘴角有时眼睛都睁不开
外科,神经脑外科,脑外伤癫痫可以治愈吗？治愈方法都有什么啊？我,我之前头部受伤了，后来是治疗好了的，上个月开始我有时候感觉全身抽搐，有时候还突然晕倒了啊，我特别奇怪，结果那天的时候，出现了口吐白沫
外科,神经脑外科,脑瘫儿怎么办啊好苦恼？,朋友家的宝宝最近越来越不正常动作迟缓不爱洗澡和同龄的小孩子比智力明显低下动作僵硬有的人说是脑瘫这是不是脑瘫朋友现在很苦恼 想得到怎样的帮助：这是不是脑瘫是的话怎么治疗啊
外科,神经脑外科,臂丛神经损伤有没有什么预兆,我爸爸岁数大了，最近我发现他精神是不太好，而且爱忘记事情，头昏是他自己说的，说有时候走着走着就会有晕眩的感觉，我们家人也是很担心的，请问臂丛神经损伤有没有什么预兆
外科,神经脑外科,面肌痉挛对心脏会有影响吗？,身边有个朋友最近一直喊头疼而且有时候会抽风，也不想去医院检查，请问面肌痉挛对心脏会有影响吗？
外科,神经脑外科,脑血管意外后神经缺损怎样评分,无
外科,神经脑外科,脑内长期震动是什么问题,您好，我脑内从17岁开始，时不时的会有震动感。尤其是在看书或者入睡前，右侧大脑部位有如弹簧抖动后的跳动感，吱吱吱。。。。。。，停一下，马上又接着吱吱吱。。。。。。严重影响工作和生活，无法集中注意力思考问题，无法入睡 。痛苦不堪。
外科,神经脑外科,神经干细胞移植后效果几乎没有，还有必要再做吗,痉挛型脑瘫，15岁，中度，智力较好，没有服药，做过腰部的神经剪细的手术
外科,神经脑外科,小儿肺炎什么症状,喘气不通畅2天多了
外科,神经脑外科,腔隙性脑梗死严重吗？,医生，你好。我妈妈这几天头痛的特别厉害，而且还恶心干呕，我就赶紧带我妈妈去医院仔细检查，结果医生说我妈妈这是右基底节区腔隙性脑梗死，您好医生这种病严重吗？我妈妈应当如何治疗？
外科,神经脑外科,轻微脑梗塞需要药物治疗吗？,在多家医院仔细检查没脑梗塞由于出车祸诊断为脑梗塞四肢动弹这样是不是证明是轻微脑梗塞那到底好不好治疗
外科,神经脑外科,小儿脑瘫的早期症状有哪些,一个比较好的朋友，结婚好几年都没有孩子，四处求医之后他老婆才好不容易怀上了，十月怀胎后，宝宝出生了，全家人都别提多高兴了，宝宝现在快三个月了，可是好多的症状显现出小宝宝可能是患上了什么病，去医院做了相关的检查之后，医生怀疑是脑瘫。
外科,神经脑外科,5年前在一次CT检查时诊断出中度脑积水咋办,5年前在一次CT仔细检查时确诊出中度脑积水，先天性脑导水管狭窄引发的，当时没任何症状也没发展经济，随着时间推移我现在觉着记忆力差好忘事，有时头胀，眼胀，手麻，这个是脑积水引来的吗？？
外科,神经脑外科,心脑血管异常是不是容易中风？,今年72岁，2010年12月份发觉我的血液有些粘稠，可能会是心脑血管有问题。据说容易中风，我想问下医生我该怎么调理？中风后果是不是很严重？
外科,神经脑外科,高血压患者如何预防脑梗塞?,我有高血压，主要是我自己的原因引发的，我本人很胖，平时也特别讨厌吃肥肉，后来发现自己的头老是晕，去仔细检查才知晓是高血压，现在为了健康我已经戒肥肉了，饮食也比较清淡，我就是想理解下脑梗塞的预防工作。
外科,神经脑外科,得了帕金森能活几年,得了帕金森能活两年？我家人现在腿无力手发抖经常摔交，现在用龙元熄颤汤救治已经免强把症状压制下去了，您好帕金森能活多久？
外科,神经脑外科,因车祸引起臂丛神经损伤现上臂有,因车祸引起臂丛神经损伤现上臂有知觉但不能活动手指有疼痛请问怎么样做
外科,神经脑外科,脑梗塞患者应注意些什么?,我大伯以前患高血压，但是没留意，长期高强度的工作，突发性脑梗塞，经医院救治，救治后已经出院在家静养，医生建议患者恢复期在家要做康复救治，定希检查。
外科,神经脑外科,致使脑瘫的原因有哪些？,今天去医院看望一个刚刚生产的朋友，她的小宝宝五官长得很好看．但是好象眼神有点呆滞，本来宝宝的出生是高兴的事情，但是我看见朋友的脸上一点笑容也没有，我感觉到了有点不对头，朋友很伤心的说，孩子可能得了脑摊．我们一下全都楞住了，不知道怎么安慰她好． 想得到怎样的帮助：脑瘫是什么原因导致的？
外科,神经脑外科,围产期如何预防工作脑瘫儿,现在脑瘫儿越来越多了，我们也是打算做父母的，特别害怕这种事情降临，在孕前肯定会做好一切检查措施的，可是当怀孕期间，听说也是有这种风险的，特别是我们住在农村，一切都不怎么方便。 想得到怎样的帮助：围产期怎样做才可以预防脑瘫儿产生？
外科,神经脑外科,癫痫病失神发作是什么样的症状,父亲患有癫痫刚诊断出患有癫痫病没多久，发作的症状也不同，听有些患者家属说可能是癫痫小发作，能介绍下是什么样的症状吗
外科,神经脑外科,急性播散性脑脊髓炎怎么办,我妹妹患了急性播散性脑脊髓炎，她9岁，由感冒引来，耽搁2天，病房3天现已住进重症监护室，并报病危，现在微有转好；血压温度正常，有一点意识。
外科,神经脑外科,脑梗塞患者流鼻血说话不灵怎么治疗,我母亲今年7月中旬因多发性脑梗住院半个月，后好转。后来一吃阿司匹林就出鼻血，就停吃了。十天前，一遇冷就不会说话，回到屋里后就好转。今早出鼻血，出血量不大。室外气温2度，在室外呆了50分钟，又不会说话。
外科,神经脑外科,打喷嚏、咳噪就尿失禁怎么办,打喷嚏、咳噪就尿失禁，有一年时间
外科,神经脑外科,老人为什么时不时点头,从去年已经开始时不时摇摇头，想理解几下有什么治疗方法，是怎么致使的 曾经的治疗情况和效果：曾经摔断过两次腿在乎怎样的帮助：想进行咨询几下是什么病
外科,神经脑外科,突发脑梗塞要怎么治疗,我爸爸岁数大了，最近我发现他精神是不太好，而且爱忘记事情，头昏是他自己说的，说有时候走着走着就会有晕眩的感觉，我们家人也是很担心的，请问突发脑梗塞要怎么治疗
外科,神经脑外科,脑瘫是什么原因导致的,我也不知道我自己是什么情况最近这几天经常现在感觉自己好像比别人做什么事情都慢一拍似的去医院里面检查了一下结果检查出是得了脑瘫，
外科,神经脑外科,94岁老人脑外伤性脑积水该怎么办?,老人94岁，由于不愿吃饭，步伐艰难缓慢检查胃肠、肝脏功能后都没有问题;后回家大概2日后跌倒造成脑部受伤缝3针，当时脑ct显示脑部软组织肿胀没有其他问题，老人一直清醒，但行走需搀扶。摔伤后输液3日消炎，到第7日时、一直不愿吃饭，精神状态不佳，再次入院，检查脑ct有脑积水不多也不算少，
外科,神经脑外科,婴幼儿脑积水如何治好？,"我女1岁4月患有脑积水诊断为幕上脑积水轻重度大夫建议先观察（如有其加重阵状）在手术目，前孩子无任何症状，嘴角偶有一两下抽动，智力发育基本正常，有没有其他更好保守治疗方法．
岁4月
详细病情及咨询目的:脑积水治疗方案
本次发病及持续的时间:4月前嘴角偶有抽动
目前一般情况:无任何症状 嘴角偶有抽动
病史:无
以往的诊断和治疗经"
外科,神经脑外科,锁骨骨折钢板多长时间能拆,检查一切良好2009.7月1日，车祸导致锁骨骨折
外科,神经脑外科,脑血管痉挛怎样治疗能缓解吗,张三，女，35，头昏，视物旋转模糊，舌苔厚，腹胀，失眠，长期流泪。
外科,神经脑外科,脑干出血的患者一般多长时间可以苏醒..,8月27晚出现病态10分钟后送医院经ct确定为脑干出血8毫升左右，现在是高度昏迷，下肢无反应，在当地医院进行保守治疗，已经15天，还没有清醒，问有哪些好的治疗方法，多长时间能醒过来，是否会出现植物人
外科,神经脑外科,请问中风吃什么好,"母亲今年60,长年有糖尿病,三高,几年前胆囊摘除,昨天突发小中风,嘴巴歪斜。"
外科,神经脑外科,脑部感觉不得劲怎么办,在市第一医院治疗后出院，刚出院3天。发病时间11月11日。脑有颞叶区出血30毫升，头脑清醒，行动自如。有时会咳嗽，小便尿不出来。
外科,神经脑外科,垂体腺瘤可以怀孕并成功生育吗?,患者女，27岁，2010年4月-8月出现闭经4个月，2010年8月31日经医院核磁共振查出患有0.7cm的垂体腺瘤。
外科,神经脑外科,左臂导致臂丛神经损伤怎么样治疗,天2012年9月28日晚上七点正产了一个8.6斤的巨大儿，头部现出来，左臂不好出来，最后导致左臂锁骨骨折，左臂臂丛神经损伤，当地医院最先开始将其左臂固定，周后用了一些治疗神经的药物
外科,神经脑外科,患有脑中风后遗症怎么办？怎么样治疗脑中风后,患有脑中风后遗症怎么办？怎么样治疗脑中风后遗症？
外科,神经脑外科,脑梗塞恢复期左边胳膊很疼很僵怎么办？,我爸爸53岁，2010年11月开始左边的手脚无力，走路踉跄。第二天去医院，医生说是脑梗塞，面积不大，指甲大小，压的是丘脑，正好影响运动神经，不过医生说我爸爸这个不严重，不会留下什么后遗症。输了或许10天的液就出院了。到现在腿恢复的已经差不多了，走路什么的都没什么大问题，现在就是左边胳膊特别疼，特别僵，他自己也经常活动，我妈妈也有帮他按摩。他生病前就特别喜欢快走，运动量算比较大的。恢复期的时候也坚持
